ts	status	candidate	params	top	train_cagr	train_dd	ret_dd	h1	h2	fwd_cagr	fwd_dd	fwd_bench	note
2026-09-26T08:39:12Z	baseline	strat_l23b_gapdrift	{"b_hi": 0.65, "b_lo": 0.45, "b_mid": 0.55, "floor_lb": 19, "gd_w": 0.0, "lookback": 16, "max_dist": 0.055, "regime_ma": 18}	25	24.125	-18.979	1.271	18.999	29.218	blind	blind	blind	first entry [risk:none select:robust exec:realistic fill=next_open lock=1 min_tv=5e+06 cost=50rt expo=1 minyr=-14.2 ystd=50.0 robust=1.059 rmin=0.000 noise_sd=0.078]
2026-09-26T08:39:21Z	keep	strat_l23b_gapdrift	{"b_hi": 0.65, "b_lo": 0.45, "b_mid": 0.55, "floor_lb": 19, "gd_gap": 0.03, "gd_lb": 2, "gd_vm": 2.0, "gd_w": 0.15, "lookback": 16, "max_dist": 0.055, "regime_ma": 18}	25	25.566	-17.753	1.440	21.563	29.506	blind	blind	blind	beats best on robust by 0.141 > margin 0.098 [risk:none select:robust exec:realistic fill=next_open lock=1 min_tv=5e+06 cost=50rt expo=1 minyr=-13.2 ystd=53.8 robust=1.200 rmin=0.000 noise_sd=0.098]
2026-09-26T08:39:32Z	discard	strat_l23b_gapdrift	{"b_hi": 0.65, "b_lo": 0.45, "b_mid": 0.55, "floor_lb": 19, "gd_gap": 0.03, "gd_lb": 2, "gd_vm": 2.0, "gd_w": 0.3, "lookback": 16, "max_dist": 0.055, "regime_ma": 18}	25	25.725	-16.488	1.560	19.415	32.053	blind	blind	blind	TRAIN 1.172 <= best 1.200 + margin 0.134 [robust] [risk:none select:robust exec:realistic fill=next_open lock=1 min_tv=5e+06 cost=50rt expo=1 minyr=-14.9 ystd=56.3 robust=1.172 rmin=0.000 noise_sd=0.134]
2026-09-26T08:39:44Z	discard	strat_l23b_gapdrift	{"b_hi": 0.65, "b_lo": 0.45, "b_mid": 0.55, "floor_lb": 19, "gd_gap": 0.03, "gd_lb": 1, "gd_vm": 2.0, "gd_w": 0.15, "lookback": 16, "max_dist": 0.055, "regime_ma": 18}	25	24.749	-18.643	1.327	20.450	28.990	blind	blind	blind	TRAIN 1.196 <= best 1.200 + margin 0.107 [robust] [risk:none select:robust exec:realistic fill=next_open lock=1 min_tv=5e+06 cost=50rt expo=1 minyr=-14.9 ystd=54.1 robust=1.196 rmin=0.000 noise_sd=0.107]
2026-09-26T08:39:51Z	discard	strat_l23b_gapdrift	{"b_hi": 0.65, "b_lo": 0.45, "b_mid": 0.55, "floor_lb": 19, "gd_gap": 0.03, "gd_lb": 3, "gd_vm": 2.0, "gd_w": 0.15, "lookback": 16, "max_dist": 0.055, "regime_ma": 18}	25	26.123	-17.545	1.489	20.868	31.346	blind	blind	blind	TRAIN 1.212 <= best 1.200 + margin 0.101 [robust] [risk:none select:robust exec:realistic fill=next_open lock=1 min_tv=5e+06 cost=50rt expo=1 minyr=-12.9 ystd=55.7 robust=1.212 rmin=0.000 noise_sd=0.101]
2026-09-26T08:40:10Z	discard	strat_l23b_gapdrift	{"b_hi": 0.65, "b_lo": 0.45, "b_mid": 0.55, "floor_lb": 19, "gd_gap": 0.03, "gd_held": false, "gd_lb": 3, "gd_vm": 2.0, "gd_w": 0.15, "lookback": 16, "max_dist": 0.055, "regime_ma": 18}	25	24.942	-17.572	1.419	21.040	28.781	blind	blind	blind	TRAIN 1.194 <= best 1.200 + margin 0.092 [robust] [risk:none select:robust exec:realistic fill=next_open lock=1 min_tv=5e+06 cost=50rt expo=1 minyr=-12.6 ystd=47.1 robust=1.194 rmin=0.000 noise_sd=0.092]
2026-09-26T08:40:22Z	discard	strat_l23b_gapdrift	{"b_hi": 0.65, "b_lo": 0.45, "b_mid": 0.55, "floor_lb": 19, "gd_gap": 0.05, "gd_lb": 3, "gd_vm": 3.0, "gd_w": 0.15, "lookback": 16, "max_dist": 0.055, "regime_ma": 18}	25	25.352	-18.610	1.362	20.032	30.645	blind	blind	blind	TRAIN 1.122 <= best 1.200 + margin 0.073 [robust] [risk:none select:robust exec:realistic fill=next_open lock=1 min_tv=5e+06 cost=50rt expo=1 minyr=-13.6 ystd=53.0 robust=1.122 rmin=0.000 noise_sd=0.073]
2026-09-26T08:40:27Z	discard	strat_l23b_gapdrift	{"b_hi": 0.65, "b_lo": 0.45, "b_mid": 0.55, "floor_lb": 19, "gd_gap": 0.03, "gd_lb": 4, "gd_vm": 2.0, "gd_w": 0.15, "lookback": 16, "max_dist": 0.055, "regime_ma": 18}	25	24.769	-17.484	1.417	20.223	29.264	blind	blind	blind	TRAIN 1.169 <= best 1.200 + margin 0.098 [robust] [risk:none select:robust exec:realistic fill=next_open lock=1 min_tv=5e+06 cost=50rt expo=1 minyr=-13.8 ystd=50.7 robust=1.169 rmin=0.000 noise_sd=0.098]
2026-09-26T08:40:54Z	discard	strat_l23b_ddquality	{"b_hi": 0.65, "b_lo": 0.45, "b_mid": 0.55, "dq_lb": 6, "dq_w": 0.15, "floor_lb": 19, "lookback": 16, "max_dist": 0.055, "regime_ma": 18}	25	21.621	-21.090	1.025	14.373	28.959	blind	blind	blind	TRAIN 0.729 <= best 1.200 + margin 0.079 [robust] [risk:none select:robust exec:realistic fill=next_open lock=1 min_tv=5e+06 cost=50rt expo=1 minyr=-18.3 ystd=52.3 robust=0.729 rmin=0.000 noise_sd=0.079]
2026-09-26T08:41:03Z	discard	strat_l23b_ddquality	{"b_hi": 0.65, "b_lo": 0.45, "b_mid": 0.55, "dq_w": 0.0, "floor_lb": 19, "lookback": 16, "max_dist": 0.055, "regime_ma": 18}	25	24.125	-18.979	1.271	18.999	29.218	blind	blind	blind	TRAIN 1.059 <= best 1.200 + margin 0.078 [robust] [risk:none select:robust exec:realistic fill=next_open lock=1 min_tv=5e+06 cost=50rt expo=1 minyr=-14.2 ystd=50.0 robust=1.059 rmin=0.000 noise_sd=0.078]
2026-09-26T08:41:09Z	discard	strat_l23b_ddquality	{"b_hi": 0.65, "b_lo": 0.45, "b_mid": 0.55, "dq_lb": 6, "dq_w": -0.15, "floor_lb": 19, "lookback": 16, "max_dist": 0.055, "regime_ma": 18}	25	26.910	-16.525	1.628	21.798	31.984	blind	blind	blind	TRAIN 1.324 <= best 1.200 + margin 0.146 [robust] [risk:none select:robust exec:realistic fill=next_open lock=1 min_tv=5e+06 cost=50rt expo=1 minyr=-14.4 ystd=55.3 robust=1.324 rmin=0.000 noise_sd=0.146]
2026-09-26T08:41:21Z	discard	strat_l23b_ddquality	{"b_hi": 0.65, "b_lo": 0.45, "b_mid": 0.55, "dq_lb": 12, "dq_w": -0.15, "floor_lb": 19, "lookback": 16, "max_dist": 0.055, "regime_ma": 18}	25	26.976	-17.403	1.550	22.767	31.124	blind	blind	blind	TRAIN 1.343 <= best 1.200 + margin 0.155 [robust] [risk:none select:robust exec:realistic fill=next_open lock=1 min_tv=5e+06 cost=50rt expo=1 minyr=-13.8 ystd=53.6 robust=1.343 rmin=0.000 noise_sd=0.155]
2026-09-26T08:41:25Z	keep	strat_l23b_ddquality	{"b_hi": 0.65, "b_lo": 0.45, "b_mid": 0.55, "dq_lb": 4, "dq_w": -0.15, "floor_lb": 19, "lookback": 16, "max_dist": 0.055, "regime_ma": 18}	25	27.286	-16.398	1.664	25.341	29.168	blind	blind	blind	beats best on robust by 0.313 > margin 0.173 [risk:none select:robust exec:realistic fill=next_open lock=1 min_tv=5e+06 cost=50rt expo=1 minyr=-13.4 ystd=53.2 robust=1.513 rmin=0.000 noise_sd=0.173]
2026-09-26T08:41:29Z	discard	strat_l23b_ddquality	{"b_hi": 0.65, "b_lo": 0.45, "b_mid": 0.55, "dq_lb": 8, "dq_w": -0.15, "floor_lb": 19, "lookback": 16, "max_dist": 0.055, "regime_ma": 18}	25	28.560	-16.424	1.739	23.430	33.651	blind	blind	blind	TRAIN 1.427 <= best 1.513 + margin 0.153 [robust] [risk:none select:robust exec:realistic fill=next_open lock=1 min_tv=5e+06 cost=50rt expo=1 minyr=-14.2 ystd=57.3 robust=1.427 rmin=0.000 noise_sd=0.153]
2026-09-26T08:41:41Z	discard	strat_l23b_ddquality	{"b_hi": 0.65, "b_lo": 0.45, "b_mid": 0.55, "dq_lb": 6, "dq_w": -0.3, "floor_lb": 19, "lookback": 16, "max_dist": 0.055, "regime_ma": 18}	25	25.375	-17.435	1.455	21.201	29.488	blind	blind	blind	TRAIN 1.204 <= best 1.513 + margin 0.123 [robust] [risk:none select:robust exec:realistic fill=next_open lock=1 min_tv=5e+06 cost=50rt expo=1 minyr=-15.3 ystd=52.2 robust=1.204 rmin=0.000 noise_sd=0.123]
2026-09-26T08:41:46Z	discard	strat_l23b_ddquality	{"b_hi": 0.65, "b_lo": 0.45, "b_mid": 0.55, "dq_lb": 6, "dq_w": -0.1, "floor_lb": 19, "lookback": 16, "max_dist": 0.055, "regime_ma": 18}	25	26.237	-16.540	1.586	20.564	31.896	blind	blind	blind	TRAIN 1.222 <= best 1.513 + margin 0.146 [robust] [risk:none select:robust exec:realistic fill=next_open lock=1 min_tv=5e+06 cost=50rt expo=1 minyr=-14.6 ystd=53.5 robust=1.222 rmin=0.000 noise_sd=0.146]
2026-09-26T08:41:51Z	discard	strat_l23b_ddquality	{"b_hi": 0.65, "b_lo": 0.45, "b_mid": 0.55, "dq_lb": 3, "dq_w": -0.15, "floor_lb": 19, "lookback": 16, "max_dist": 0.055, "regime_ma": 18}	25	26.579	-16.540	1.607	24.883	28.217	blind	blind	blind	TRAIN 1.559 <= best 1.513 + margin 0.163 [robust] [risk:none select:robust exec:realistic fill=next_open lock=1 min_tv=5e+06 cost=50rt expo=1 minyr=-13.2 ystd=51.1 robust=1.559 rmin=0.000 noise_sd=0.163]
2026-09-26T08:42:16Z	discard	strat_l23b_driftdq	{"b_hi": 0.65, "b_lo": 0.45, "b_mid": 0.55, "dq_lb": 4, "dq_w": -0.15, "floor_lb": 19, "gd_gap": 0.03, "gd_lb": 2, "gd_vm": 2.0, "gd_w": 0.15, "lookback": 16, "max_dist": 0.055, "regime_ma": 18}	25	24.881	-15.898	1.565	21.996	27.696	blind	blind	blind	TRAIN 1.352 <= best 1.513 + margin 0.128 [robust] [risk:none select:robust exec:realistic fill=next_open lock=1 min_tv=5e+06 cost=50rt expo=1 minyr=-12.5 ystd=44.0 robust=1.352 rmin=0.000 noise_sd=0.128]
2026-09-26T08:42:25Z	discard	strat_l23b_driftdq	{"b_hi": 0.65, "b_lo": 0.45, "b_mid": 0.55, "dq_w": 0.0, "floor_lb": 19, "gd_w": 0.0, "lookback": 16, "max_dist": 0.055, "regime_ma": 18}	25	24.125	-18.979	1.271	18.999	29.218	blind	blind	blind	TRAIN 1.059 <= best 1.513 + margin 0.078 [robust] [risk:none select:robust exec:realistic fill=next_open lock=1 min_tv=5e+06 cost=50rt expo=1 minyr=-14.2 ystd=50.0 robust=1.059 rmin=0.000 noise_sd=0.078]
2026-09-26T08:42:36Z	discard	strat_l23b_driftdq	{"b_hi": 0.65, "b_lo": 0.45, "b_mid": 0.55, "dq_lb": 6, "dq_w": -0.15, "floor_lb": 19, "gd_gap": 0.03, "gd_lb": 3, "gd_vm": 2.0, "gd_w": 0.15, "lookback": 16, "max_dist": 0.055, "regime_ma": 18}	25	25.594	-16.030	1.597	20.752	30.392	blind	blind	blind	TRAIN 1.279 <= best 1.513 + margin 0.108 [robust] [risk:none select:robust exec:realistic fill=next_open lock=1 min_tv=5e+06 cost=50rt expo=1 minyr=-13.0 ystd=50.2 robust=1.279 rmin=0.000 noise_sd=0.108]
2026-09-26T08:43:18Z	discard	strat_l23b_ddquality	{"b_hi": 0.65, "b_lo": 0.45, "b_mid": 0.55, "dq_lb": 4, "dq_w": -0.2, "floor_lb": 19, "lookback": 16, "max_dist": 0.055, "regime_ma": 18}	25	27.179	-16.398	1.657	23.960	30.326	blind	blind	blind	TRAIN 1.464 <= best 1.513 + margin 0.175 [robust] [risk:none select:robust exec:realistic fill=next_open lock=1 min_tv=5e+06 cost=50rt expo=1 minyr=-14.4 ystd=52.3 robust=1.464 rmin=0.000 noise_sd=0.175]
2026-09-26T08:43:21Z	discard	strat_l23b_ddquality	{"b_hi": 0.65, "b_lo": 0.45, "b_mid": 0.55, "dq_lb": 2, "dq_w": -0.15, "floor_lb": 19, "lookback": 16, "max_dist": 0.055, "regime_ma": 18}	25	26.949	-16.034	1.681	24.538	29.291	blind	blind	blind	TRAIN 1.556 <= best 1.513 + margin 0.147 [robust] [risk:none select:robust exec:realistic fill=next_open lock=1 min_tv=5e+06 cost=50rt expo=1 minyr=-13.2 ystd=51.5 robust=1.556 rmin=0.000 noise_sd=0.147]
2026-09-26T08:43:25Z	discard	strat_l23b_ddquality	{"b_hi": 0.65, "b_lo": 0.45, "b_mid": 0.55, "dq_lb": 4, "dq_w": -0.1, "floor_lb": 19, "lookback": 16, "max_dist": 0.055, "regime_ma": 18}	25	26.388	-16.382	1.611	21.437	31.296	blind	blind	blind	TRAIN 1.281 <= best 1.513 + margin 0.149 [robust] [risk:none select:robust exec:realistic fill=next_open lock=1 min_tv=5e+06 cost=50rt expo=1 minyr=-14.3 ystd=52.9 robust=1.281 rmin=0.000 noise_sd=0.149]
2026-09-26T08:43:40Z	discard	strat_l23b_gapdrift	{"b_hi": 0.65, "b_lo": 0.45, "b_mid": 0.55, "floor_lb": 19, "gd_gap": 0.02, "gd_lb": 3, "gd_vm": 2.0, "gd_w": 0.1, "lookback": 16, "max_dist": 0.055, "regime_ma": 18}	25	23.819	-17.631	1.351	18.639	28.969	blind	blind	blind	TRAIN 1.062 <= best 1.513 + margin 0.094 [robust] [risk:none select:robust exec:realistic fill=next_open lock=1 min_tv=5e+06 cost=50rt expo=1 minyr=-12.2 ystd=45.5 robust=1.062 rmin=0.000 noise_sd=0.094]
2026-09-26T08:43:44Z	discard	strat_l23b_ddquality	{"b_hi": 0.65, "b_lo": 0.45, "b_mid": 0.55, "dq_lb": 1, "dq_w": -0.15, "floor_lb": 19, "lookback": 16, "max_dist": 0.055, "regime_ma": 18}	25	25.792	-16.452	1.568	22.520	28.994	blind	blind	blind	TRAIN 1.351 <= best 1.513 + margin 0.141 [robust] [risk:none select:robust exec:realistic fill=next_open lock=1 min_tv=5e+06 cost=50rt expo=1 minyr=-13.1 ystd=51.7 robust=1.351 rmin=0.000 noise_sd=0.141]
2026-09-26T08:44:10Z	discard	strat_l23b_trmom	{"b_hi": 0.65, "b_lo": 0.45, "b_mid": 0.55, "floor_lb": 19, "lookback": 16, "max_dist": 0.055, "regime_ma": 18, "tr_lb": 6, "tr_w": 0.15}	25	22.002	-19.511	1.128	14.719	29.376	blind	blind	blind	TRAIN 0.784 <= best 1.513 + margin 0.085 [robust] [risk:none select:robust exec:realistic fill=next_open lock=1 min_tv=5e+06 cost=50rt expo=1 minyr=-18.7 ystd=49.4 robust=0.784 rmin=0.000 noise_sd=0.085]
2026-09-26T08:44:22Z	discard	strat_l23b_trmom	{"b_hi": 0.65, "b_lo": 0.45, "b_mid": 0.55, "floor_lb": 19, "lookback": 16, "max_dist": 0.055, "regime_ma": 18, "tr_lb": 6, "tr_w": -0.15}	25	27.088	-18.123	1.495	24.203	29.901	blind	blind	blind	TRAIN 1.353 <= best 1.513 + margin 0.142 [robust] [risk:none select:robust exec:realistic fill=next_open lock=1 min_tv=5e+06 cost=50rt expo=1 minyr=-12.8 ystd=56.4 robust=1.353 rmin=0.000 noise_sd=0.142]
2026-09-26T08:44:28Z	discard	strat_l23b_trmom	{"b_hi": 0.65, "b_lo": 0.45, "b_mid": 0.55, "floor_lb": 19, "lookback": 16, "max_dist": 0.055, "regime_ma": 18, "tr_lb": 12, "tr_w": 0.15}	25	23.194	-18.666	1.243	17.393	28.992	blind	blind	blind	TRAIN 0.932 <= best 1.513 + margin 0.070 [robust] [risk:none select:robust exec:realistic fill=next_open lock=1 min_tv=5e+06 cost=50rt expo=1 minyr=-15.8 ystd=50.6 robust=0.932 rmin=0.000 noise_sd=0.070]
2026-09-26T08:44:30Z	discard	strat_l23b_trmom	{"b_hi": 0.65, "b_lo": 0.45, "b_mid": 0.55, "floor_lb": 19, "lookback": 16, "max_dist": 0.055, "regime_ma": 18, "tr_w": 0.0}	25	24.125	-18.979	1.271	18.999	29.218	blind	blind	blind	TRAIN 1.059 <= best 1.513 + margin 0.078 [robust] [risk:none select:robust exec:realistic fill=next_open lock=1 min_tv=5e+06 cost=50rt expo=1 minyr=-14.2 ystd=50.0 robust=1.059 rmin=0.000 noise_sd=0.078]
2026-09-26T08:44:43Z	discard	strat_l23b_trmom	{"b_hi": 0.65, "b_lo": 0.45, "b_mid": 0.55, "floor_lb": 19, "lookback": 16, "max_dist": 0.055, "regime_ma": 18, "tr_lb": 12, "tr_w": -0.15}	25	25.557	-18.248	1.401	19.526	31.590	blind	blind	blind	TRAIN 1.148 <= best 1.513 + margin 0.086 [robust] [risk:none select:robust exec:realistic fill=next_open lock=1 min_tv=5e+06 cost=50rt expo=1 minyr=-14.1 ystd=53.0 robust=1.148 rmin=0.000 noise_sd=0.086]
2026-09-26T08:44:49Z	discard	strat_l23b_trmom	{"b_hi": 0.65, "b_lo": 0.45, "b_mid": 0.55, "floor_lb": 19, "lookback": 16, "max_dist": 0.055, "regime_ma": 18, "tr_lb": 3, "tr_w": -0.15}	25	24.321	-19.346	1.257	22.947	25.645	blind	blind	blind	TRAIN 1.274 <= best 1.513 + margin 0.101 [robust] [risk:none select:robust exec:realistic fill=next_open lock=1 min_tv=5e+06 cost=50rt expo=1 minyr=-16.2 ystd=49.6 robust=1.274 rmin=0.000 noise_sd=0.101]
2026-09-26T08:45:03Z	discard	strat_l23b_ddquality	{"b_hi": 0.65, "b_lo": 0.45, "b_mid": 0.55, "dq_lb": 4, "dq_placebo": 1, "dq_w": -0.15, "floor_lb": 19, "lookback": 16, "max_dist": 0.055, "regime_ma": 18}	25	26.253	-18.855	1.392	19.114	33.458	blind	blind	blind	TRAIN 1.072 <= best 1.513 + margin 0.097 [robust] [risk:none select:robust exec:realistic fill=next_open lock=1 min_tv=5e+06 cost=50rt expo=1 minyr=-18.0 ystd=57.0 robust=1.072 rmin=0.000 noise_sd=0.097]
2026-09-26T08:45:15Z	discard	strat_l23b_ddquality	{"b_hi": 0.65, "b_lo": 0.45, "b_mid": 0.55, "dq_lb": 4, "dq_placebo": 2, "dq_w": -0.15, "floor_lb": 19, "lookback": 16, "max_dist": 0.055, "regime_ma": 18}	25	24.277	-18.605	1.305	17.407	31.201	blind	blind	blind	TRAIN 0.979 <= best 1.513 + margin 0.119 [robust] [risk:none select:robust exec:realistic fill=next_open lock=1 min_tv=5e+06 cost=50rt expo=1 minyr=-17.7 ystd=54.4 robust=0.979 rmin=0.000 noise_sd=0.119]
2026-09-26T08:45:19Z	discard	strat_l23b_ddquality	{"b_hi": 0.65, "b_lo": 0.45, "b_mid": 0.55, "dq_lb": 4, "dq_placebo": 3, "dq_w": -0.15, "floor_lb": 19, "lookback": 16, "max_dist": 0.055, "regime_ma": 18}	25	24.497	-19.470	1.258	22.234	26.693	blind	blind	blind	TRAIN 1.219 <= best 1.513 + margin 0.113 [robust] [risk:none select:robust exec:realistic fill=next_open lock=1 min_tv=5e+06 cost=50rt expo=1 minyr=-16.5 ystd=48.7 robust=1.219 rmin=0.000 noise_sd=0.113]
2026-09-26T08:45:24Z	discard	strat_l23b_ddquality	{"b_hi": 0.65, "b_lo": 0.45, "b_mid": 0.55, "dq_lb": 4, "dq_placebo": 4, "dq_w": -0.15, "floor_lb": 19, "lookback": 16, "max_dist": 0.055, "regime_ma": 18}	25	24.803	-18.990	1.306	19.495	30.084	blind	blind	blind	TRAIN 1.069 <= best 1.513 + margin 0.081 [robust] [risk:none select:robust exec:realistic fill=next_open lock=1 min_tv=5e+06 cost=50rt expo=1 minyr=-14.5 ystd=50.3 robust=1.069 rmin=0.000 noise_sd=0.081]
2026-09-26T08:45:39Z	discard	strat_l23b_gapdrift	{"b_hi": 0.65, "b_lo": 0.45, "b_mid": 0.55, "floor_lb": 19, "gd_gap": 0.03, "gd_lb": 2, "gd_placebo": 1, "gd_vm": 2.0, "gd_w": 0.15, "lookback": 16, "max_dist": 0.055, "regime_ma": 18}	25	22.535	-19.079	1.181	17.731	27.298	blind	blind	blind	TRAIN 0.967 <= best 1.513 + margin 0.089 [robust] [risk:none select:robust exec:realistic fill=next_open lock=1 min_tv=5e+06 cost=50rt expo=1 minyr=-15.0 ystd=50.0 robust=0.967 rmin=0.000 noise_sd=0.089]
2026-09-26T08:45:51Z	discard	strat_l23b_gapdrift	{"b_hi": 0.65, "b_lo": 0.45, "b_mid": 0.55, "floor_lb": 19, "gd_gap": 0.03, "gd_lb": 2, "gd_placebo": 2, "gd_vm": 2.0, "gd_w": 0.15, "lookback": 16, "max_dist": 0.055, "regime_ma": 18}	25	23.692	-19.764	1.199	21.106	26.210	blind	blind	blind	TRAIN 1.116 <= best 1.513 + margin 0.087 [robust] [risk:none select:robust exec:realistic fill=next_open lock=1 min_tv=5e+06 cost=50rt expo=1 minyr=-14.5 ystd=45.6 robust=1.116 rmin=0.000 noise_sd=0.087]
2026-09-26T08:45:57Z	discard	strat_l23b_gapdrift	{"b_hi": 0.65, "b_lo": 0.45, "b_mid": 0.55, "floor_lb": 19, "gd_gap": 0.03, "gd_lb": 2, "gd_placebo": 3, "gd_vm": 2.0, "gd_w": 0.15, "lookback": 16, "max_dist": 0.055, "regime_ma": 18}	25	24.014	-18.209	1.319	19.900	28.067	blind	blind	blind	TRAIN 1.119 <= best 1.513 + margin 0.090 [robust] [risk:none select:robust exec:realistic fill=next_open lock=1 min_tv=5e+06 cost=50rt expo=1 minyr=-14.2 ystd=46.4 robust=1.119 rmin=0.000 noise_sd=0.090]
2026-09-26T08:46:11Z	discard	strat_l23b_trmom	{"b_hi": 0.65, "b_lo": 0.45, "b_mid": 0.55, "floor_lb": 19, "lookback": 16, "max_dist": 0.055, "regime_ma": 18, "tr_lb": 6, "tr_price_only": true, "tr_w": -0.15}	25	26.754	-17.965	1.489	24.021	29.415	blind	blind	blind	TRAIN 1.346 <= best 1.513 + margin 0.135 [robust] [risk:none select:robust exec:realistic fill=next_open lock=1 min_tv=5e+06 cost=50rt expo=1 minyr=-12.8 ystd=55.8 robust=1.346 rmin=0.000 noise_sd=0.135]
2026-09-26T08:46:22Z	discard	strat_l23b_ddquality	{"b_hi": 0.65, "b_lo": 0.45, "b_mid": 0.55, "dq_lb": 5, "dq_w": -0.15, "floor_lb": 19, "lookback": 16, "max_dist": 0.055, "regime_ma": 18}	25	26.821	-16.398	1.636	22.365	31.221	blind	blind	blind	TRAIN 1.390 <= best 1.513 + margin 0.169 [robust] [risk:none select:robust exec:realistic fill=next_open lock=1 min_tv=5e+06 cost=50rt expo=1 minyr=-14.2 ystd=53.9 robust=1.390 rmin=0.000 noise_sd=0.169]
2026-09-26T08:46:27Z	discard	strat_l23b_ddquality	{"b_hi": 0.65, "b_lo": 0.45, "b_mid": 0.55, "dq_lb": 3, "dq_w": -0.2, "floor_lb": 19, "lookback": 16, "max_dist": 0.055, "regime_ma": 18}	25	25.909	-16.413	1.579	23.592	28.159	blind	blind	blind	TRAIN 1.449 <= best 1.513 + margin 0.149 [robust] [risk:none select:robust exec:realistic fill=next_open lock=1 min_tv=5e+06 cost=50rt expo=1 minyr=-14.2 ystd=48.5 robust=1.449 rmin=0.000 noise_sd=0.149]
