ts	status	candidate	params	top	train_cagr	train_dd	ret_dd	h1	h2	fwd_cagr	fwd_dd	fwd_bench	note
2026-09-26T09:22:46Z	baseline	strat_floorhighfresh	{"b_hi": 0.65, "b_lo": 0.45, "b_mid": 0.55, "floor_lb": 19, "lookback": 16, "max_dist": 0.055, "regime_ma": 18}	25	24.125	-18.979	1.271	18.999	29.218	blind	blind	blind	first entry [risk:none select:robust exec:realistic fill=next_open lock=1 min_tv=5e+06 cost=50rt expo=1 minyr=-14.2 ystd=50.0 robust=1.059 rmin=0.000 noise_sd=0.078]
2026-09-26T09:22:49Z	keep	strat_floorhighfresh	{"b_hi": 0.65, "b_lo": 0.45, "b_mid": 0.55, "floor_lb": 19, "lookback": 16, "max_dist": 0.055, "regime_ma": 18, "top": 15}	15	27.022	-18.768	1.440	25.428	28.560	blind	blind	blind	beats best on robust by 0.339 > margin 0.170 [risk:top=15 select:robust exec:realistic fill=next_open lock=1 min_tv=5e+06 cost=50rt expo=1 minyr=-9.4 ystd=47.5 robust=1.397 rmin=0.000 noise_sd=0.170]
2026-09-26T09:22:51Z	discard	strat_floorhighfresh	{"b_hi": 0.65, "b_lo": 0.45, "b_mid": 0.55, "floor_lb": 19, "lookback": 16, "max_dist": 0.055, "regime_ma": 18, "top": 12}	12	26.943	-19.671	1.370	25.027	28.798	blind	blind	blind	TRAIN 1.406 <= best 1.397 + margin 0.127 [robust] [risk:top=12 select:robust exec:realistic fill=next_open lock=1 min_tv=5e+06 cost=50rt expo=1 minyr=-15.2 ystd=53.6 robust=1.406 rmin=0.000 noise_sd=0.127]
2026-09-26T09:22:53Z	discard	strat_floorhighfresh	{"b_hi": 0.65, "b_lo": 0.45, "b_mid": 0.55, "floor_lb": 19, "lookback": 16, "max_dist": 0.055, "regime_ma": 18, "top": 18}	18	26.543	-18.513	1.434	23.190	29.825	blind	blind	blind	TRAIN 1.341 <= best 1.397 + margin 0.140 [robust] [risk:top=18 select:robust exec:realistic fill=next_open lock=1 min_tv=5e+06 cost=50rt expo=1 minyr=-10.7 ystd=50.3 robust=1.341 rmin=0.000 noise_sd=0.140]
2026-09-26T09:22:56Z	discard	strat_floorhighfresh	{"b_hi": 0.65, "b_lo": 0.45, "b_mid": 0.55, "floor_lb": 19, "lookback": 16, "max_dist": 0.055, "regime_ma": 18, "top": 15, "weighting": "rank"}	15	25.298	-21.336	1.186	23.659	26.881	blind	blind	blind	TRAIN 1.234 <= best 1.397 + margin 0.117 [robust] [risk:top=15 weighting=rank select:robust exec:realistic fill=next_open lock=1 min_tv=5e+06 cost=50rt expo=1 minyr=-14.6 ystd=47.6 robust=1.234 rmin=0.000 noise_sd=0.117]
2026-09-26T09:23:01Z	keep	strat_floorhighfresh	{"b_hi": 0.65, "b_lo": 0.45, "b_mid": 0.55, "floor_lb": 19, "lookback": 16, "max_dist": 0.055, "regime_ma": 18, "top": 15, "weighting": "invvol"}	15	30.001	-17.857	1.680	28.617	31.334	blind	blind	blind	beats best on robust by 0.225 > margin 0.177 [risk:top=15 weighting=invvol select:robust exec:realistic fill=next_open lock=1 min_tv=5e+06 cost=50rt expo=1 minyr=-9.2 ystd=54.7 robust=1.623 rmin=0.000 noise_sd=0.177]
2026-09-26T09:23:07Z	discard	strat_floorhighfresh	{"b_hi": 0.65, "b_lo": 0.45, "b_mid": 0.55, "floor_lb": 19, "lookback": 16, "max_dist": 0.055, "regime_ma": 18, "top": 25, "weighting": "invvol"}	25	26.023	-17.715	1.469	20.459	31.568	blind	blind	blind	TRAIN 1.141 <= best 1.623 + margin 0.075 [robust] [risk:top=25 weighting=invvol select:robust exec:realistic fill=next_open lock=1 min_tv=5e+06 cost=50rt expo=1 minyr=-13.4 ystd=55.6 robust=1.141 rmin=0.000 noise_sd=0.075]
2026-09-26T09:23:09Z	discard	strat_floorhighfresh	{"b_hi": 0.65, "b_lo": 0.45, "b_mid": 0.55, "floor_lb": 19, "lookback": 16, "max_dist": 0.055, "min_hold": 2, "regime_ma": 18, "top": 15}	15	22.241	-17.991	1.236	19.112	25.302	blind	blind	blind	TRAIN 1.107 <= best 1.623 + margin 0.171 [robust] [risk:top=15 min_hold=2 select:robust exec:realistic fill=next_open lock=1 min_tv=5e+06 cost=50rt expo=1 minyr=-12.3 ystd=38.4 robust=1.107 rmin=0.000 noise_sd=0.171]
2026-09-26T09:23:15Z	discard	strat_floorhighfresh	{"b_hi": 0.65, "b_lo": 0.45, "b_mid": 0.55, "floor_lb": 19, "lookback": 16, "max_dist": 0.055, "regime_ma": 18, "sl_pct": 0.25, "top": 15}	15	24.528	-21.710	1.130	20.695	28.296	blind	blind	blind	TRAIN 0.944 <= best 1.623 + margin 0.166 [robust] [risk:top=15 sl_pct=0.25 select:robust exec:realistic fill=next_open lock=1 min_tv=5e+06 cost=50rt expo=1 minyr=-16.8 ystd=47.7 robust=0.944 rmin=0.000 noise_sd=0.166]
2026-09-26T09:23:20Z	discard	strat_floorhighfresh	{"b_hi": 0.65, "b_lo": 0.45, "b_mid": 0.55, "floor_lb": 19, "lookback": 16, "max_dist": 0.055, "regime_ma": 18, "sl_pct": 0.35, "top": 15}	15	25.477	-20.606	1.236	22.330	28.552	blind	blind	blind	TRAIN 1.097 <= best 1.623 + margin 0.177 [robust] [risk:top=15 sl_pct=0.35 select:robust exec:realistic fill=next_open lock=1 min_tv=5e+06 cost=50rt expo=1 minyr=-14.3 ystd=47.9 robust=1.097 rmin=0.000 noise_sd=0.177]
2026-09-26T09:23:26Z	discard	strat_floorhighfresh	{"b_hi": 0.65, "b_lo": 0.45, "b_mid": 0.55, "floor_lb": 19, "lookback": 16, "max_dist": 0.055, "regime_ma": 18, "top": 15, "ts_pct": 0.35}	15	24.752	-20.286	1.220	21.407	28.027	blind	blind	blind	TRAIN 1.057 <= best 1.623 + margin 0.163 [robust] [risk:top=15 ts_pct=0.35 select:robust exec:realistic fill=next_open lock=1 min_tv=5e+06 cost=50rt expo=1 minyr=-13.3 ystd=47.8 robust=1.057 rmin=0.000 noise_sd=0.163]
2026-09-26T09:23:28Z	discard	strat_floorhighfresh	{"b_hi": 0.65, "b_lo": 0.45, "b_mid": 0.55, "floor_lb": 19, "lookback": 16, "max_dist": 0.055, "max_hold": 6, "regime_ma": 18, "top": 15}	15	26.972	-18.768	1.437	25.634	28.261	blind	blind	blind	TRAIN 1.409 <= best 1.623 + margin 0.183 [robust] [risk:max_hold=6 top=15 select:robust exec:realistic fill=next_open lock=1 min_tv=5e+06 cost=50rt expo=1 minyr=-9.0 ystd=46.7 robust=1.409 rmin=0.000 noise_sd=0.183]
2026-09-26T09:23:49Z	discard	strat_floorhighfresh	{"b_hi": 0.65, "b_lo": 0.45, "b_mid": 0.55, "floor_lb": 19, "lookback": 16, "max_dist": 0.055, "regime_ma": 18, "top": 12, "weighting": "invvol"}	12	30.153	-17.367	1.736	30.050	30.251	blind	blind	blind	TRAIN 1.705 <= best 1.623 + margin 0.147 [robust] [risk:top=12 weighting=invvol select:robust exec:realistic fill=next_open lock=1 min_tv=5e+06 cost=50rt expo=1 minyr=-9.3 ystd=58.0 robust=1.705 rmin=0.000 noise_sd=0.147]
2026-09-26T09:23:55Z	discard	strat_floorhighfresh	{"b_hi": 0.65, "b_lo": 0.45, "b_mid": 0.55, "floor_lb": 19, "lookback": 16, "max_dist": 0.055, "regime_ma": 18, "top": 18, "weighting": "invvol"}	18	29.624	-16.957	1.747	25.782	33.397	blind	blind	blind	TRAIN 1.503 <= best 1.623 + margin 0.143 [robust] [risk:top=18 weighting=invvol select:robust exec:realistic fill=next_open lock=1 min_tv=5e+06 cost=50rt expo=1 minyr=-9.6 ystd=58.9 robust=1.503 rmin=0.000 noise_sd=0.143]
2026-09-26T09:24:00Z	discard	strat_floorhighfresh	{"b_hi": 0.65, "b_lo": 0.45, "b_mid": 0.55, "floor_lb": 19, "lookback": 16, "max_dist": 0.055, "regime_ma": 18, "top": 20, "weighting": "invvol"}	20	28.906	-16.988	1.702	24.345	33.411	blind	blind	blind	TRAIN 1.414 <= best 1.623 + margin 0.112 [robust] [risk:top=20 weighting=invvol select:robust exec:realistic fill=next_open lock=1 min_tv=5e+06 cost=50rt expo=1 minyr=-11.3 ystd=58.7 robust=1.414 rmin=0.000 noise_sd=0.112]
2026-09-26T09:24:05Z	discard	strat_floorhighfresh	{"b_hi": 0.65, "b_lo": 0.45, "b_mid": 0.55, "floor_lb": 19, "lookback": 16, "max_dist": 0.055, "max_weight": 0.12, "regime_ma": 18, "top": 15, "weighting": "invvol"}	15	29.538	-18.070	1.635	28.598	30.441	blind	blind	blind	TRAIN 1.583 <= best 1.623 + margin 0.175 [robust] [risk:top=15 weighting=invvol max_weight=0.12 select:robust exec:realistic fill=next_open lock=1 min_tv=5e+06 cost=50rt expo=1 minyr=-9.2 ystd=53.2 robust=1.583 rmin=0.000 noise_sd=0.175]
2026-09-26T09:24:11Z	discard	strat_floorhighfresh	{"b_hi": 0.65, "b_lo": 0.45, "b_mid": 0.55, "floor_lb": 19, "lookback": 16, "max_dist": 0.055, "max_weight": 0.09, "regime_ma": 18, "top": 15, "weighting": "invvol"}	15	28.819	-18.398	1.566	28.031	29.574	blind	blind	blind	TRAIN 1.503 <= best 1.623 + margin 0.167 [robust] [risk:top=15 weighting=invvol max_weight=0.09 select:robust exec:realistic fill=next_open lock=1 min_tv=5e+06 cost=50rt expo=1 minyr=-9.1 ystd=52.0 robust=1.503 rmin=0.000 noise_sd=0.167]
2026-09-26T09:24:19Z	keep	strat_l23a_liqconfirm	{"b_hi": 0.65, "b_lo": 0.45, "b_mid": 0.55, "floor_lb": 19, "lookback": 16, "lq_days": 40, "lq_min": 5000000.0, "lq_mode": "strict", "lq_shift": 0.05, "lq_shift_hi": 0.05, "lq_shift_lo": 0.075, "max_dist": 0.055, "regime_ma": 18, "top": 15, "weighting": "invvol"}	15	34.598	-17.857	1.938	38.108	31.334	blind	blind	blind	beats best on robust by 1.610 > margin 0.270 [risk:top=15 weighting=invvol select:robust exec:realistic fill=next_open lock=1 min_tv=5e+06 cost=50rt expo=1 minyr=-12.7 ystd=55.9 robust=3.232 rmin=0.000 noise_sd=0.270]
2026-09-26T09:24:24Z	discard	strat_l23a_liqconfirm	{"b_hi": 0.65, "b_lo": 0.45, "b_mid": 0.55, "floor_lb": 19, "lookback": 16, "lq_days": 40, "lq_min": 5000000.0, "lq_mode": "strict", "lq_shift": 0.05, "lq_shift_hi": 0.05, "lq_shift_lo": 0.075, "max_dist": 0.055, "regime_ma": 18, "top": 15}	15	31.791	-16.479	1.929	35.267	28.560	blind	blind	blind	TRAIN 2.718 <= best 3.232 + margin 0.199 [robust] [risk:top=15 select:robust exec:realistic fill=next_open lock=1 min_tv=5e+06 cost=50rt expo=1 minyr=-12.9 ystd=48.8 robust=2.718 rmin=0.000 noise_sd=0.199]
2026-09-26T09:24:31Z	discard	strat_l23o_liqramp	{"b_hi": 0.65, "b_lo": 0.45, "b_mid": 0.55, "floor_lb": 19, "lookback": 16, "lq_days": 40, "lq_min": 5000000.0, "max_dist": 0.055, "regime_ma": 18, "rp_hi": 0.7, "rp_lo": 0.5, "rp_on": 1, "top": 15, "weighting": "invvol"}	15	31.841	-17.936	1.775	34.293	29.545	blind	blind	blind	TRAIN 2.894 <= best 3.232 + margin 0.233 [robust] [risk:top=15 weighting=invvol select:robust exec:realistic fill=next_open lock=1 min_tv=5e+06 cost=50rt expo=1 minyr=-14.1 ystd=56.5 robust=2.894 rmin=-0.068 noise_sd=0.233]
2026-09-26T09:26:57Z	discard	strat_l23a_liqconfirm	{"b_hi": 0.65, "b_lo": 0.45, "b_mid": 0.55, "floor_lb": 19, "lookback": 16, "lq_days": 40, "lq_min": 5000000.0, "lq_mode": "strict", "lq_shift": 0.05, "lq_shift_hi": 0.05, "lq_shift_lo": 0.075, "max_dist": 0.055, "regime_ma": 18, "top": 25, "weighting": "invvol"}	25	30.090	-17.220	1.747	28.557	31.568	blind	blind	blind	TRAIN 2.121 <= best 3.232 + margin 0.161 [robust] [risk:top=25 weighting=invvol select:robust exec:realistic fill=next_open lock=1 min_tv=5e+06 cost=50rt expo=1 minyr=-13.6 ystd=56.4 robust=2.121 rmin=0.000 noise_sd=0.161]
2026-09-26T09:27:05Z	discard	strat_l23a_liqconfirm	{"b_hi": 0.65, "b_lo": 0.45, "b_mid": 0.55, "floor_lb": 19, "lookback": 16, "lq_days": 40, "lq_min": 5000000.0, "lq_mode": "strict", "lq_shift": 0.05, "lq_shift_hi": 0.05, "lq_shift_lo": 0.075, "max_dist": 0.055, "regime_ma": 18, "top": 30, "weighting": "invvol"}	30	30.174	-18.327	1.646	28.909	31.392	blind	blind	blind	TRAIN 2.140 <= best 3.232 + margin 0.111 [robust] [risk:top=30 weighting=invvol select:robust exec:realistic fill=next_open lock=1 min_tv=5e+06 cost=50rt expo=1 minyr=-15.5 ystd=57.7 robust=2.140 rmin=0.000 noise_sd=0.111]
2026-09-26T09:27:10Z	discard	strat_l23a_liqconfirm	{"b_hi": 0.65, "b_lo": 0.45, "b_mid": 0.55, "floor_lb": 19, "lookback": 16, "lq_days": 40, "lq_min": 5000000.0, "lq_mode": "strict", "lq_shift": 0.05, "lq_shift_hi": 0.05, "lq_shift_lo": 0.075, "max_dist": 0.055, "regime_ma": 18, "top": 35}	35	28.410	-18.843	1.508	27.559	29.227	blind	blind	blind	TRAIN 2.006 <= best 3.232 + margin 0.118 [robust] [risk:top=35 select:robust exec:realistic fill=next_open lock=1 min_tv=5e+06 cost=50rt expo=1 minyr=-18.8 ystd=57.1 robust=2.006 rmin=0.000 noise_sd=0.118]
2026-09-26T09:27:16Z	discard	strat_floorhighfresh	{"b_hi": 0.65, "b_lo": 0.45, "b_mid": 0.55, "floor_lb": 19, "lookback": 16, "max_dist": 0.055, "regime_ma": 18, "top": 30, "weighting": "invvol"}	30	26.121	-18.327	1.425	20.821	31.392	blind	blind	blind	TRAIN 1.129 <= best 3.232 + margin 0.062 [robust] [risk:top=30 weighting=invvol select:robust exec:realistic fill=next_open lock=1 min_tv=5e+06 cost=50rt expo=1 minyr=-15.6 ystd=56.6 robust=1.129 rmin=0.000 noise_sd=0.062]
2026-09-26T09:27:22Z	discard	strat_floorhighfresh	{"b_hi": 0.65, "b_lo": 0.45, "b_mid": 0.55, "floor_lb": 19, "lookback": 16, "max_dist": 0.055, "regime_ma": 18, "top": 40, "weighting": "invvol"}	40	24.061	-17.790	1.352	16.907	31.289	blind	blind	blind	TRAIN 1.010 <= best 3.232 + margin 0.066 [robust] [risk:top=40 weighting=invvol select:robust exec:realistic fill=next_open lock=1 min_tv=5e+06 cost=50rt expo=1 minyr=-15.6 ystd=59.1 robust=1.010 rmin=0.000 noise_sd=0.066]
2026-09-26T09:27:28Z	discard	strat_floorhighfresh	{"b_hi": 0.65, "b_lo": 0.45, "b_mid": 0.55, "floor_lb": 19, "lookback": 16, "max_dist": 0.055, "min_hold": 2, "regime_ma": 18, "top": 25, "weighting": "invvol"}	25	25.818	-16.565	1.559	22.616	28.949	blind	blind	blind	TRAIN 1.351 <= best 3.232 + margin 0.102 [robust] [risk:top=25 weighting=invvol min_hold=2 select:robust exec:realistic fill=next_open lock=1 min_tv=5e+06 cost=50rt expo=1 minyr=-6.6 ystd=52.6 robust=1.351 rmin=0.000 noise_sd=0.102]
2026-09-26T09:27:53Z	discard	strat_l23a_liqconfirm	{"b_hi": 0.65, "b_lo": 0.45, "b_mid": 0.55, "floor_lb": 19, "lookback": 16, "lq_days": 40, "lq_min": 5000000.0, "lq_mode": "strict", "lq_shift": 0.05, "lq_shift_hi": 0.05, "lq_shift_lo": 0.075, "max_dist": 0.055, "regime_ma": 18, "top": 22, "weighting": "invvol"}	22	33.346	-16.785	1.987	33.779	32.934	blind	blind	blind	TRAIN 2.661 <= best 3.232 + margin 0.221 [robust] [risk:top=22 weighting=invvol select:robust exec:realistic fill=next_open lock=1 min_tv=5e+06 cost=50rt expo=1 minyr=-14.3 ystd=59.3 robust=2.661 rmin=0.000 noise_sd=0.221]
2026-09-26T09:28:02Z	discard	strat_l23a_liqconfirm	{"b_hi": 0.65, "b_lo": 0.45, "b_mid": 0.55, "floor_lb": 19, "lookback": 16, "lq_days": 40, "lq_min": 5000000.0, "lq_mode": "strict", "lq_shift": 0.05, "lq_shift_hi": 0.05, "lq_shift_lo": 0.075, "max_dist": 0.055, "regime_ma": 18, "top": 28, "weighting": "invvol"}	28	29.006	-18.382	1.578	28.369	29.617	blind	blind	blind	TRAIN 2.135 <= best 3.232 + margin 0.167 [robust] [risk:top=28 weighting=invvol select:robust exec:realistic fill=next_open lock=1 min_tv=5e+06 cost=50rt expo=1 minyr=-14.3 ystd=52.7 robust=2.135 rmin=0.000 noise_sd=0.167]
2026-09-26T09:28:10Z	discard	strat_l23a_liqconfirm	{"b_hi": 0.65, "b_lo": 0.45, "b_mid": 0.55, "floor_lb": 19, "lookback": 16, "lq_days": 40, "lq_min": 5000000.0, "lq_mode": "strict", "lq_shift": 0.05, "lq_shift_hi": 0.05, "lq_shift_lo": 0.075, "max_dist": 0.055, "max_weight": 0.08, "regime_ma": 18, "top": 25, "weighting": "invvol"}	25	29.797	-17.297	1.723	28.555	30.993	blind	blind	blind	TRAIN 2.119 <= best 3.232 + margin 0.161 [robust] [risk:top=25 weighting=invvol max_weight=0.08 select:robust exec:realistic fill=next_open lock=1 min_tv=5e+06 cost=50rt expo=1 minyr=-13.5 ystd=55.3 robust=2.119 rmin=0.000 noise_sd=0.161]
2026-09-26T09:28:18Z	discard	strat_l23a_liqconfirm	{"b_hi": 0.65, "b_lo": 0.45, "b_mid": 0.55, "floor_lb": 19, "lookback": 16, "lq_days": 40, "lq_min": 5000000.0, "lq_mode": "strict", "lq_shift": 0.05, "lq_shift_hi": 0.05, "lq_shift_lo": 0.0625, "max_dist": 0.055, "regime_ma": 18, "top": 25, "weighting": "invvol"}	25	28.622	-17.220	1.662	25.603	31.568	blind	blind	blind	TRAIN 1.559 <= best 3.232 + margin 0.093 [robust] [risk:top=25 weighting=invvol select:robust exec:realistic fill=next_open lock=1 min_tv=5e+06 cost=50rt expo=1 minyr=-13.6 ystd=57.4 robust=1.559 rmin=0.000 noise_sd=0.093]
2026-09-26T09:28:26Z	discard	strat_l23a_liqconfirm	{"b_hi": 0.65, "b_lo": 0.45, "b_mid": 0.55, "floor_lb": 19, "lookback": 16, "lq_days": 40, "lq_min": 5000000.0, "lq_mode": "strict", "lq_shift": 0.05, "lq_shift_hi": 0.05, "lq_shift_lo": 0.0875, "max_dist": 0.055, "regime_ma": 18, "top": 25, "weighting": "invvol"}	25	29.328	-17.220	1.703	29.292	29.363	blind	blind	blind	TRAIN 2.160 <= best 3.232 + margin 0.162 [robust] [risk:top=25 weighting=invvol select:robust exec:realistic fill=next_open lock=1 min_tv=5e+06 cost=50rt expo=1 minyr=-11.9 ystd=56.6 robust=2.160 rmin=0.000 noise_sd=0.162]
2026-09-26T09:28:34Z	discard	strat_l23a_liqconfirm	{"b_hi": 0.65, "b_lo": 0.45, "b_mid": 0.55, "floor_lb": 19, "lookback": 16, "lq_days": 40, "lq_min": 5000000.0, "lq_mode": "strict", "lq_shift": 0.05, "lq_shift_hi": 0.05, "lq_shift_lo": 0.075, "max_dist": 0.055, "regime_ma": 17, "top": 25, "weighting": "invvol"}	25	28.632	-17.220	1.663	25.624	31.568	blind	blind	blind	TRAIN 1.837 <= best 3.232 + margin 0.138 [robust] [risk:top=25 weighting=invvol select:robust exec:realistic fill=next_open lock=1 min_tv=5e+06 cost=50rt expo=1 minyr=-11.9 ystd=56.1 robust=1.837 rmin=0.000 noise_sd=0.138]
2026-09-26T09:28:42Z	discard	strat_l23a_liqconfirm	{"b_hi": 0.65, "b_lo": 0.45, "b_mid": 0.55, "floor_lb": 19, "lookback": 16, "lq_days": 40, "lq_min": 5000000.0, "lq_mode": "strict", "lq_shift": 0.05, "lq_shift_hi": 0.05, "lq_shift_lo": 0.075, "max_dist": 0.055, "regime_ma": 19, "top": 25, "weighting": "invvol"}	25	26.783	-17.220	1.555	24.133	29.363	blind	blind	blind	TRAIN 1.473 <= best 3.232 + margin 0.098 [robust] [risk:top=25 weighting=invvol select:robust exec:realistic fill=next_open lock=1 min_tv=5e+06 cost=50rt expo=1 minyr=-15.4 ystd=58.1 robust=1.473 rmin=0.000 noise_sd=0.098]
