ts	status	candidate	params	top	train_cagr	train_dd	ret_dd	h1	h2	fwd_cagr	fwd_dd	fwd_bench	note
2026-09-26T17:23:09Z	discard	strat_l27b_spread	{"b_hi": 0.65, "b_lo": 0.45, "b_mid": 0.55, "floor_lb": 19, "lookback": 16, "lq_days": 40, "lq_min": 5000000.0, "lq_mode": "strict", "lq_shift": 0.05, "lq_shift_hi": 0.05, "lq_shift_lo": 0.075, "max_dist": 0.055, "regime_ma": 18, "sp_frac": 0.5, "sp_lb": 12, "sp_w": 0.2, "top": 25, "weighting": "invvol"}	25	32.711	-18.226	1.795	34.314	31.200	blind	blind	blind	TRAIN 2.705 <= best 3.229 + margin 0.151 [robust] [risk:top=25 weighting=invvol select:robust exec:realistic fill=next_open lock=1 min_tv=5e+06 cost=50rt expo=1 minyr=-14.2 ystd=57.6 robust=2.705 rmin=0.000 noise_sd=0.151]
2026-09-26T17:23:21Z	discard	strat_l27b_spread	{"b_hi": 0.65, "b_lo": 0.45, "b_mid": 0.55, "floor_lb": 19, "lookback": 16, "lq_days": 40, "lq_min": 5000000.0, "lq_mode": "strict", "lq_shift": 0.05, "lq_shift_hi": 0.05, "lq_shift_lo": 0.075, "max_dist": 0.055, "regime_ma": 18, "sp_frac": 0.5, "sp_lb": 6, "sp_w": 0.2, "top": 25, "weighting": "invvol"}	25	31.480	-16.757	1.879	32.911	30.130	blind	blind	blind	TRAIN 2.247 <= best 3.229 + margin 0.198 [robust] [risk:top=25 weighting=invvol select:robust exec:realistic fill=next_open lock=1 min_tv=5e+06 cost=50rt expo=1 minyr=-15.1 ystd=53.6 robust=2.247 rmin=0.000 noise_sd=0.198]
2026-09-26T17:23:48Z	discard	strat_l27b_spreadidio	{"b_hi": 0.65, "b_lo": 0.45, "b_mid": 0.55, "floor_lb": 19, "im_lb": 12, "im_w": 0.0, "lookback": 16, "lq_days": 40, "lq_min": 5000000.0, "lq_mode": "strict", "lq_shift": 0.05, "lq_shift_hi": 0.05, "lq_shift_lo": 0.075, "max_dist": 0.055, "regime_ma": 18, "sp_frac": 0.5, "sp_lb": 9, "sp_w": 0.0, "top": 25, "weighting": "invvol"}	25	30.090	-17.220	1.747	28.557	31.568	blind	blind	blind	TRAIN 2.121 <= best 3.229 + margin 0.161 [robust] [risk:top=25 weighting=invvol select:robust exec:realistic fill=next_open lock=1 min_tv=5e+06 cost=50rt expo=1 minyr=-13.6 ystd=56.4 robust=2.121 rmin=0.000 noise_sd=0.161]
2026-09-26T17:23:59Z	discard	strat_l27b_spreadidio	{"b_hi": 0.65, "b_lo": 0.45, "b_mid": 0.55, "floor_lb": 19, "im_lb": 12, "im_w": -0.1, "lookback": 16, "lq_days": 40, "lq_min": 5000000.0, "lq_mode": "strict", "lq_shift": 0.05, "lq_shift_hi": 0.05, "lq_shift_lo": 0.075, "max_dist": 0.055, "regime_ma": 18, "sp_frac": 0.5, "sp_lb": 9, "sp_w": 0.2, "top": 25, "weighting": "invvol"}	25	33.969	-16.554	2.052	35.063	32.933	blind	blind	blind	TRAIN 2.654 <= best 3.229 + margin 0.189 [robust] [risk:top=25 weighting=invvol select:robust exec:realistic fill=next_open lock=1 min_tv=5e+06 cost=50rt expo=1 minyr=-14.6 ystd=58.4 robust=2.654 rmin=0.000 noise_sd=0.189]
2026-09-26T17:24:10Z	discard	strat_l27b_spreadidio	{"b_hi": 0.65, "b_lo": 0.45, "b_mid": 0.55, "floor_lb": 19, "im_lb": 12, "im_w": -0.15, "lookback": 16, "lq_days": 40, "lq_min": 5000000.0, "lq_mode": "strict", "lq_shift": 0.05, "lq_shift_hi": 0.05, "lq_shift_lo": 0.075, "max_dist": 0.055, "regime_ma": 18, "sp_frac": 0.5, "sp_lb": 9, "sp_w": 0.2, "top": 25, "weighting": "invvol"}	25	34.060	-16.523	2.061	34.264	33.865	blind	blind	blind	TRAIN 2.617 <= best 3.229 + margin 0.150 [robust] [risk:top=25 weighting=invvol select:robust exec:realistic fill=next_open lock=1 min_tv=5e+06 cost=50rt expo=1 minyr=-15.0 ystd=58.2 robust=2.617 rmin=0.000 noise_sd=0.150]
2026-09-26T17:24:21Z	discard	strat_l27b_spreadidio	{"b_hi": 0.65, "b_lo": 0.45, "b_mid": 0.55, "floor_lb": 19, "im_lb": 12, "im_w": -0.05, "lookback": 16, "lq_days": 40, "lq_min": 5000000.0, "lq_mode": "strict", "lq_shift": 0.05, "lq_shift_hi": 0.05, "lq_shift_lo": 0.075, "max_dist": 0.055, "regime_ma": 18, "sp_frac": 0.5, "sp_lb": 9, "sp_w": 0.2, "top": 25, "weighting": "invvol"}	25	33.826	-16.849	2.008	34.151	33.516	blind	blind	blind	TRAIN 2.442 <= best 3.229 + margin 0.245 [robust] [risk:top=25 weighting=invvol select:robust exec:realistic fill=next_open lock=1 min_tv=5e+06 cost=50rt expo=1 minyr=-14.5 ystd=60.1 robust=2.442 rmin=0.000 noise_sd=0.245]
2026-09-26T17:24:40Z	discard	strat_l27b_spread	{"b_hi": 0.65, "b_lo": 0.45, "b_mid": 0.55, "floor_lb": 19, "lookback": 16, "lq_days": 40, "lq_min": 5000000.0, "lq_mode": "strict", "lq_shift": 0.05, "lq_shift_hi": 0.05, "lq_shift_lo": 0.075, "max_dist": 0.055, "regime_ma": 18, "sp_frac": 0.4, "sp_lb": 9, "sp_w": 0.2, "top": 25, "weighting": "invvol"}	25	35.186	-15.841	2.221	36.043	34.374	blind	blind	blind	TRAIN 2.550 <= best 3.229 + margin 0.184 [robust] [risk:top=25 weighting=invvol select:robust exec:realistic fill=next_open lock=1 min_tv=5e+06 cost=50rt expo=1 minyr=-13.9 ystd=61.9 robust=2.550 rmin=0.000 noise_sd=0.184]
2026-09-26T17:24:51Z	discard	strat_l27b_spread	{"b_hi": 0.65, "b_lo": 0.45, "b_mid": 0.55, "floor_lb": 19, "lookback": 16, "lq_days": 40, "lq_min": 5000000.0, "lq_mode": "strict", "lq_shift": 0.05, "lq_shift_hi": 0.05, "lq_shift_lo": 0.075, "max_dist": 0.055, "regime_ma": 18, "sp_frac": 0.6, "sp_lb": 9, "sp_w": 0.2, "top": 25, "weighting": "invvol"}	25	35.186	-15.841	2.221	36.043	34.374	blind	blind	blind	TRAIN 2.550 <= best 3.229 + margin 0.184 [robust] [risk:top=25 weighting=invvol select:robust exec:realistic fill=next_open lock=1 min_tv=5e+06 cost=50rt expo=1 minyr=-13.9 ystd=61.9 robust=2.550 rmin=0.000 noise_sd=0.184]
