ts	status	candidate	params	top	train_cagr	train_dd	ret_dd	h1	h2	fwd_cagr	fwd_dd	fwd_bench	note
2026-09-26T17:34:25Z	discard	strat_l27b2_zeroret	{"b_hi": 0.65, "b_lo": 0.45, "b_mid": 0.55, "floor_lb": 19, "lookback": 16, "lq_days": 40, "lq_min": 5000000.0, "lq_mode": "strict", "lq_shift": 0.05, "lq_shift_hi": 0.05, "lq_shift_lo": 0.075, "max_dist": 0.055, "regime_ma": 18, "top": 25, "weighting": "invvol", "zr_frac": 0.5, "zr_lb": 12, "zr_w": -0.1}	25	29.436	-17.305	1.701	29.566	29.312	blind	blind	blind	TRAIN 2.042 <= best 2.830 + margin 0.125 [robust] [risk:top=25 weighting=invvol select:robust exec:realistic fill=next_open lock=1 min_tv=5e+06 cost=50rt expo=1 minyr=-13.8 ystd=60.4 robust=2.042 rmin=0.000 noise_sd=0.125]
2026-09-26T17:34:35Z	discard	strat_l27b2_zeroret	{"b_hi": 0.65, "b_lo": 0.45, "b_mid": 0.55, "floor_lb": 19, "lookback": 16, "lq_days": 40, "lq_min": 5000000.0, "lq_mode": "strict", "lq_shift": 0.05, "lq_shift_hi": 0.05, "lq_shift_lo": 0.075, "max_dist": 0.055, "regime_ma": 18, "top": 25, "weighting": "invvol", "zr_frac": 0.5, "zr_lb": 9, "zr_w": 0.2}	25	30.016	-18.352	1.636	29.977	30.054	blind	blind	blind	TRAIN 2.356 <= best 2.830 + margin 0.231 [robust] [risk:top=25 weighting=invvol select:robust exec:realistic fill=next_open lock=1 min_tv=5e+06 cost=50rt expo=1 minyr=-16.7 ystd=53.7 robust=2.356 rmin=0.000 noise_sd=0.231]
