ts	status	candidate	params	top	train_cagr	train_dd	ret_dd	h1	h2	fwd_cagr	fwd_dd	fwd_bench	note
2026-09-26T17:26:45Z	discard	strat_l27a_froth	{"b_hi": 0.65, "b_lo": 0.45, "b_mid": 0.55, "floor_lb": 19, "fr_cut": 0.4, "fr_days": 50, "fr_k": 2, "fr_min": 20000000.0, "fr_thr": 0.06, "lookback": 16, "lq_days": 40, "lq_min": 5000000.0, "lq_mode": "strict", "lq_shift": 0.05, "lq_shift_hi": 0.05, "lq_shift_lo": 0.075, "max_dist": 0.055, "regime_ma": 18, "top": 25, "weighting": "invvol"}	25	29.717	-14.091	2.109	33.249	26.436	blind	blind	blind	TRAIN 3.679 <= best 5.619 + margin 0.246 [robust] [risk:top=25 weighting=invvol select:robust exec:realistic fill=next_open lock=1 min_tv=5e+06 cost=50rt expo=1 minyr=-13.9 ystd=46.2 robust=3.679 rmin=0.000 noise_sd=0.246]
2026-09-26T17:27:04Z	discard	strat_l27a_froth	{"b_hi": 0.65, "b_lo": 0.45, "b_mid": 0.55, "floor_lb": 19, "fr_cut": 0.4, "fr_days": 40, "fr_k": 2, "fr_min": 20000000.0, "fr_thr": 0.06, "lookback": 16, "lq_days": 40, "lq_min": 5000000.0, "lq_mode": "strict", "lq_shift": 0.05, "lq_shift_hi": 0.05, "lq_shift_lo": 0.075, "max_dist": 0.055, "regime_ma": 19, "top": 25, "weighting": "invvol"}	25	27.560	-15.964	1.726	31.053	24.317	blind	blind	blind	TRAIN 2.645 <= best 5.619 + margin 0.159 [robust] [risk:top=25 weighting=invvol select:robust exec:realistic fill=next_open lock=1 min_tv=5e+06 cost=50rt expo=1 minyr=-15.8 ystd=47.4 robust=2.645 rmin=0.000 noise_sd=0.159]
2026-09-26T17:27:24Z	discard	strat_l27a_froth	{"b_hi": 0.65, "b_lo": 0.45, "b_mid": 0.55, "floor_lb": 19, "fr_cut": 0.4, "fr_days": 40, "fr_k": 2, "fr_min": 20000000.0, "fr_thr": 0.06, "lookback": 16, "lq_days": 40, "lq_min": 5000000.0, "lq_mode": "strict", "lq_shift": 0.05, "lq_shift_hi": 0.05, "lq_shift_lo": 0.075, "max_dist": 0.055, "regime_ma": 17, "top": 25, "weighting": "invvol"}	25	28.768	-12.404	2.319	31.260	26.436	blind	blind	blind	TRAIN 3.487 <= best 5.619 + margin 0.221 [robust] [risk:top=25 weighting=invvol select:robust exec:realistic fill=next_open lock=1 min_tv=5e+06 cost=50rt expo=1 minyr=-12.2 ystd=45.9 robust=3.487 rmin=0.000 noise_sd=0.221]
2026-09-26T17:27:43Z	discard	strat_l27a_froth	{"b_hi": 0.585, "b_lo": 0.45, "b_mid": 0.55, "floor_lb": 19, "fr_cut": 0.4, "fr_days": 40, "fr_k": 2, "fr_min": 20000000.0, "fr_thr": 0.06, "lookback": 16, "lq_days": 40, "lq_min": 5000000.0, "lq_mode": "strict", "lq_shift": 0.05, "lq_shift_hi": 0.05, "lq_shift_lo": 0.075, "max_dist": 0.055, "regime_ma": 18, "top": 25, "weighting": "invvol"}	25	30.345	-15.964	1.901	34.575	26.436	blind	blind	blind	TRAIN 3.856 <= best 5.619 + margin 0.169 [robust] [risk:top=25 weighting=invvol select:robust exec:realistic fill=next_open lock=1 min_tv=5e+06 cost=50rt expo=1 minyr=-15.8 ystd=46.2 robust=3.856 rmin=0.000 noise_sd=0.169]
2026-09-26T17:28:00Z	discard	strat_l27a_froth	{"b_hi": 0.715, "b_lo": 0.45, "b_mid": 0.55, "floor_lb": 19, "fr_cut": 0.4, "fr_days": 40, "fr_k": 2, "fr_min": 20000000.0, "fr_thr": 0.06, "lookback": 16, "lq_days": 40, "lq_min": 5000000.0, "lq_mode": "strict", "lq_shift": 0.05, "lq_shift_hi": 0.05, "lq_shift_lo": 0.075, "max_dist": 0.055, "regime_ma": 18, "top": 25, "weighting": "invvol"}	25	27.876	-12.442	2.241	29.404	26.436	blind	blind	blind	TRAIN 4.470 <= best 5.619 + margin 0.187 [robust] [risk:top=25 weighting=invvol select:robust exec:realistic fill=next_open lock=1 min_tv=5e+06 cost=50rt expo=1 minyr=-12.3 ystd=41.7 robust=4.470 rmin=0.000 noise_sd=0.187]
2026-09-26T17:28:18Z	discard	strat_l27a_froth	{"b_hi": 0.65, "b_lo": 0.45, "b_mid": 0.55, "floor_lb": 19, "fr_cut": 0.4, "fr_days": 40, "fr_k": 2, "fr_min": 20000000.0, "fr_thr": 0.06, "lookback": 16, "lq_days": 40, "lq_min": 5000000.0, "lq_mode": "strict", "lq_shift": 0.05, "lq_shift_hi": 0.05, "lq_shift_lo": 0.075, "max_dist": 0.055, "regime_ma": 18, "top": 24, "weighting": "invvol"}	24	31.757	-14.367	2.210	35.647	28.151	blind	blind	blind	TRAIN 3.767 <= best 5.619 + margin 0.258 [robust] [risk:top=24 weighting=invvol select:robust exec:realistic fill=next_open lock=1 min_tv=5e+06 cost=50rt expo=1 minyr=-14.4 ystd=48.9 robust=3.767 rmin=0.000 noise_sd=0.258]
2026-09-26T17:28:34Z	discard	strat_l27a_froth	{"b_hi": 0.65, "b_lo": 0.45, "b_mid": 0.55, "floor_lb": 19, "fr_cut": 0.4, "fr_days": 40, "fr_k": 2, "fr_min": 20000000.0, "fr_thr": 0.06, "lookback": 16, "lq_days": 40, "lq_min": 5000000.0, "lq_mode": "strict", "lq_shift": 0.05, "lq_shift_hi": 0.05, "lq_shift_lo": 0.075, "max_dist": 0.055, "regime_ma": 18, "top": 26, "weighting": "invvol"}	26	30.099	-14.143	2.128	34.502	26.035	blind	blind	blind	TRAIN 3.804 <= best 5.619 + margin 0.231 [robust] [risk:top=26 weighting=invvol select:robust exec:realistic fill=next_open lock=1 min_tv=5e+06 cost=50rt expo=1 minyr=-14.1 ystd=45.6 robust=3.804 rmin=0.000 noise_sd=0.231]
2026-09-26T17:28:54Z	discard	strat_l27a_froth	{"b_hi": 0.65, "b_lo": 0.45, "b_mid": 0.55, "floor_lb": 19, "fr_cut": 0.4, "fr_days": 40, "fr_k": 2, "fr_min": 20000000.0, "fr_thr": 0.06, "lookback": 16, "lq_days": 40, "lq_min": 5000000.0, "lq_mode": "strict", "lq_shift": 0.05, "lq_shift_hi": 0.05, "lq_shift_lo": 0.0675, "max_dist": 0.055, "regime_ma": 18, "top": 25, "weighting": "invvol"}	25	29.163	-14.091	2.070	32.086	26.436	blind	blind	blind	TRAIN 2.813 <= best 5.619 + margin 0.166 [robust] [risk:top=25 weighting=invvol select:robust exec:realistic fill=next_open lock=1 min_tv=5e+06 cost=50rt expo=1 minyr=-13.9 ystd=46.8 robust=2.813 rmin=0.000 noise_sd=0.166]
2026-09-26T17:29:09Z	discard	strat_l27a_froth	{"b_hi": 0.65, "b_lo": 0.405, "b_mid": 0.55, "floor_lb": 19, "fr_cut": 0.4, "fr_days": 40, "fr_k": 2, "fr_min": 20000000.0, "fr_thr": 0.06, "lookback": 16, "lq_days": 40, "lq_min": 5000000.0, "lq_mode": "strict", "lq_shift": 0.05, "lq_shift_hi": 0.05, "lq_shift_lo": 0.075, "max_dist": 0.055, "regime_ma": 18, "top": 25, "weighting": "invvol"}	25	29.016	-16.508	1.758	32.604	25.686	blind	blind	blind	TRAIN 2.867 <= best 5.619 + margin 0.174 [robust] [risk:top=25 weighting=invvol select:robust exec:realistic fill=next_open lock=1 min_tv=5e+06 cost=50rt expo=1 minyr=-13.9 ystd=46.8 robust=2.867 rmin=-0.242 noise_sd=0.174]
