ts	status	candidate	params	top	train_cagr	train_dd	ret_dd	h1	h2	fwd_cagr	fwd_dd	fwd_bench	note
2026-09-26T17:26:48Z	baseline	strat_l27b2_amihud	{"am_frac": 0.5, "am_lb": 9, "am_w": 0.0, "b_hi": 0.65, "b_lo": 0.45, "b_mid": 0.55, "floor_lb": 19, "lookback": 16, "lq_days": 40, "lq_min": 5000000.0, "lq_mode": "strict", "lq_shift": 0.05, "lq_shift_hi": 0.05, "lq_shift_lo": 0.075, "max_dist": 0.055, "regime_ma": 18, "top": 25, "weighting": "invvol"}	25	30.090	-17.220	1.747	28.557	31.568	blind	blind	blind	first entry [risk:top=25 weighting=invvol select:robust exec:realistic fill=next_open lock=1 min_tv=5e+06 cost=50rt expo=1 minyr=-13.6 ystd=56.4 robust=2.121 rmin=0.000 noise_sd=0.161]
2026-09-26T17:27:12Z	discard	strat_l27b2_amihud	{"am_frac": 0.5, "am_lb": 9, "am_w": 0.2, "b_hi": 0.65, "b_lo": 0.45, "b_mid": 0.55, "floor_lb": 19, "lookback": 16, "lq_days": 40, "lq_min": 5000000.0, "lq_mode": "strict", "lq_shift": 0.05, "lq_shift_hi": 0.05, "lq_shift_lo": 0.075, "max_dist": 0.055, "regime_ma": 18, "top": 25, "weighting": "invvol"}	25	33.178	-17.546	1.891	32.225	34.093	blind	blind	blind	TRAIN 2.265 <= best 2.121 + margin 0.147 [robust] [risk:top=25 weighting=invvol select:robust exec:realistic fill=next_open lock=1 min_tv=5e+06 cost=50rt expo=1 minyr=-17.5 ystd=61.9 robust=2.265 rmin=0.000 noise_sd=0.147]
2026-09-26T17:27:26Z	discard	strat_l27b2_amihud	{"am_frac": 0.5, "am_lb": 9, "am_w": -0.2, "b_hi": 0.65, "b_lo": 0.45, "b_mid": 0.55, "floor_lb": 19, "lookback": 16, "lq_days": 40, "lq_min": 5000000.0, "lq_mode": "strict", "lq_shift": 0.05, "lq_shift_hi": 0.05, "lq_shift_lo": 0.075, "max_dist": 0.055, "regime_ma": 18, "top": 25, "weighting": "invvol"}	25	28.309	-18.195	1.556	27.176	29.399	blind	blind	blind	TRAIN 2.043 <= best 2.121 + margin 0.137 [robust] [risk:top=25 weighting=invvol select:robust exec:realistic fill=next_open lock=1 min_tv=5e+06 cost=50rt expo=1 minyr=-13.1 ystd=53.8 robust=2.043 rmin=0.000 noise_sd=0.137]
2026-09-26T17:27:38Z	keep	strat_l27b2_amihud	{"am_frac": 0.5, "am_lb": 9, "am_w": 0.1, "b_hi": 0.65, "b_lo": 0.45, "b_mid": 0.55, "floor_lb": 19, "lookback": 16, "lq_days": 40, "lq_min": 5000000.0, "lq_mode": "strict", "lq_shift": 0.05, "lq_shift_hi": 0.05, "lq_shift_lo": 0.075, "max_dist": 0.055, "regime_ma": 18, "top": 25, "weighting": "invvol"}	25	32.777	-17.083	1.919	33.411	32.176	blind	blind	blind	beats best on robust by 0.404 > margin 0.175 [risk:top=25 weighting=invvol select:robust exec:realistic fill=next_open lock=1 min_tv=5e+06 cost=50rt expo=1 minyr=-15.0 ystd=58.3 robust=2.525 rmin=0.000 noise_sd=0.175]
2026-09-26T17:27:50Z	discard	strat_l27b2_amihud	{"am_frac": 0.5, "am_lb": 9, "am_w": -0.1, "b_hi": 0.65, "b_lo": 0.45, "b_mid": 0.55, "floor_lb": 19, "lookback": 16, "lq_days": 40, "lq_min": 5000000.0, "lq_mode": "strict", "lq_shift": 0.05, "lq_shift_hi": 0.05, "lq_shift_lo": 0.075, "max_dist": 0.055, "regime_ma": 18, "top": 25, "weighting": "invvol"}	25	29.918	-18.274	1.637	28.973	30.826	blind	blind	blind	TRAIN 2.231 <= best 2.525 + margin 0.176 [robust] [risk:top=25 weighting=invvol select:robust exec:realistic fill=next_open lock=1 min_tv=5e+06 cost=50rt expo=1 minyr=-15.0 ystd=56.6 robust=2.231 rmin=0.000 noise_sd=0.176]
2026-09-26T17:28:04Z	discard	strat_l27b2_amihud	{"am_frac": 0.5, "am_lb": 6, "am_w": 0.2, "b_hi": 0.65, "b_lo": 0.45, "b_mid": 0.55, "floor_lb": 19, "lookback": 16, "lq_days": 40, "lq_min": 5000000.0, "lq_mode": "strict", "lq_shift": 0.05, "lq_shift_hi": 0.05, "lq_shift_lo": 0.075, "max_dist": 0.055, "regime_ma": 18, "top": 25, "weighting": "invvol"}	25	33.280	-16.825	1.978	31.280	35.216	blind	blind	blind	TRAIN 2.212 <= best 2.525 + margin 0.200 [robust] [risk:top=25 weighting=invvol select:robust exec:realistic fill=next_open lock=1 min_tv=5e+06 cost=50rt expo=1 minyr=-16.8 ystd=62.8 robust=2.212 rmin=0.000 noise_sd=0.200]
2026-09-26T17:28:17Z	discard	strat_l27b2_amihud	{"am_frac": 0.5, "am_lb": 12, "am_w": 0.2, "b_hi": 0.65, "b_lo": 0.45, "b_mid": 0.55, "floor_lb": 19, "lookback": 16, "lq_days": 40, "lq_min": 5000000.0, "lq_mode": "strict", "lq_shift": 0.05, "lq_shift_hi": 0.05, "lq_shift_lo": 0.075, "max_dist": 0.055, "regime_ma": 18, "top": 25, "weighting": "invvol"}	25	35.337	-16.695	2.117	33.703	36.913	blind	blind	blind	TRAIN 2.522 <= best 2.525 + margin 0.171 [robust] [risk:top=25 weighting=invvol select:robust exec:realistic fill=next_open lock=1 min_tv=5e+06 cost=50rt expo=1 minyr=-16.7 ystd=68.4 robust=2.522 rmin=0.000 noise_sd=0.171]
2026-09-26T17:28:43Z	discard	strat_l27b2_amihud	{"am_frac": 0.5, "am_lb": 12, "am_w": 0.15, "b_hi": 0.65, "b_lo": 0.45, "b_mid": 0.55, "floor_lb": 19, "lookback": 16, "lq_days": 40, "lq_min": 5000000.0, "lq_mode": "strict", "lq_shift": 0.05, "lq_shift_hi": 0.05, "lq_shift_lo": 0.075, "max_dist": 0.055, "regime_ma": 18, "top": 25, "weighting": "invvol"}	25	34.126	-17.590	1.940	33.710	34.523	blind	blind	blind	TRAIN 2.496 <= best 2.525 + margin 0.212 [robust] [risk:top=25 weighting=invvol select:robust exec:realistic fill=next_open lock=1 min_tv=5e+06 cost=50rt expo=1 minyr=-15.4 ystd=62.9 robust=2.496 rmin=0.000 noise_sd=0.212]
2026-09-26T17:28:55Z	discard	strat_l27b2_amihud	{"am_frac": 0.5, "am_lb": 12, "am_w": 0.25, "b_hi": 0.65, "b_lo": 0.45, "b_mid": 0.55, "floor_lb": 19, "lookback": 16, "lq_days": 40, "lq_min": 5000000.0, "lq_mode": "strict", "lq_shift": 0.05, "lq_shift_hi": 0.05, "lq_shift_lo": 0.075, "max_dist": 0.055, "regime_ma": 18, "top": 25, "weighting": "invvol"}	25	34.378	-17.981	1.912	33.002	35.704	blind	blind	blind	TRAIN 2.433 <= best 2.525 + margin 0.185 [robust] [risk:top=25 weighting=invvol select:robust exec:realistic fill=next_open lock=1 min_tv=5e+06 cost=50rt expo=1 minyr=-18.0 ystd=64.6 robust=2.433 rmin=0.000 noise_sd=0.185]
2026-09-26T17:29:08Z	discard	strat_l27b2_amihud	{"am_frac": 0.5, "am_lb": 15, "am_w": 0.2, "b_hi": 0.65, "b_lo": 0.45, "b_mid": 0.55, "floor_lb": 19, "lookback": 16, "lq_days": 40, "lq_min": 5000000.0, "lq_mode": "strict", "lq_shift": 0.05, "lq_shift_hi": 0.05, "lq_shift_lo": 0.075, "max_dist": 0.055, "regime_ma": 18, "top": 25, "weighting": "invvol"}	25	35.114	-16.216	2.165	34.255	35.938	blind	blind	blind	TRAIN 2.586 <= best 2.525 + margin 0.177 [robust] [risk:top=25 weighting=invvol select:robust exec:realistic fill=next_open lock=1 min_tv=5e+06 cost=50rt expo=1 minyr=-16.0 ystd=64.9 robust=2.586 rmin=0.000 noise_sd=0.177]
2026-09-26T17:29:19Z	discard	strat_l27b2_amihud	{"am_frac": 0.5, "am_lb": 12, "am_w": 0.3, "b_hi": 0.65, "b_lo": 0.45, "b_mid": 0.55, "floor_lb": 19, "lookback": 16, "lq_days": 40, "lq_min": 5000000.0, "lq_mode": "strict", "lq_shift": 0.05, "lq_shift_hi": 0.05, "lq_shift_lo": 0.075, "max_dist": 0.055, "regime_ma": 18, "top": 25, "weighting": "invvol"}	25	35.769	-20.218	1.769	31.912	39.551	blind	blind	blind	TRAIN 2.173 <= best 2.525 + margin 0.150 [robust] [risk:top=25 weighting=invvol select:robust exec:realistic fill=next_open lock=1 min_tv=5e+06 cost=50rt expo=1 minyr=-20.2 ystd=72.8 robust=2.173 rmin=0.000 noise_sd=0.150]
2026-09-26T17:29:30Z	discard	strat_l27b2_amihud	{"am_frac": 0.5, "am_lb": 18, "am_w": 0.2, "b_hi": 0.65, "b_lo": 0.45, "b_mid": 0.55, "floor_lb": 19, "lookback": 16, "lq_days": 40, "lq_min": 5000000.0, "lq_mode": "strict", "lq_shift": 0.05, "lq_shift_hi": 0.05, "lq_shift_lo": 0.075, "max_dist": 0.055, "regime_ma": 18, "top": 25, "weighting": "invvol"}	25	35.198	-17.590	2.001	34.017	36.334	blind	blind	blind	TRAIN 2.457 <= best 2.525 + margin 0.164 [robust] [risk:top=25 weighting=invvol select:robust exec:realistic fill=next_open lock=1 min_tv=5e+06 cost=50rt expo=1 minyr=-15.0 ystd=66.3 robust=2.457 rmin=0.000 noise_sd=0.164]
2026-09-26T17:29:38Z	discard	strat_l27b2_roll	{"b_hi": 0.65, "b_lo": 0.45, "b_mid": 0.55, "floor_lb": 19, "lookback": 16, "lq_days": 40, "lq_min": 5000000.0, "lq_mode": "strict", "lq_shift": 0.05, "lq_shift_hi": 0.05, "lq_shift_lo": 0.075, "max_dist": 0.055, "regime_ma": 18, "rl_frac": 0.5, "rl_lb": 9, "rl_w": 0.0, "top": 25, "weighting": "invvol"}	25	30.090	-17.220	1.747	28.557	31.568	blind	blind	blind	TRAIN 2.121 <= best 2.525 + margin 0.161 [robust] [risk:top=25 weighting=invvol select:robust exec:realistic fill=next_open lock=1 min_tv=5e+06 cost=50rt expo=1 minyr=-13.6 ystd=56.4 robust=2.121 rmin=0.000 noise_sd=0.161]
2026-09-26T17:29:48Z	discard	strat_l27b2_roll	{"b_hi": 0.65, "b_lo": 0.45, "b_mid": 0.55, "floor_lb": 19, "lookback": 16, "lq_days": 40, "lq_min": 5000000.0, "lq_mode": "strict", "lq_shift": 0.05, "lq_shift_hi": 0.05, "lq_shift_lo": 0.075, "max_dist": 0.055, "regime_ma": 18, "rl_frac": 0.5, "rl_lb": 9, "rl_w": 0.2, "top": 25, "weighting": "invvol"}	25	27.127	-18.435	1.472	26.067	28.146	blind	blind	blind	TRAIN 1.843 <= best 2.525 + margin 0.143 [robust] [risk:top=25 weighting=invvol select:robust exec:realistic fill=next_open lock=1 min_tv=5e+06 cost=50rt expo=1 minyr=-14.5 ystd=49.7 robust=1.843 rmin=0.000 noise_sd=0.143]
2026-09-26T17:29:58Z	discard	strat_l27b2_roll	{"b_hi": 0.65, "b_lo": 0.45, "b_mid": 0.55, "floor_lb": 19, "lookback": 16, "lq_days": 40, "lq_min": 5000000.0, "lq_mode": "strict", "lq_shift": 0.05, "lq_shift_hi": 0.05, "lq_shift_lo": 0.075, "max_dist": 0.055, "regime_ma": 18, "rl_frac": 0.5, "rl_lb": 9, "rl_w": -0.2, "top": 25, "weighting": "invvol"}	25	30.971	-17.497	1.770	29.900	32.001	blind	blind	blind	TRAIN 2.311 <= best 2.525 + margin 0.116 [robust] [risk:top=25 weighting=invvol select:robust exec:realistic fill=next_open lock=1 min_tv=5e+06 cost=50rt expo=1 minyr=-15.5 ystd=66.4 robust=2.311 rmin=0.000 noise_sd=0.116]
2026-09-26T17:30:08Z	discard	strat_l27b2_roll	{"b_hi": 0.65, "b_lo": 0.45, "b_mid": 0.55, "floor_lb": 19, "lookback": 16, "lq_days": 40, "lq_min": 5000000.0, "lq_mode": "strict", "lq_shift": 0.05, "lq_shift_hi": 0.05, "lq_shift_lo": 0.075, "max_dist": 0.055, "regime_ma": 18, "rl_frac": 0.5, "rl_lb": 9, "rl_w": 0.1, "top": 25, "weighting": "invvol"}	25	28.699	-17.938	1.600	28.127	29.248	blind	blind	blind	TRAIN 2.279 <= best 2.525 + margin 0.160 [robust] [risk:top=25 weighting=invvol select:robust exec:realistic fill=next_open lock=1 min_tv=5e+06 cost=50rt expo=1 minyr=-14.2 ystd=51.8 robust=2.279 rmin=0.000 noise_sd=0.160]
2026-09-26T17:30:19Z	discard	strat_l27b2_roll	{"b_hi": 0.65, "b_lo": 0.45, "b_mid": 0.55, "floor_lb": 19, "lookback": 16, "lq_days": 40, "lq_min": 5000000.0, "lq_mode": "strict", "lq_shift": 0.05, "lq_shift_hi": 0.05, "lq_shift_lo": 0.075, "max_dist": 0.055, "regime_ma": 18, "rl_frac": 0.5, "rl_lb": 9, "rl_w": -0.1, "top": 25, "weighting": "invvol"}	25	32.313	-16.880	1.914	29.270	35.280	blind	blind	blind	TRAIN 2.255 <= best 2.525 + margin 0.165 [robust] [risk:top=25 weighting=invvol select:robust exec:realistic fill=next_open lock=1 min_tv=5e+06 cost=50rt expo=1 minyr=-15.8 ystd=63.1 robust=2.255 rmin=0.000 noise_sd=0.165]
2026-09-26T17:30:29Z	discard	strat_l27b2_roll	{"b_hi": 0.65, "b_lo": 0.45, "b_mid": 0.55, "floor_lb": 19, "lookback": 16, "lq_days": 40, "lq_min": 5000000.0, "lq_mode": "strict", "lq_shift": 0.05, "lq_shift_hi": 0.05, "lq_shift_lo": 0.075, "max_dist": 0.055, "regime_ma": 18, "rl_frac": 0.5, "rl_lb": 12, "rl_w": 0.2, "top": 25, "weighting": "invvol"}	25	30.543	-17.906	1.706	29.868	31.189	blind	blind	blind	TRAIN 2.356 <= best 2.525 + margin 0.143 [robust] [risk:top=25 weighting=invvol select:robust exec:realistic fill=next_open lock=1 min_tv=5e+06 cost=50rt expo=1 minyr=-15.9 ystd=54.5 robust=2.356 rmin=0.000 noise_sd=0.143]
2026-09-26T17:30:40Z	discard	strat_l27b2_roll	{"b_hi": 0.65, "b_lo": 0.45, "b_mid": 0.55, "floor_lb": 19, "lookback": 16, "lq_days": 40, "lq_min": 5000000.0, "lq_mode": "strict", "lq_shift": 0.05, "lq_shift_hi": 0.05, "lq_shift_lo": 0.075, "max_dist": 0.055, "regime_ma": 18, "rl_frac": 0.5, "rl_lb": 6, "rl_w": 0.2, "top": 25, "weighting": "invvol"}	25	30.848	-19.792	1.559	29.213	32.426	blind	blind	blind	TRAIN 2.020 <= best 2.525 + margin 0.126 [robust] [risk:top=25 weighting=invvol select:robust exec:realistic fill=next_open lock=1 min_tv=5e+06 cost=50rt expo=1 minyr=-13.3 ystd=54.2 robust=2.020 rmin=0.000 noise_sd=0.126]
2026-09-26T17:31:11Z	discard	strat_l27b2_amihud	{"am_frac": 0.5, "am_lb": 15, "am_w": 0.15, "b_hi": 0.65, "b_lo": 0.45, "b_mid": 0.55, "floor_lb": 19, "lookback": 16, "lq_days": 40, "lq_min": 5000000.0, "lq_mode": "strict", "lq_shift": 0.05, "lq_shift_hi": 0.05, "lq_shift_lo": 0.075, "max_dist": 0.055, "regime_ma": 18, "top": 25, "weighting": "invvol"}	25	34.320	-17.590	1.951	34.688	33.970	blind	blind	blind	TRAIN 2.671 <= best 2.525 + margin 0.155 [robust] [risk:top=25 weighting=invvol select:robust exec:realistic fill=next_open lock=1 min_tv=5e+06 cost=50rt expo=1 minyr=-15.3 ystd=61.8 robust=2.671 rmin=0.000 noise_sd=0.155]
2026-09-26T17:31:22Z	discard	strat_l27b2_amihud	{"am_frac": 0.5, "am_lb": 15, "am_w": 0.25, "b_hi": 0.65, "b_lo": 0.45, "b_mid": 0.55, "floor_lb": 19, "lookback": 16, "lq_days": 40, "lq_min": 5000000.0, "lq_mode": "strict", "lq_shift": 0.05, "lq_shift_hi": 0.05, "lq_shift_lo": 0.075, "max_dist": 0.055, "regime_ma": 18, "top": 25, "weighting": "invvol"}	25	35.287	-18.223	1.936	33.722	36.796	blind	blind	blind	TRAIN 2.452 <= best 2.525 + margin 0.156 [robust] [risk:top=25 weighting=invvol select:robust exec:realistic fill=next_open lock=1 min_tv=5e+06 cost=50rt expo=1 minyr=-18.2 ystd=66.8 robust=2.452 rmin=0.000 noise_sd=0.156]
2026-09-26T17:31:33Z	discard	strat_l27b2_roll	{"b_hi": 0.65, "b_lo": 0.45, "b_mid": 0.55, "floor_lb": 19, "lookback": 16, "lq_days": 40, "lq_min": 5000000.0, "lq_mode": "strict", "lq_shift": 0.05, "lq_shift_hi": 0.05, "lq_shift_lo": 0.075, "max_dist": 0.055, "regime_ma": 18, "rl_frac": 0.5, "rl_lb": 9, "rl_w": -0.15, "top": 25, "weighting": "invvol"}	25	32.452	-17.032	1.905	28.491	36.343	blind	blind	blind	TRAIN 2.147 <= best 2.525 + margin 0.117 [robust] [risk:top=25 weighting=invvol select:robust exec:realistic fill=next_open lock=1 min_tv=5e+06 cost=50rt expo=1 minyr=-15.8 ystd=66.6 robust=2.147 rmin=0.000 noise_sd=0.117]
2026-09-26T17:31:45Z	discard	strat_l27b2_roll	{"b_hi": 0.65, "b_lo": 0.45, "b_mid": 0.55, "floor_lb": 19, "lookback": 16, "lq_days": 40, "lq_min": 5000000.0, "lq_mode": "strict", "lq_shift": 0.05, "lq_shift_hi": 0.05, "lq_shift_lo": 0.075, "max_dist": 0.055, "regime_ma": 18, "rl_frac": 0.5, "rl_lb": 9, "rl_w": -0.05, "top": 25, "weighting": "invvol"}	25	31.645	-17.290	1.830	29.889	33.341	blind	blind	blind	TRAIN 2.305 <= best 2.525 + margin 0.156 [robust] [risk:top=25 weighting=invvol select:robust exec:realistic fill=next_open lock=1 min_tv=5e+06 cost=50rt expo=1 minyr=-15.4 ystd=60.1 robust=2.305 rmin=0.000 noise_sd=0.156]
2026-09-26T17:31:56Z	discard	strat_l27b2_roll	{"b_hi": 0.65, "b_lo": 0.45, "b_mid": 0.55, "floor_lb": 19, "lookback": 16, "lq_days": 40, "lq_min": 5000000.0, "lq_mode": "strict", "lq_shift": 0.05, "lq_shift_hi": 0.05, "lq_shift_lo": 0.075, "max_dist": 0.055, "regime_ma": 18, "rl_frac": 0.5, "rl_lb": 6, "rl_w": -0.1, "top": 25, "weighting": "invvol"}	25	32.359	-16.522	1.959	30.479	34.176	blind	blind	blind	TRAIN 2.321 <= best 2.525 + margin 0.135 [robust] [risk:top=25 weighting=invvol select:robust exec:realistic fill=next_open lock=1 min_tv=5e+06 cost=50rt expo=1 minyr=-16.4 ystd=63.2 robust=2.321 rmin=0.000 noise_sd=0.135]
2026-09-26T17:32:07Z	discard	strat_l27b2_roll	{"b_hi": 0.65, "b_lo": 0.45, "b_mid": 0.55, "floor_lb": 19, "lookback": 16, "lq_days": 40, "lq_min": 5000000.0, "lq_mode": "strict", "lq_shift": 0.05, "lq_shift_hi": 0.05, "lq_shift_lo": 0.075, "max_dist": 0.055, "regime_ma": 18, "rl_frac": 0.5, "rl_lb": 12, "rl_w": -0.1, "top": 25, "weighting": "invvol"}	25	31.547	-17.337	1.820	28.393	34.627	blind	blind	blind	TRAIN 2.133 <= best 2.525 + margin 0.133 [robust] [risk:top=25 weighting=invvol select:robust exec:realistic fill=next_open lock=1 min_tv=5e+06 cost=50rt expo=1 minyr=-15.8 ystd=60.7 robust=2.133 rmin=0.000 noise_sd=0.133]
2026-09-26T17:32:16Z	discard	strat_l27b2_amispread	{"am_frac": 0.5, "am_lb": 15, "am_w": 0.0, "b_hi": 0.65, "b_lo": 0.45, "b_mid": 0.55, "floor_lb": 19, "lookback": 16, "lq_days": 40, "lq_min": 5000000.0, "lq_mode": "strict", "lq_shift": 0.05, "lq_shift_hi": 0.05, "lq_shift_lo": 0.075, "max_dist": 0.055, "regime_ma": 18, "sp_frac": 0.5, "sp_lb": 9, "sp_w": 0.0, "top": 25, "weighting": "invvol"}	25	30.090	-17.220	1.747	28.557	31.568	blind	blind	blind	TRAIN 2.121 <= best 2.525 + margin 0.161 [robust] [risk:top=25 weighting=invvol select:robust exec:realistic fill=next_open lock=1 min_tv=5e+06 cost=50rt expo=1 minyr=-13.6 ystd=56.4 robust=2.121 rmin=0.000 noise_sd=0.161]
2026-09-26T17:32:30Z	discard	strat_l27b2_amispread	{"am_frac": 0.5, "am_lb": 15, "am_w": 0.2, "b_hi": 0.65, "b_lo": 0.45, "b_mid": 0.55, "floor_lb": 19, "lookback": 16, "lq_days": 40, "lq_min": 5000000.0, "lq_mode": "strict", "lq_shift": 0.05, "lq_shift_hi": 0.05, "lq_shift_lo": 0.075, "max_dist": 0.055, "regime_ma": 18, "sp_frac": 0.5, "sp_lb": 9, "sp_w": 0.2, "top": 25, "weighting": "invvol"}	25	35.738	-18.183	1.965	32.803	38.598	blind	blind	blind	TRAIN 2.205 <= best 2.525 + margin 0.213 [robust] [risk:top=25 weighting=invvol select:robust exec:realistic fill=next_open lock=1 min_tv=5e+06 cost=50rt expo=1 minyr=-18.2 ystd=73.8 robust=2.205 rmin=0.000 noise_sd=0.213]
2026-09-26T17:32:43Z	discard	strat_l27b2_amispread	{"am_frac": 0.5, "am_lb": 15, "am_w": 0.1, "b_hi": 0.65, "b_lo": 0.45, "b_mid": 0.55, "floor_lb": 19, "lookback": 16, "lq_days": 40, "lq_min": 5000000.0, "lq_mode": "strict", "lq_shift": 0.05, "lq_shift_hi": 0.05, "lq_shift_lo": 0.075, "max_dist": 0.055, "regime_ma": 18, "sp_frac": 0.5, "sp_lb": 9, "sp_w": 0.2, "top": 25, "weighting": "invvol"}	25	35.073	-16.663	2.105	34.881	35.255	blind	blind	blind	TRAIN 2.449 <= best 2.525 + margin 0.195 [robust] [risk:top=25 weighting=invvol select:robust exec:realistic fill=next_open lock=1 min_tv=5e+06 cost=50rt expo=1 minyr=-14.7 ystd=62.8 robust=2.449 rmin=0.000 noise_sd=0.195]
2026-09-26T17:32:57Z	keep	strat_l27b2_amispread	{"am_frac": 0.5, "am_lb": 12, "am_w": 0.2, "b_hi": 0.65, "b_lo": 0.45, "b_mid": 0.55, "floor_lb": 19, "lookback": 16, "lq_days": 40, "lq_min": 5000000.0, "lq_mode": "strict", "lq_shift": 0.05, "lq_shift_hi": 0.05, "lq_shift_lo": 0.075, "max_dist": 0.055, "regime_ma": 18, "sp_frac": 0.5, "sp_lb": 9, "sp_w": 0.2, "top": 25, "weighting": "invvol"}	25	36.212	-18.674	1.939	34.783	37.590	blind	blind	blind	beats best on robust by 0.304 > margin 0.241 [risk:top=25 weighting=invvol select:robust exec:realistic fill=next_open lock=1 min_tv=5e+06 cost=50rt expo=1 minyr=-18.7 ystd=69.8 robust=2.830 rmin=0.000 noise_sd=0.241]
2026-09-26T17:33:11Z	discard	strat_l27b2_amispread	{"am_frac": 0.5, "am_lb": 15, "am_w": 0.1, "b_hi": 0.65, "b_lo": 0.45, "b_mid": 0.55, "floor_lb": 19, "lookback": 16, "lq_days": 40, "lq_min": 5000000.0, "lq_mode": "strict", "lq_shift": 0.05, "lq_shift_hi": 0.05, "lq_shift_lo": 0.075, "max_dist": 0.055, "regime_ma": 18, "sp_frac": 0.5, "sp_lb": 9, "sp_w": 0.1, "top": 25, "weighting": "invvol"}	25	34.671	-16.767	2.068	36.392	33.051	blind	blind	blind	TRAIN 2.809 <= best 2.830 + margin 0.219 [robust] [risk:top=25 weighting=invvol select:robust exec:realistic fill=next_open lock=1 min_tv=5e+06 cost=50rt expo=1 minyr=-14.0 ystd=60.3 robust=2.809 rmin=0.000 noise_sd=0.219]
2026-09-26T17:33:44Z	discard	strat_l27b2_zeroret	{"b_hi": 0.65, "b_lo": 0.45, "b_mid": 0.55, "floor_lb": 19, "lookback": 16, "lq_days": 40, "lq_min": 5000000.0, "lq_mode": "strict", "lq_shift": 0.05, "lq_shift_hi": 0.05, "lq_shift_lo": 0.075, "max_dist": 0.055, "regime_ma": 18, "top": 25, "weighting": "invvol", "zr_frac": 0.5, "zr_lb": 12, "zr_w": 0.0}	25	30.090	-17.220	1.747	28.557	31.568	blind	blind	blind	TRAIN 2.121 <= best 2.830 + margin 0.161 [robust] [risk:top=25 weighting=invvol select:robust exec:realistic fill=next_open lock=1 min_tv=5e+06 cost=50rt expo=1 minyr=-13.6 ystd=56.4 robust=2.121 rmin=0.000 noise_sd=0.161]
2026-09-26T17:33:55Z	discard	strat_l27b2_zeroret	{"b_hi": 0.65, "b_lo": 0.45, "b_mid": 0.55, "floor_lb": 19, "lookback": 16, "lq_days": 40, "lq_min": 5000000.0, "lq_mode": "strict", "lq_shift": 0.05, "lq_shift_hi": 0.05, "lq_shift_lo": 0.075, "max_dist": 0.055, "regime_ma": 18, "top": 25, "weighting": "invvol", "zr_frac": 0.5, "zr_lb": 12, "zr_w": 0.2}	25	30.139	-18.734	1.609	31.154	29.179	blind	blind	blind	TRAIN 2.243 <= best 2.830 + margin 0.206 [robust] [risk:top=25 weighting=invvol select:robust exec:realistic fill=next_open lock=1 min_tv=5e+06 cost=50rt expo=1 minyr=-16.1 ystd=51.5 robust=2.243 rmin=0.000 noise_sd=0.206]
2026-09-26T17:34:05Z	discard	strat_l27b2_zeroret	{"b_hi": 0.65, "b_lo": 0.45, "b_mid": 0.55, "floor_lb": 19, "lookback": 16, "lq_days": 40, "lq_min": 5000000.0, "lq_mode": "strict", "lq_shift": 0.05, "lq_shift_hi": 0.05, "lq_shift_lo": 0.075, "max_dist": 0.055, "regime_ma": 18, "top": 25, "weighting": "invvol", "zr_frac": 0.5, "zr_lb": 12, "zr_w": -0.2}	25	28.631	-19.378	1.477	24.683	32.512	blind	blind	blind	TRAIN 1.557 <= best 2.830 + margin 0.094 [robust] [risk:top=25 weighting=invvol select:robust exec:realistic fill=next_open lock=1 min_tv=5e+06 cost=50rt expo=1 minyr=-14.8 ystd=69.2 robust=1.557 rmin=0.000 noise_sd=0.094]
2026-09-26T17:34:15Z	discard	strat_l27b2_zeroret	{"b_hi": 0.65, "b_lo": 0.45, "b_mid": 0.55, "floor_lb": 19, "lookback": 16, "lq_days": 40, "lq_min": 5000000.0, "lq_mode": "strict", "lq_shift": 0.05, "lq_shift_hi": 0.05, "lq_shift_lo": 0.075, "max_dist": 0.055, "regime_ma": 18, "top": 25, "weighting": "invvol", "zr_frac": 0.5, "zr_lb": 12, "zr_w": 0.1}	25	32.877	-18.403	1.787	32.981	32.778	blind	blind	blind	TRAIN 2.507 <= best 2.830 + margin 0.154 [robust] [risk:top=25 weighting=invvol select:robust exec:realistic fill=next_open lock=1 min_tv=5e+06 cost=50rt expo=1 minyr=-15.8 ystd=59.8 robust=2.507 rmin=0.000 noise_sd=0.154]
