ts	status	candidate	params	top	train_cagr	train_dd	ret_dd	h1	h2	fwd_cagr	fwd_dd	fwd_bench	note
2026-09-26T20:38:43Z	discard	strat_l29c_spreadz	{"b_hi": 0.65, "b_lo": 0.45, "b_mid": 0.55, "floor_lb": 19, "lookback": 16, "lq_days": 40, "lq_min": 5000000.0, "lq_mode": "strict", "lq_shift": 0.05, "lq_shift_hi": 0.05, "lq_shift_lo": 0.075, "max_dist": 0.055, "regime_ma": 18, "sp_frac": 0.5, "sp_lb": 4, "sz_frac": 0.5, "sz_lb": 24, "sz_w": -0.05, "top": 25, "weighting": "invvol"}	25	30.887	-17.284	1.787	29.862	31.873	blind	blind	blind	TRAIN 2.461 <= best 2.959 + margin 0.160 [robust] [risk:top=25 weighting=invvol select:robust exec:realistic fill=next_open lock=1 min_tv=5e+06 cost=50rt expo=1 minyr=-13.3 ystd=55.8 robust=2.461 rmin=0.000 noise_sd=0.160]
2026-09-26T20:38:58Z	discard	strat_l29c_spreadz	{"b_hi": 0.65, "b_lo": 0.45, "b_mid": 0.55, "floor_lb": 19, "lookback": 16, "lq_days": 40, "lq_min": 5000000.0, "lq_mode": "strict", "lq_shift": 0.05, "lq_shift_hi": 0.05, "lq_shift_lo": 0.075, "max_dist": 0.055, "regime_ma": 18, "sp_frac": 0.5, "sp_lb": 4, "sz_frac": 0.5, "sz_lb": 24, "sz_w": 0.05, "top": 25, "weighting": "invvol"}	25	29.448	-17.220	1.710	28.894	29.978	blind	blind	blind	TRAIN 2.077 <= best 2.959 + margin 0.199 [robust] [risk:top=25 weighting=invvol select:robust exec:realistic fill=next_open lock=1 min_tv=5e+06 cost=50rt expo=1 minyr=-14.2 ystd=51.3 robust=2.077 rmin=0.000 noise_sd=0.199]
2026-09-26T20:39:12Z	discard	strat_l29c_spreadz	{"b_hi": 0.65, "b_lo": 0.45, "b_mid": 0.55, "floor_lb": 19, "lookback": 16, "lq_days": 40, "lq_min": 5000000.0, "lq_mode": "strict", "lq_shift": 0.05, "lq_shift_hi": 0.05, "lq_shift_lo": 0.075, "max_dist": 0.055, "regime_ma": 18, "sp_frac": 0.5, "sp_lb": 4, "sz_frac": 0.5, "sz_lb": 24, "sz_w": -0.1, "top": 25, "weighting": "invvol"}	25	28.918	-17.753	1.629	30.026	27.870	blind	blind	blind	TRAIN 2.258 <= best 2.959 + margin 0.133 [robust] [risk:top=25 weighting=invvol select:robust exec:realistic fill=next_open lock=1 min_tv=5e+06 cost=50rt expo=1 minyr=-16.4 ystd=60.4 robust=2.258 rmin=0.000 noise_sd=0.133]
2026-09-26T20:39:27Z	discard	strat_l29c_randtilt	{"b_hi": 0.65, "b_lo": 0.45, "b_mid": 0.55, "floor_lb": 19, "lookback": 16, "lq_days": 40, "lq_min": 5000000.0, "lq_mode": "strict", "lq_shift": 0.05, "lq_shift_hi": 0.05, "lq_shift_lo": 0.075, "max_dist": 0.055, "regime_ma": 18, "rt_seed": 8, "rt_w": 0.07, "top": 25, "weighting": "invvol"}	25	32.191	-17.288	1.862	29.323	34.984	blind	blind	blind	TRAIN 2.305 <= best 2.959 + margin 0.169 [robust] [risk:top=25 weighting=invvol select:robust exec:realistic fill=next_open lock=1 min_tv=5e+06 cost=50rt expo=1 minyr=-15.3 ystd=60.9 robust=2.305 rmin=0.000 noise_sd=0.169]
2026-09-26T20:39:38Z	discard	strat_l29c_randtilt	{"b_hi": 0.65, "b_lo": 0.45, "b_mid": 0.55, "floor_lb": 19, "lookback": 16, "lq_days": 40, "lq_min": 5000000.0, "lq_mode": "strict", "lq_shift": 0.05, "lq_shift_hi": 0.05, "lq_shift_lo": 0.075, "max_dist": 0.055, "regime_ma": 18, "rt_seed": 9, "rt_w": 0.07, "top": 25, "weighting": "invvol"}	25	29.463	-17.503	1.683	28.744	30.152	blind	blind	blind	TRAIN 2.419 <= best 2.959 + margin 0.189 [robust] [risk:top=25 weighting=invvol select:robust exec:realistic fill=next_open lock=1 min_tv=5e+06 cost=50rt expo=1 minyr=-13.9 ystd=51.4 robust=2.419 rmin=0.000 noise_sd=0.189]
2026-09-26T20:39:49Z	discard	strat_l29c_randtilt	{"b_hi": 0.65, "b_lo": 0.45, "b_mid": 0.55, "floor_lb": 19, "lookback": 16, "lq_days": 40, "lq_min": 5000000.0, "lq_mode": "strict", "lq_shift": 0.05, "lq_shift_hi": 0.05, "lq_shift_lo": 0.075, "max_dist": 0.055, "regime_ma": 18, "rt_seed": 6, "rt_w": 0.15, "top": 25, "weighting": "invvol"}	25	28.540	-16.445	1.735	25.315	31.691	blind	blind	blind	TRAIN 1.876 <= best 2.959 + margin 0.095 [robust] [risk:top=25 weighting=invvol select:robust exec:realistic fill=next_open lock=1 min_tv=5e+06 cost=50rt expo=1 minyr=-14.4 ystd=54.3 robust=1.876 rmin=0.000 noise_sd=0.095]
2026-09-26T20:40:00Z	discard	strat_l29c_randtilt	{"b_hi": 0.65, "b_lo": 0.45, "b_mid": 0.55, "floor_lb": 19, "lookback": 16, "lq_days": 40, "lq_min": 5000000.0, "lq_mode": "strict", "lq_shift": 0.05, "lq_shift_hi": 0.05, "lq_shift_lo": 0.075, "max_dist": 0.055, "regime_ma": 18, "rt_seed": 7, "rt_w": 0.15, "top": 25, "weighting": "invvol"}	25	29.431	-17.652	1.667	27.268	31.528	blind	blind	blind	TRAIN 2.056 <= best 2.959 + margin 0.178 [robust] [risk:top=25 weighting=invvol select:robust exec:realistic fill=next_open lock=1 min_tv=5e+06 cost=50rt expo=1 minyr=-16.7 ystd=57.3 robust=2.056 rmin=0.000 noise_sd=0.178]
