ts	status	candidate	params	top	train_cagr	train_dd	ret_dd	h1	h2	fwd_cagr	fwd_dd	fwd_bench	note
2026-09-15T03:34:35Z	discard	strat_floorhigh	{"floor_lb": 18, "lookback": 15, "max_dist": 0.03, "max_hold": 6, "regime_ma": 10, "weak_exp": 0.9}	25	44.232	-49.636	0.891	36.928	51.559	67.695	-17.966	14.717	DD -49.6% breaches floor/slack [risk:max_hold=6 select:cagr]
2026-09-15T03:34:38Z	discard	strat_floorbreak	{"floor_lb": 18, "lookback": 15, "max_dist": 0.03, "regime_ma": 10, "weak_exp": 1.0}	25	20.998	-48.635	0.432	18.340	23.587	14.883	-26.332	14.717	TRAIN 21.00% <= best 33.79% [cagr] [risk:none select:cagr]
2026-09-15T03:34:42Z	discard	strat_floorbreak	{"floor_lb": 16, "lookback": 15, "max_dist": 0.03, "regime_ma": 10, "weak_exp": 1.0}	25	21.095	-45.965	0.459	16.672	25.468	14.450	-27.318	14.717	TRAIN 21.09% <= best 33.79% [cagr] [risk:none select:cagr]
2026-09-15T03:34:50Z	keep	strat_floorhightier	{"b_hi": 0.65, "b_lo": 0.45, "b_mid": 0.55, "floor_lb": 18, "lookback": 15, "max_dist": 0.03, "regime_ma": 10}	25	35.507	-18.331	1.937	11.927	62.602	28.752	-19.701	14.717	beats best on cagr [risk:none select:cagr]
2026-09-15T03:34:54Z	discard	strat_floorhightier	{"b_hi": 0.5, "b_lo": 0.2, "b_mid": 0.35, "floor_lb": 18, "lookback": 15, "max_dist": 0.03, "regime_ma": 10}	25	45.195	-46.750	0.967	35.781	54.779	53.713	-19.591	14.717	DD -46.8% breaches floor/slack [risk:none select:cagr]
2026-09-15T03:34:57Z	discard	strat_floorhigh	{"floor_lb": 16, "lookback": 15, "max_dist": 0.03, "max_hold": 6, "regime_ma": 10, "weak_exp": 0.9}	25	42.493	-53.467	0.795	43.421	41.613	71.127	-19.228	14.717	DD -53.5% breaches floor/slack [risk:max_hold=6 select:cagr]
2026-09-15T03:36:24Z	discard	strat_floorhighskip	{"floor_lb": 18, "lookback": 15, "max_dist": 0.03, "regime_ma": 10, "skip_q": 0.9, "weak_exp": 0.4}	25	35.729	-38.747	0.922	31.470	39.919	43.741	-23.062	14.717	DD -38.7% breaches floor/slack [risk:none select:cagr]
2026-09-15T03:36:28Z	discard	strat_highbase	{"floor_lb": 18, "lookback": 15, "max_dist": 0.03, "regime_ma": 10, "weak_exp": 0.4}	25	23.044	-25.369	0.908	12.433	34.093	33.070	-15.912	14.717	TRAIN 23.04% <= best 35.51% [cagr] [risk:none select:cagr]
2026-09-15T03:36:39Z	discard	strat_floorhighskip	{"floor_lb": 24, "lookback": 15, "max_dist": 0.1, "regime_ma": 6, "skip_q": 0.9, "weak_exp": 0.4}	25	26.342	-32.905	0.801	15.314	37.839	21.269	-23.457	14.717	TRAIN 26.34% <= best 35.51% [cagr] [risk:none select:cagr]
2026-09-15T03:36:51Z	discard	strat_floorhighskiptier	{"b_hi": 0.65, "b_lo": 0.45, "b_mid": 0.55, "floor_lb": 18, "lookback": 15, "max_dist": 0.03, "regime_ma": 10, "skip_q": 0.9}	25	24.748	-20.617	1.200	10.182	40.426	24.587	-23.629	14.717	TRAIN 24.75% <= best 35.51% [cagr] [risk:none select:cagr]
2026-09-20T12:50:00Z	discard	strat_floorhigh	{"floor_lb": 18, "lookback": 15, "max_dist": 0.03, "regime_ma": 10, "trail_k": 0.2, "weak_exp": 0.4}	25	39.715	-45.142	0.880	32.965	46.470	43.620	-17.535	14.717	DD -45.1% breaches floor/slack [risk:trail_k=0.2 select:cagr]
2026-09-20T12:50:10Z	discard	strat_floorhigh	{"floor_lb": 18, "lookback": 15, "max_dist": 0.03, "regime_ma": 10, "trail_k": 0.1, "weak_exp": 0.4}	25	36.020	-49.414	0.729	34.422	37.562	41.872	-18.272	14.717	DD -49.4% breaches floor/slack [risk:trail_k=0.1 select:cagr]
2026-09-20T12:50:19Z	discard	strat_floorhightier	{"b_hi": 0.65, "b_lo": 0.45, "b_mid": 0.55, "floor_lb": 18, "lookback": 15, "max_dist": 0.03, "regime_ma": 10, "trail_k": 0.2}	25	30.137	-19.195	1.570	12.304	49.772	26.276	-19.603	14.717	TRAIN 30.14% <= best 35.51% [cagr] [risk:trail_k=0.2 select:cagr]
2026-09-20T12:50:24Z	discard	strat_floorhightier	{"b_hi": 0.6, "b_lo": 0.4, "b_mid": 0.5, "floor_lb": 18, "lookback": 15, "max_dist": 0.03, "regime_ma": 10}	25	43.798	-25.722	1.703	24.707	64.717	37.422	-19.701	14.717	DD -25.7% breaches floor/slack [risk:none select:cagr]
2026-09-20T12:50:28Z	discard	strat_floorhightier	{"b_hi": 0.7, "b_lo": 0.5, "b_mid": 0.6, "floor_lb": 18, "lookback": 15, "max_dist": 0.03, "regime_ma": 10}	25	32.474	-14.749	2.202	10.104	58.023	24.900	-15.875	14.717	TRAIN 32.47% <= best 35.51% [cagr] [risk:none select:cagr]
2026-09-20T12:50:33Z	discard	strat_floorhightier	{"b_hi": 0.65, "b_lo": 0.45, "b_mid": 0.55, "floor_lb": 18, "lookback": 12, "max_dist": 0.03, "regime_ma": 10}	25	34.528	-18.331	1.884	11.927	60.315	28.612	-19.701	14.717	TRAIN 34.53% <= best 35.51% [cagr] [risk:none select:cagr]
2026-09-20T12:50:37Z	discard	strat_floorhightier	{"b_hi": 0.65, "b_lo": 0.45, "b_mid": 0.55, "floor_lb": 18, "lookback": 18, "max_dist": 0.03, "regime_ma": 10}	25	35.260	-18.331	1.924	11.927	62.024	28.923	-19.209	14.717	TRAIN 35.26% <= best 35.51% [cagr] [risk:none select:cagr]
2026-09-20T12:50:42Z	discard	strat_floorhighskip	{"floor_lb": 18, "lookback": 15, "max_dist": 0.03, "regime_ma": 10, "skip_q": 0.95, "weak_exp": 0.4}	25	36.199	-44.150	0.820	36.711	35.712	42.752	-22.598	14.717	DD -44.1% breaches floor/slack [risk:none select:cagr]
2026-09-20T13:02:53Z	discard	strat_floorhightier	{"b_hi": 0.65, "b_lo": 0.45, "b_mid": 0.55, "floor_lb": 15, "lookback": 15, "max_dist": 0.03, "regime_ma": 10}	25	35.455	-19.806	1.790	18.242	54.197	29.204	-23.174	14.717	TRAIN 35.46% <= best 35.51% [cagr] [risk:none select:cagr]
2026-09-20T13:03:19Z	discard	strat_floorhightier	{"b_hi": 0.65, "b_lo": 0.45, "b_mid": 0.55, "floor_lb": 21, "lookback": 15, "max_dist": 0.03, "regime_ma": 10}	25	33.609	-20.950	1.604	7.780	63.981	20.768	-20.226	14.717	TRAIN 33.61% <= best 35.51% [cagr] [risk:none select:cagr]
2026-09-20T13:03:30Z	keep	strat_floorhightier	{"b_hi": 0.65, "b_lo": 0.45, "b_mid": 0.55, "floor_lb": 18, "lookback": 15, "max_dist": 0.02, "regime_ma": 10}	25	37.415	-17.457	2.143	16.384	60.998	27.756	-20.044	14.717	beats best on cagr [risk:none select:cagr]
2026-09-20T13:03:40Z	discard	strat_floorhightier	{"b_hi": 0.65, "b_lo": 0.45, "b_mid": 0.55, "floor_lb": 18, "lookback": 15, "max_dist": 0.04, "regime_ma": 10}	25	36.284	-18.331	1.979	13.657	62.041	28.128	-19.604	14.717	TRAIN 36.28% <= best 37.41% [cagr] [risk:none select:cagr]
2026-09-20T13:03:50Z	keep	strat_floorhightier	{"b_hi": 0.65, "b_lo": 0.45, "b_mid": 0.55, "floor_lb": 18, "lookback": 15, "max_dist": 0.05, "regime_ma": 10}	25	37.639	-17.288	2.177	17.163	60.486	27.588	-19.784	14.717	beats best on cagr [risk:none select:cagr]
2026-09-20T13:04:00Z	discard	strat_floorhightier	{"b_hi": 0.65, "b_lo": 0.45, "b_mid": 0.55, "floor_lb": 18, "lookback": 15, "max_dist": 0.03, "regime_ma": 8}	25	33.019	-21.414	1.542	9.862	59.630	32.433	-18.752	14.717	TRAIN 33.02% <= best 37.64% [cagr] [risk:none select:cagr]
2026-09-20T13:04:09Z	discard	strat_floorhightier	{"b_hi": 0.65, "b_lo": 0.45, "b_mid": 0.55, "floor_lb": 18, "lookback": 15, "max_dist": 0.03, "regime_ma": 12}	25	36.539	-18.331	1.993	15.620	59.999	28.471	-20.032	14.717	TRAIN 36.54% <= best 37.64% [cagr] [risk:none select:cagr]
2026-09-20T13:04:38Z	discard	strat_floorhightiervol	{"b_hi": 0.65, "b_lo": 0.45, "b_mid": 0.55, "floor_lb": 18, "lookback": 15, "max_dist": 0.05, "regime_ma": 10}	25	28.880	-17.317	1.668	12.882	46.240	21.141	-12.521	14.717	TRAIN 28.88% <= best 37.64% [cagr] [risk:none select:cagr]
2026-09-20T13:04:41Z	discard	strat_floortrendq	{"b_hi": 0.65, "b_lo": 0.45, "b_mid": 0.55, "floor_lb": 18, "lookback": 15, "max_dist": 0.05, "regime_ma": 10}	25	22.568	-17.829	1.266	9.475	36.508	9.856	-10.938	14.717	TRAIN 22.57% <= best 37.64% [cagr] [risk:none select:cagr]
2026-09-20T13:04:45Z	discard	strat_floortrendq	{"b_hi": 0.65, "b_lo": 0.45, "b_mid": 0.55, "floor_lb": 18, "lookback": 15, "max_dist": 0.05, "regime_ma": 10, "trend_lb": 6}	25	20.187	-16.907	1.194	7.161	34.078	11.921	-14.342	14.717	TRAIN 20.19% <= best 37.64% [cagr] [risk:none select:cagr]
2026-09-20T13:06:03Z	discard	strat_floorhighskip	{"floor_lb": 18, "lookback": 15, "max_dist": 0.03, "regime_ma": 10, "skip_q": 0.85, "weak_exp": 0.4}	25	33.094	-38.151	0.867	25.416	40.852	36.911	-23.984	14.717	TRAIN 33.09% <= best 37.64% [cagr] [risk:none select:cagr]
2026-09-20T13:06:12Z	discard	strat_floorhigh	{"floor_lb": 18, "lookback": 15, "max_dist": 0.03, "regime_ma": 10, "trail_k": 0.3, "weak_exp": 0.4}	25	39.479	-45.512	0.867	33.781	45.137	48.310	-16.418	14.717	DD -45.5% breaches floor/slack [risk:trail_k=0.3 select:cagr]
2026-09-20T13:06:21Z	discard	strat_floorhigh	{"floor_lb": 18, "lookback": 15, "max_dist": 0.03, "regime_ma": 10, "trail_k": 0.4, "weak_exp": 0.4}	25	42.002	-45.511	0.923	35.525	48.466	52.013	-17.904	14.717	DD -45.5% breaches floor/slack [risk:trail_k=0.4 select:cagr]
2026-09-20T13:07:19Z	discard	strat_floorhightier	{"b_hi": 0.65, "b_lo": 0.45, "b_mid": 0.55, "floor_lb": 18, "lookback": 15, "max_dist": 0.06, "regime_ma": 10}	25	36.595	-17.124	2.137	17.068	58.241	27.259	-19.143	14.717	TRAIN 36.60% <= best 37.64% [cagr] [risk:none select:cagr]
2026-09-20T13:07:23Z	discard	strat_floorhightier	{"b_hi": 0.65, "b_lo": 0.45, "b_mid": 0.55, "floor_lb": 18, "lookback": 15, "max_dist": 0.07, "regime_ma": 10}	25	35.594	-16.830	2.115	16.453	56.768	28.095	-19.611	14.717	TRAIN 35.59% <= best 37.64% [cagr] [risk:none select:cagr]
2026-09-20T13:07:27Z	discard	strat_floorhightier	{"b_hi": 0.65, "b_lo": 0.45, "b_mid": 0.55, "floor_lb": 18, "lookback": 15, "max_dist": 0.08, "regime_ma": 10}	25	35.693	-16.980	2.102	17.129	56.127	28.230	-20.219	14.717	TRAIN 35.69% <= best 37.64% [cagr] [risk:none select:cagr]
2026-09-20T13:08:41Z	discard	strat_floorhightier	{"b_hi": 0.65, "b_lo": 0.45, "b_mid": 0.55, "floor_lb": 15, "lookback": 15, "max_dist": 0.05, "regime_ma": 10}	25	37.091	-16.966	2.186	20.879	54.570	28.645	-22.649	14.717	TRAIN 37.09% <= best 37.64% [cagr] [risk:none select:cagr]
2026-09-20T13:08:46Z	discard	strat_floorhightier	{"b_hi": 0.65, "b_lo": 0.45, "b_mid": 0.55, "floor_lb": 21, "lookback": 15, "max_dist": 0.05, "regime_ma": 10}	25	36.302	-20.887	1.738	11.561	64.986	18.355	-21.100	14.717	TRAIN 36.30% <= best 37.64% [cagr] [risk:none select:cagr]
2026-09-20T13:08:50Z	discard	strat_floorhightier	{"b_hi": 0.65, "b_lo": 0.45, "b_mid": 0.55, "floor_lb": 18, "lookback": 12, "max_dist": 0.05, "regime_ma": 10}	25	36.317	-17.288	2.101	17.163	57.490	27.666	-19.784	14.717	TRAIN 36.32% <= best 37.64% [cagr] [risk:none select:cagr]
2026-09-20T13:08:54Z	discard	strat_floorhightier	{"b_hi": 0.65, "b_lo": 0.45, "b_mid": 0.55, "floor_lb": 18, "lookback": 18, "max_dist": 0.05, "regime_ma": 10}	25	37.445	-17.288	2.166	17.163	60.045	27.758	-19.293	14.717	TRAIN 37.44% <= best 37.64% [cagr] [risk:none select:cagr]
2026-09-20T13:09:51Z	discard	strat_floorhightier	{"b_hi": 0.6, "b_lo": 0.4, "b_mid": 0.5, "floor_lb": 18, "lookback": 15, "max_dist": 0.05, "regime_ma": 10}	25	46.104	-23.156	1.991	30.918	62.222	35.898	-19.784	14.717	DD -23.2% breaches floor/slack [risk:none select:cagr]
2026-09-20T13:09:55Z	discard	strat_floorhightier	{"b_hi": 0.7, "b_lo": 0.5, "b_mid": 0.6, "floor_lb": 18, "lookback": 15, "max_dist": 0.05, "regime_ma": 10}	25	34.337	-12.017	2.857	14.871	55.962	23.967	-15.838	14.717	TRAIN 34.34% <= best 37.64% [cagr] [risk:none select:cagr]
2026-09-20T13:10:47Z	discard	strat_floorhightiervol	{"b_hi": 0.65, "b_lo": 0.45, "b_mid": 0.55, "floor_lb": 18, "lookback": 15, "max_dist": 0.05, "regime_ma": 10, "vol_q": 0.85}	25	30.405	-18.108	1.679	16.275	45.473	25.686	-17.890	14.717	TRAIN 30.40% <= best 37.64% [cagr] [risk:none select:cagr]
2026-09-20T13:10:50Z	discard	strat_floorhightiervol	{"b_hi": 0.65, "b_lo": 0.45, "b_mid": 0.55, "floor_lb": 18, "lookback": 15, "max_dist": 0.05, "regime_ma": 10, "vol_q": 0.9}	25	26.266	-17.796	1.476	13.493	39.780	27.262	-17.264	14.717	TRAIN 26.27% <= best 37.64% [cagr] [risk:none select:cagr]
2026-09-20T13:10:55Z	keep	strat_floorhightier	{"b_hi": 0.65, "b_lo": 0.45, "b_mid": 0.55, "floor_lb": 18, "lookback": 15, "max_dist": 0.05, "regime_ma": 12}	25	38.675	-17.164	2.253	21.134	57.761	27.085	-20.115	14.717	beats best on cagr [risk:none select:cagr]
2026-09-20T13:11:00Z	discard	strat_floorhighcomp	{"b_hi": 0.65, "b_lo": 0.45, "b_mid": 0.55, "floor_lb": 18, "lookback": 15, "max_dist": 0.05, "regime_ma": 10}	25	36.680	-17.594	2.085	16.235	59.514	28.007	-19.792	14.717	TRAIN 36.68% <= best 38.68% [cagr] [risk:none select:cagr]
2026-09-20T13:11:04Z	discard	strat_floorhighcomp	{"b_hi": 0.65, "b_lo": 0.45, "b_mid": 0.55, "floor_lb": 18, "lookback": 15, "max_dist": 0.03, "regime_ma": 10}	25	35.698	-18.542	1.925	12.189	62.688	28.793	-19.701	14.717	TRAIN 35.70% <= best 38.68% [cagr] [risk:none select:cagr]
2026-09-20T13:12:23Z	keep	strat_floorhightier	{"b_hi": 0.65, "b_lo": 0.45, "b_mid": 0.55, "floor_lb": 18, "lookback": 15, "max_dist": 0.05, "regime_ma": 14}	25	39.583	-16.824	2.353	24.031	56.225	30.218	-19.647	14.717	beats best on cagr [risk:none select:cagr]
2026-09-20T13:12:27Z	discard	strat_floorhightier	{"b_hi": 0.65, "b_lo": 0.45, "b_mid": 0.55, "floor_lb": 15, "lookback": 15, "max_dist": 0.05, "regime_ma": 12}	25	37.966	-16.966	2.238	24.285	52.411	28.728	-22.649	14.717	TRAIN 37.97% <= best 39.58% [cagr] [risk:none select:cagr]
2026-09-20T13:12:31Z	discard	strat_floorhightier	{"b_hi": 0.65, "b_lo": 0.45, "b_mid": 0.55, "floor_lb": 18, "lookback": 18, "max_dist": 0.05, "regime_ma": 12}	25	38.515	-17.164	2.244	21.134	57.405	27.255	-19.626	14.717	TRAIN 38.52% <= best 39.58% [cagr] [risk:none select:cagr]
2026-09-20T13:13:22Z	keep	strat_floorhightier	{"b_hi": 0.65, "b_lo": 0.45, "b_mid": 0.55, "floor_lb": 18, "lookback": 15, "max_dist": 0.05, "regime_ma": 16}	25	40.356	-16.866	2.393	27.671	53.622	32.952	-19.647	14.717	beats best on cagr [risk:none select:cagr]
2026-09-20T13:13:36Z	keep	strat_floorhightier	{"b_hi": 0.65, "b_lo": 0.45, "b_mid": 0.55, "floor_lb": 18, "lookback": 15, "max_dist": 0.05, "regime_ma": 18}	25	41.277	-16.866	2.447	29.393	53.622	37.398	-17.865	14.717	beats best on cagr [risk:none select:cagr]
2026-09-20T13:13:40Z	discard	strat_floorhightier	{"b_hi": 0.65, "b_lo": 0.45, "b_mid": 0.55, "floor_lb": 18, "lookback": 15, "max_dist": 0.05, "regime_ma": 20}	25	38.400	-22.042	1.742	30.272	46.622	37.913	-17.865	14.717	TRAIN 38.40% <= best 41.28% [cagr] [risk:none select:cagr]
2026-09-20T13:13:50Z	discard	strat_floorhightier	{"b_hi": 0.65, "b_lo": 0.45, "b_mid": 0.55, "floor_lb": 18, "lookback": 15, "max_dist": 0.05, "regime_ma": 22}	25	40.075	-22.042	1.818	33.522	46.622	37.630	-17.865	14.717	TRAIN 40.07% <= best 41.28% [cagr] [risk:none select:cagr]
2026-09-20T13:13:54Z	discard	strat_floorhightier	{"b_hi": 0.65, "b_lo": 0.45, "b_mid": 0.55, "floor_lb": 15, "lookback": 15, "max_dist": 0.05, "regime_ma": 18}	25	41.280	-16.795	2.458	33.845	48.754	38.887	-22.649	14.717	TRAIN 41.28% <= best 41.28% [cagr] [risk:none select:cagr]
2026-09-20T13:14:28Z	discard	strat_floorhightier	{"b_hi": 0.65, "b_lo": 0.45, "b_mid": 0.55, "floor_lb": 18, "lookback": 18, "max_dist": 0.05, "regime_ma": 18}	25	41.218	-16.866	2.444	29.393	53.497	37.666	-17.865	14.717	TRAIN 41.22% <= best 41.28% [cagr] [risk:none select:cagr]
2026-09-20T13:14:32Z	discard	strat_floorhightier	{"b_hi": 0.6, "b_lo": 0.4, "b_mid": 0.5, "floor_lb": 18, "lookback": 15, "max_dist": 0.05, "regime_ma": 18}	25	46.226	-22.042	2.097	38.850	53.622	39.548	-17.865	14.717	DD -22.0% breaches floor/slack [risk:none select:cagr]
2026-09-20T13:16:36Z	discard	strat_floorhighspons	{"b_hi": 0.65, "b_lo": 0.45, "b_mid": 0.55, "floor_lb": 18, "lookback": 15, "max_dist": 0.05, "regime_ma": 18}	25	24.049	-15.047	1.598	23.473	24.601	9.708	-22.460	14.717	TRAIN 24.05% <= best 41.28% [cagr] [risk:none select:cagr]
2026-09-20T13:17:03Z	discard	strat_floorhightier	{"b_hi": 0.7, "b_lo": 0.5, "b_mid": 0.6, "floor_lb": 18, "lookback": 15, "max_dist": 0.05, "regime_ma": 18}	25	36.808	-15.464	2.380	27.221	46.622	27.731	-19.647	14.717	TRAIN 36.81% <= best 41.28% [cagr] [risk:none select:cagr]
2026-09-20T13:28:05Z	discard	strat_floorhightier	{"b_hi": 0.65, "b_lo": 0.45, "b_mid": 0.55, "floor_lb": 18, "lookback": 15, "max_dist": 0.045, "regime_ma": 18}	25	40.149	-18.571	2.162	26.683	54.319	38.578	-17.904	14.717	TRAIN 40.15% <= best 41.28% [cagr] [risk:none select:cagr]
2026-09-20T13:28:20Z	discard	strat_floorhightier	{"b_hi": 0.65, "b_lo": 0.45, "b_mid": 0.55, "floor_lb": 18, "lookback": 15, "max_dist": 0.055, "regime_ma": 18}	25	40.604	-17.174	2.364	29.988	51.532	37.099	-17.865	14.717	TRAIN 40.60% <= best 41.28% [cagr] [risk:none select:cagr]
2026-09-20T13:28:29Z	keep	strat_floorhightier	{"b_hi": 0.65, "b_lo": 0.45, "b_mid": 0.55, "floor_lb": 16, "lookback": 15, "max_dist": 0.05, "regime_ma": 18}	25	41.750	-15.766	2.648	32.405	51.274	40.516	-19.611	14.717	beats best on cagr [risk:none select:cagr]
2026-09-20T13:28:41Z	discard	strat_floorhightier	{"b_hi": 0.65, "b_lo": 0.45, "b_mid": 0.55, "floor_lb": 17, "lookback": 15, "max_dist": 0.05, "regime_ma": 18}	25	39.042	-16.169	2.415	30.563	47.638	39.334	-19.139	14.717	TRAIN 39.04% <= best 41.75% [cagr] [risk:none select:cagr]
2026-09-20T13:28:51Z	keep	strat_floorhightier	{"b_hi": 0.65, "b_lo": 0.45, "b_mid": 0.55, "floor_lb": 19, "lookback": 15, "max_dist": 0.05, "regime_ma": 18}	25	44.457	-16.025	2.774	30.659	58.968	33.510	-13.639	14.717	beats best on cagr [risk:none select:cagr]
2026-09-20T13:29:00Z	discard	strat_floorhightier	{"b_hi": 0.65, "b_lo": 0.45, "b_mid": 0.55, "floor_lb": 20, "lookback": 15, "max_dist": 0.05, "regime_ma": 18}	25	43.190	-16.272	2.654	28.160	59.160	30.878	-16.908	14.717	TRAIN 43.19% <= best 44.46% [cagr] [risk:none select:cagr]
2026-09-20T13:29:10Z	discard	strat_floorhightier	{"b_hi": 0.65, "b_lo": 0.45, "b_mid": 0.55, "floor_lb": 18, "lookback": 14, "max_dist": 0.05, "regime_ma": 18}	25	40.795	-16.866	2.419	29.393	52.600	37.398	-17.865	14.717	TRAIN 40.79% <= best 44.46% [cagr] [risk:none select:cagr]
2026-09-20T13:29:12Z	discard	strat_floorhightierhold	{"b_hi": 0.65, "b_lo": 0.45, "b_mid": 0.55, "floor_lb": 18, "lookback": 15, "max_dist": 0.05, "max_hold": 6, "regime_ma": 18}	25	42.024	-16.824	2.498	29.802	54.747	38.993	-18.061	14.717	TRAIN 42.02% <= best 44.46% [cagr] [risk:max_hold=6 select:cagr]
2026-09-20T13:29:18Z	discard	strat_floorhightier	{"b_hi": 0.65, "b_lo": 0.45, "b_mid": 0.55, "floor_lb": 18, "lookback": 16, "max_dist": 0.05, "regime_ma": 18}	25	41.297	-16.866	2.449	29.393	53.666	37.666	-17.865	14.717	TRAIN 41.30% <= best 44.46% [cagr] [risk:none select:cagr]
2026-09-20T13:29:28Z	discard	strat_floorhightier	{"b_hi": 0.62, "b_lo": 0.42, "b_mid": 0.52, "floor_lb": 18, "lookback": 15, "max_dist": 0.05, "regime_ma": 18}	25	43.516	-22.042	1.974	33.630	53.622	39.548	-17.865	14.717	TRAIN 43.52% <= best 44.46% [cagr] [risk:none select:cagr]
2026-09-20T13:29:33Z	discard	strat_floorhightierhold	{"b_hi": 0.65, "b_lo": 0.45, "b_mid": 0.55, "floor_lb": 19, "lookback": 15, "max_dist": 0.05, "max_hold": 3, "regime_ma": 18}	25	43.628	-20.954	2.082	32.889	54.676	34.521	-16.366	14.717	TRAIN 43.63% <= best 44.46% [cagr] [risk:max_hold=3 select:cagr]
2026-09-20T13:29:39Z	discard	strat_floorhightier	{"b_hi": 0.68, "b_lo": 0.48, "b_mid": 0.58, "floor_lb": 18, "lookback": 15, "max_dist": 0.05, "regime_ma": 18}	25	37.271	-16.866	2.210	23.733	51.557	30.819	-17.865	14.717	TRAIN 37.27% <= best 44.46% [cagr] [risk:none select:cagr]
2026-09-20T13:29:44Z	discard	strat_floorhightierhold	{"b_hi": 0.65, "b_lo": 0.45, "b_mid": 0.55, "floor_lb": 19, "lookback": 15, "max_dist": 0.05, "max_hold": 9, "regime_ma": 18}	25	43.798	-16.875	2.595	30.580	57.644	32.102	-13.639	14.717	TRAIN 43.80% <= best 44.46% [cagr] [risk:max_hold=9 select:cagr]
2026-09-20T13:29:51Z	discard	strat_floorhightier	{"b_hi": 0.65, "b_lo": 0.45, "b_mid": 0.55, "floor_lb": 18, "lookback": 15, "max_dist": 0.05, "regime_ma": 17}	25	40.865	-16.866	2.423	28.621	53.622	32.372	-17.865	14.717	TRAIN 40.86% <= best 44.46% [cagr] [risk:none select:cagr]
2026-09-20T13:29:54Z	discard	strat_floorhighpart	{"b_hi": 0.65, "b_lo": 0.45, "b_mid": 0.55, "floor_lb": 19, "lookback": 15, "max_dist": 0.05, "p_min": 0.5, "part_lb": 6, "regime_ma": 18}	25	43.798	-16.667	2.628	29.924	58.404	31.845	-13.747	14.717	TRAIN 43.80% <= best 44.46% [cagr] [risk:none select:cagr]
2026-09-20T13:29:59Z	discard	strat_floorhightier	{"b_hi": 0.65, "b_lo": 0.45, "b_mid": 0.55, "floor_lb": 18, "lookback": 15, "max_dist": 0.05, "regime_ma": 19}	25	41.590	-22.042	1.887	29.982	53.622	37.931	-17.865	14.717	TRAIN 41.59% <= best 44.46% [cagr] [risk:none select:cagr]
2026-09-20T13:30:04Z	discard	strat_floorhighpart	{"b_hi": 0.65, "b_lo": 0.45, "b_mid": 0.55, "floor_lb": 19, "lookback": 15, "max_dist": 0.05, "p_min": 0.67, "part_lb": 6, "regime_ma": 18}	25	42.695	-21.708	1.967	25.098	61.772	30.655	-13.747	14.717	TRAIN 42.69% <= best 44.46% [cagr] [risk:none select:cagr]
2026-09-20T13:30:34Z	discard	strat_floorhightierhold	{"b_hi": 0.65, "b_lo": 0.45, "b_mid": 0.55, "floor_lb": 19, "lookback": 15, "max_dist": 0.05, "max_hold": 12, "regime_ma": 18}	25	44.457	-16.025	2.774	30.659	58.968	33.510	-13.639	14.717	TRAIN 44.46% <= best 44.46% [cagr] [risk:max_hold=12 select:cagr]
2026-09-20T13:30:44Z	discard	strat_floorhightierhold	{"b_hi": 0.65, "b_lo": 0.45, "b_mid": 0.55, "floor_lb": 19, "lookback": 15, "max_dist": 0.05, "max_hold": 6, "regime_ma": 18}	25	44.081	-16.565	2.661	29.330	59.710	32.861	-14.269	14.717	TRAIN 44.08% <= best 44.46% [cagr] [risk:max_hold=6 select:cagr]
2026-09-20T13:30:53Z	discard	strat_floorhighpart	{"b_hi": 0.65, "b_lo": 0.45, "b_mid": 0.55, "floor_lb": 19, "lookback": 15, "max_dist": 0.05, "p_min": 0.5, "part_lb": 12, "regime_ma": 18}	25	43.602	-21.454	2.032	26.306	62.294	30.397	-13.747	14.717	TRAIN 43.60% <= best 44.46% [cagr] [risk:none select:cagr]
2026-09-20T13:31:03Z	discard	strat_floorhighpart	{"b_hi": 0.65, "b_lo": 0.45, "b_mid": 0.55, "floor_lb": 19, "lookback": 15, "max_dist": 0.05, "p_min": 0.67, "part_lb": 12, "regime_ma": 18}	25	41.406	-21.975	1.884	22.979	61.541	28.247	-13.630	14.717	TRAIN 41.41% <= best 44.46% [cagr] [risk:none select:cagr]
