ts	status	candidate	params	top	train_cagr	train_dd	ret_dd	h1	h2	fwd_cagr	fwd_dd	fwd_bench	note
2026-09-20T16:18:47Z	discard	strat_concvoltarget	{"b_hi": 0.65, "b_lo": 0.45, "b_mid": 0.55, "cap_full": 20, "cap_weak": 12, "fast_ma": 9, "floor_lb": 19, "lookback": 16, "max_dist": 0.055, "regime_ma": 18, "sustain_hi": 2, "sustain_lo": 4, "tier_lo": 0.55, "tier_mid": 1.0, "vt_lb": 6, "vt_target": 0.25}	20	58.376	-16.662	3.504	46.133	71.003	43.754	-12.121	14.717	TRAIN 58.38% <= best 77.87% [cagr] [risk:none select:cagr]
2026-09-20T16:42:07Z	discard	strat_floorhightiershapeconc	{"b_hi": 0.69, "b_lo": 0.45, "b_mid": 0.55, "cap_full": 20, "cap_weak": 12, "fast_ma": 5, "floor_lb": 19, "lookback": 10, "max_dist": 0.055, "regime_ma": 18, "sustain_hi": 2, "sustain_lo": 3, "tier_lo": 0.85, "tier_mid": 1.0}	15	76.442	-18.473	4.138	66.981	85.963	49.657	-14.374	14.717	TRAIN 76.44% <= best 77.87% [cagr] [risk:none select:cagr]
2026-09-20T16:42:12Z	discard	strat_floorhighbreadthlin	{"b_hi": 0.69, "b_hi_lin": 0.6, "b_lo": 0.45, "b_lo_lin": 0.35, "b_mid": 0.55, "fast_ma": 5, "floor_lb": 19, "lookback": 10, "max_dist": 0.055, "regime_ma": 18, "sustain_hi": 2, "sustain_lo": 3, "tier_lo": 1.0, "tier_mid": 1.0}	15	67.232	-18.473	3.639	59.804	74.635	42.798	-15.392	14.717	TRAIN 67.23% <= best 77.87% [cagr] [risk:none select:cagr]
2026-09-20T16:45:10Z	discard	strat_floorhighhyst	{"b_enter": 0.45, "b_exit": 0.4, "b_hi": 0.69, "b_lo": 0.45, "b_mid": 0.55, "fast_ma": 5, "floor_lb": 19, "lookback": 10, "max_dist": 0.055, "regime_ma": 18, "sustain_hi": 2, "sustain_lo": 3, "tier_lo": 1.0, "tier_mid": 1.0}	15	76.262	-18.973	4.019	67.090	85.475	52.240	-18.646	14.717	TRAIN 76.26% <= best 77.87% [cagr] [risk:none select:cagr]
2026-09-20T16:45:14Z	discard	strat_floorhighrankpersist	{"b_hi": 0.69, "b_lo": 0.45, "b_mid": 0.55, "fast_ma": 5, "floor_lb": 19, "lookback": 10, "max_dist": 0.055, "pers_lb": 12, "pers_w": 0.25, "regime_ma": 18, "sustain_hi": 2, "sustain_lo": 3, "tier_lo": 1.0, "tier_mid": 1.0}	15	66.151	-22.465	2.945	58.966	73.303	48.348	-11.353	14.717	TRAIN 66.15% <= best 77.87% [cagr] [risk:none select:cagr]
2026-09-20T16:45:19Z	discard	strat_floorhighrankpersist	{"b_hi": 0.69, "b_lo": 0.45, "b_mid": 0.55, "fast_ma": 5, "floor_lb": 19, "lookback": 10, "max_dist": 0.055, "pers_lb": 3, "pers_w": -0.25, "regime_ma": 18, "sustain_hi": 2, "sustain_lo": 3, "tier_lo": 1.0, "tier_mid": 1.0}	15	73.442	-20.893	3.515	61.399	85.760	45.307	-20.950	14.717	TRAIN 73.44% <= best 77.87% [cagr] [risk:none select:cagr]
2026-09-20T16:45:42Z	discard	strat_floorhighrankpersist	{"b_hi": 0.69, "b_lo": 0.45, "b_mid": 0.55, "fast_ma": 5, "floor_lb": 19, "lookback": 10, "max_dist": 0.055, "pers_lb": 12, "pers_w": -0.25, "regime_ma": 18, "sustain_hi": 2, "sustain_lo": 3, "tier_lo": 1.0, "tier_mid": 1.0}	15	78.097	-22.058	3.541	72.197	83.912	46.455	-18.150	14.717	DD -22.1% breaches floor/slack [risk:none select:cagr]
2026-09-20T16:50:25Z	keep	strat_floorhighrankpersist	{"b_hi": 0.69, "b_lo": 0.45, "b_mid": 0.55, "fast_ma": 5, "floor_lb": 19, "lookback": 10, "max_dist": 0.055, "pers_lb": 22, "pers_w": -0.4, "regime_ma": 18, "sustain_hi": 2, "sustain_lo": 3, "tier_lo": 1.0, "tier_mid": 1.0}	15	81.228	-18.388	4.417	73.730	88.679	58.533	-21.603	14.717	beats best on cagr [risk:none select:cagr]
2026-09-20T17:02:16Z	keep	strat_floorhighrankpersist	{"b_hi": 0.69, "b_lo": 0.45, "b_mid": 0.55, "fast_ma": 5, "floor_lb": 19, "lookback": 10, "max_dist": 0.055, "max_hold": 4, "pers_lb": 6, "pers_w": -0.16, "regime_ma": 18, "sustain_hi": 2, "sustain_lo": 3, "tier_lo": 1.0, "tier_mid": 1.0}	15	83.933	-19.963	4.204	69.986	98.296	49.889	-16.388	14.717	beats best on cagr [risk:max_hold=4 select:cagr]
2026-09-20T17:02:40Z	discard	strat_floorhightiershapeconc	{"b_hi": 0.69, "b_lo": 0.45, "b_mid": 0.55, "cap_full": 20, "cap_weak": 11, "fast_ma": 5, "floor_lb": 19, "lookback": 10, "max_dist": 0.055, "max_hold": 8, "regime_ma": 18, "sustain_hi": 2, "sustain_lo": 3, "tier_lo": 0.999, "tier_mid": 1.0}	15	81.374	-18.473	4.405	71.604	91.208	54.001	-14.374	14.717	TRAIN 81.37% <= best 83.93% [cagr] [risk:max_hold=8 select:cagr]
2026-09-20T17:06:31Z	discard	strat_floorhightiershapeconc	{"b_hi": 0.69, "b_lo": 0.45, "b_mid": 0.55, "cap_full": 20, "cap_weak": 11, "fast_ma": 5, "floor_lb": 19, "lookback": 10, "max_dist": 0.055, "regime_ma": 18, "sustain_hi": 2, "sustain_lo": 3, "tier_lo": 0.999, "tier_mid": 0.999}	15	80.943	-18.109	4.470	68.805	93.328	56.860	-14.374	14.717	TRAIN 80.94% <= best 83.93% [cagr] [risk:none select:cagr]
2026-09-20T17:06:35Z	discard	strat_floorhightiershapeconc	{"b_hi": 0.69, "b_lo": 0.45, "b_mid": 0.55, "cap_full": 20, "cap_weak": 11, "fast_ma": 5, "floor_lb": 19, "lookback": 10, "max_dist": 0.055, "max_hold": 9, "regime_ma": 18, "sustain_hi": 2, "sustain_lo": 3, "tier_lo": 0.999, "tier_mid": 0.999}	15	80.943	-18.109	4.470	68.805	93.328	57.585	-14.374	14.717	TRAIN 80.94% <= best 83.93% [cagr] [risk:max_hold=9 select:cagr]
2026-09-20T18:35:47Z	keep	strat_l12b2_symcap	{"b_hi": 0.69, "b_lo": 0.45, "b_mid": 0.55, "cap_full": 18, "cap_weak": 12, "fast_ma": 5, "floor_lb": 19, "lookback": 10, "max_dist": 0.055, "max_hold": 4, "pers_lb": 6, "pers_w": -0.16, "regime_ma": 18, "sustain_hi": 2, "sustain_lo": 3, "tier_lo": 0.999, "tier_mid": 0.999}	15	84.923	-19.202	4.423	70.158	100.193	43.084	-15.907	14.717	beats best on cagr [risk:max_hold=4 select:cagr]
2026-09-20T18:36:10Z	discard	strat_l12b_printclose	{"b_hi": 0.69, "b_lo": 0.45, "b_mid": 0.55, "clv_lb": 3, "clv_scale": 0.5, "fast_ma": 5, "floor_lb": 19, "lookback": 10, "max_dist": 0.055, "max_hold": 4, "pers_lb": 6, "pers_w": -0.16, "regime_ma": 18, "sustain_hi": 2, "sustain_lo": 3, "tier_lo": 1.0, "tier_mid": 1.0}	15	81.662	-21.157	3.860	69.765	93.781	56.237	-17.083	14.717	TRAIN 81.66% <= best 84.92% [cagr] [risk:max_hold=4 select:cagr]
2026-09-20T18:36:19Z	discard	strat_l12b2_bandfresh	{"b_hi": 0.69, "b_lo": 0.45, "b_mid": 0.55, "fast_ma": 5, "floor_lb": 19, "lookback": 10, "max_dist": 0.055, "max_hold": 4, "pers_lb": 6, "regime_ma": 18, "sustain_hi": 2, "sustain_lo": 3, "tier_lo": 1.0, "tier_mid": 1.0, "w_full": -0.16, "w_weak": -0.08}	15	83.933	-19.963	4.204	69.986	98.296	49.889	-16.388	14.717	TRAIN 83.93% <= best 84.92% [cagr] [risk:max_hold=4 select:cagr]
2026-09-20T18:37:15Z	discard	strat_l12b_printclose	{"b_hi": 0.69, "b_lo": 0.45, "b_mid": 0.55, "clv_lb": 3, "clv_scale": 0.8, "fast_ma": 5, "floor_lb": 19, "lookback": 10, "max_dist": 0.055, "max_hold": 4, "pers_lb": 6, "pers_w": -0.16, "regime_ma": 18, "sustain_hi": 2, "sustain_lo": 3, "tier_lo": 1.0, "tier_mid": 1.0}	15	79.706	-22.221	3.587	69.129	90.407	51.896	-16.685	14.717	TRAIN 79.71% <= best 84.92% [cagr] [risk:max_hold=4 select:cagr]
2026-09-20T18:37:24Z	discard	strat_l12b2_bandfresh	{"b_hi": 0.69, "b_lo": 0.45, "b_mid": 0.55, "fast_ma": 5, "floor_lb": 19, "lookback": 10, "max_dist": 0.055, "max_hold": 4, "pers_lb": 6, "pers_w_full": -0.16, "pers_w_weak": 0.0, "regime_ma": 18, "sustain_hi": 2, "sustain_lo": 3, "tier_lo": 0.999, "tier_mid": 0.999}	15	85.994	-22.234	3.868	73.786	98.431	44.253	-15.907	14.717	DD -22.2% breaches floor/slack [risk:max_hold=4 select:cagr]
2026-09-20T18:38:08Z	discard	strat_l12b_printclose	{"b_hi": 0.69, "b_lo": 0.45, "b_mid": 0.55, "clv_lb": 4, "clv_scale": 0.65, "fast_ma": 5, "floor_lb": 19, "lookback": 10, "max_dist": 0.055, "max_hold": 4, "pers_lb": 6, "pers_w": -0.16, "regime_ma": 18, "sustain_hi": 2, "sustain_lo": 3, "tier_lo": 1.0, "tier_mid": 1.0}	15	83.238	-22.221	3.746	69.402	97.481	50.215	-18.087	14.717	TRAIN 83.24% <= best 84.92% [cagr] [risk:max_hold=4 select:cagr]
2026-09-20T18:43:11Z	keep	strat_floorhightiershapeconc	{"b_hi": 0.69, "b_lo": 0.45, "b_mid": 0.55, "cap_full": 20, "cap_weak": 11, "fast_ma": 5, "floor_lb": 19, "lookback": 10, "max_dist": 0.055, "max_hold": 3, "regime_ma": 18, "sustain_hi": 2, "sustain_lo": 3, "tier_lo": 0.9999, "tier_mid": 0.9999}	15	85.234	-17.489	4.874	77.896	92.512	53.762	-14.374	14.717	beats best on cagr [risk:max_hold=3 select:cagr]
2026-09-20T18:43:18Z	discard	strat_floorhightiershapeconc	{"b_hi": 0.69, "b_lo": 0.45, "b_mid": 0.55, "cap_full": 15, "cap_weak": 11, "fast_ma": 5, "floor_lb": 19, "lookback": 10, "max_dist": 0.055, "max_hold": 8, "regime_ma": 18, "sustain_hi": 2, "sustain_lo": 3, "tier_lo": 0.9999, "tier_mid": 0.9999}	15	81.738	-18.110	4.513	68.875	94.914	57.307	-14.374	14.717	TRAIN 81.74% <= best 85.23% [cagr] [risk:max_hold=8 select:cagr]
2026-09-20T18:43:26Z	discard	strat_floorhightiershapeconc	{"b_hi": 0.69, "b_lo": 0.45, "b_mid": 0.55, "cap_full": 15, "cap_weak": 11, "fast_ma": 5, "floor_lb": 19, "lookback": 10, "max_dist": 0.055, "max_hold": 6, "regime_ma": 18, "sustain_hi": 2, "sustain_lo": 3, "tier_lo": 0.9999, "tier_mid": 0.9999}	15	79.332	-18.110	4.380	65.744	93.324	58.905	-14.064	14.717	TRAIN 79.33% <= best 85.23% [cagr] [risk:max_hold=6 select:cagr]
2026-09-20T18:47:03Z	discard	strat_floorhighrankpersist	{"b_hi": 0.69, "b_lo": 0.45, "b_mid": 0.55, "fast_ma": 5, "floor_lb": 19, "lookback": 10, "max_dist": 0.055, "max_hold": 2, "pers_lb": 4, "pers_w": -0.18, "regime_ma": 18, "sustain_hi": 2, "sustain_lo": 3, "tier_lo": 1.0, "tier_mid": 1.0}	13	80.877	-15.053	5.373	76.016	85.637	54.114	-16.516	14.717	TRAIN 80.88% <= best 85.23% [cagr] [risk:max_hold=2 select:cagr]
2026-09-20T18:47:10Z	discard	strat_floorhighrankpersist	{"b_hi": 0.69, "b_lo": 0.45, "b_mid": 0.55, "fast_ma": 5, "floor_lb": 19, "lookback": 10, "max_dist": 0.055, "max_hold": 2, "pers_lb": 5, "pers_w": -0.18, "regime_ma": 18, "sustain_hi": 2, "sustain_lo": 3, "tier_lo": 1.0, "tier_mid": 1.0}	13	80.689	-16.639	4.849	77.867	83.422	62.471	-15.487	14.717	TRAIN 80.69% <= best 85.23% [cagr] [risk:max_hold=2 select:cagr]
2026-09-20T19:48:56Z	keep	strat_l13a_concwobble	{"b_hi": 0.69, "b_lo": 0.45, "b_mid": 0.55, "cap_full": 20, "cap_weak": 11, "fast_ma": 5, "floor_lb": 19, "gf_lb": 12, "gf_w": 0.0, "gw_w": 0.12, "lookback": 10, "max_dist": 0.055, "max_hold": 3, "regime_ma": 18, "sustain_hi": 2, "sustain_lo": 3, "tier_lo": 0.9999, "tier_mid": 0.9999}	15	86.616	-17.339	4.995	78.710	94.479	47.694	-14.374	14.717	beats best on cagr [risk:max_hold=3 select:cagr]
2026-09-20T19:52:22Z	keep	strat_l13a_concwobble	{"b_hi": 0.69, "b_lo": 0.45, "b_mid": 0.55, "cap_full": 20, "cap_weak": 11, "fast_ma": 5, "floor_lb": 19, "gf_lb": 12, "gf_w": 0.0, "gw_w": 0.13, "lookback": 10, "max_dist": 0.055, "max_hold": 3, "regime_ma": 18, "sustain_hi": 2, "sustain_lo": 3, "tier_lo": 0.9999, "tier_mid": 0.9999}	15	86.884	-17.339	5.011	78.888	94.842	48.192	-14.374	14.717	beats best on cagr [risk:max_hold=3 select:cagr]
2026-09-20T20:37:35Z	keep	strat_l13a_concwobble	{"b_hi": 0.69, "b_lo": 0.45, "b_mid": 0.55, "cap_full": 20, "cap_weak": 11, "fast_ma": 5, "floor_lb": 19, "gf_lb": 12, "gf_w": 0.0, "gw_w": 0.13, "lookback": 12, "max_dist": 0.055, "max_hold": 3, "regime_ma": 18, "sustain_hi": 2, "sustain_lo": 3, "tier_lo": 0.9999, "tier_mid": 0.9999}	15	88.139	-17.339	5.083	80.144	96.092	49.274	-14.926	14.717	beats best on cagr [risk:max_hold=3 select:cagr]
2026-09-21T08:30:21Z	keep	strat_l15b_insideday	{"b_hi": 0.69, "b_lo": 0.45, "b_mid": 0.55, "cap_full": 20, "cap_weak": 11, "fast_ma": 5, "floor_lb": 19, "gf_lb": 12, "gf_w": 0.0, "gw_w": 0.13, "ids_lb": 3, "ids_w": -0.15, "lookback": 12, "max_dist": 0.055, "max_hold": 3, "regime_ma": 18, "sustain_hi": 2, "sustain_lo": 3, "tier_lo": 0.9999, "tier_mid": 0.9999}	15	93.425	-17.032	5.485	100.620	86.806	52.906	-12.311	14.717	beats best on cagr [risk:max_hold=3 select:cagr]
2026-09-21T08:36:43Z	keep	strat_l15b_insideday	{"b_hi": 0.69, "b_lo": 0.45, "b_mid": 0.55, "cap_full": 20, "cap_weak": 11, "fast_ma": 5, "floor_lb": 19, "gf_lb": 12, "gf_w": 0.0, "gw_w": 0.13, "ids_lb": 3, "ids_w": -0.13, "lookback": 12, "max_dist": 0.055, "max_hold": 3, "regime_ma": 18, "sustain_hi": 2, "sustain_lo": 3, "tier_lo": 0.9999, "tier_mid": 0.9999}	15	94.578	-18.864	5.014	99.318	90.164	54.398	-12.311	14.717	beats best on cagr [risk:max_hold=3 select:cagr]
2026-09-21T08:47:47Z	keep	strat_l15b_insideday	{"b_hi": 0.69, "b_lo": 0.45, "b_mid": 0.55, "cap_full": 20, "cap_weak": 11, "fast_ma": 5, "floor_lb": 19, "gf_lb": 12, "gf_w": 0.0, "gw_w": 0.15, "ids_lb": 3, "ids_w": -0.13, "lookback": 12, "max_dist": 0.055, "max_hold": 3, "regime_ma": 18, "sustain_hi": 2, "sustain_lo": 3, "tier_lo": 0.9999, "tier_mid": 0.9999}	15	96.882	-17.032	5.688	98.302	95.538	48.973	-12.311	14.717	beats best on cagr [risk:max_hold=3 select:cagr]
2026-09-21T18:10:57Z	keep	strat_l19a_balanced	{"b_hi": 0.69, "b_lo": 0.45, "b_mid": 0.55, "cap_full": 20, "cap_weak": 11, "fast_ma": 5, "floor_lb": 19, "gf_lb": 12, "gf_w": 0.0, "gw_w": 0.15, "ids_lb": 3, "ids_w": -0.13, "la_min": 0, "la_w": 0.5, "lookback": 12, "max_dist": 0.055, "max_hold": 3, "or_lb": 6, "or_w": -0.1, "regime_ma": 18, "sustain_hi": 2, "sustain_lo": 3, "tier_lo": 0.9999, "tier_mid": 0.9999}	15	98.682	-15.506	6.364	95.295	101.966	53.148	-10.403	14.717	beats best on cagr [risk:max_hold=3 select:cagr minyr=-14.9 ystd=159.0]
2026-09-23T09:18:39Z	keep	strat_l20b_spread	{"b_hi": 0.69, "b_lo": 0.45, "b_mid": 0.55, "cap_full": 20, "cap_weak": 11, "fast_ma": 5, "floor_lb": 19, "gf_lb": 12, "gf_w": 0.0, "gw_w": 0.15, "ids_lb": 3, "ids_w": -0.13, "la_min": 0, "la_w": 0.5, "lookback": 12, "max_dist": 0.055, "max_hold": 3, "or_lb": 6, "or_w": -0.1, "regime_ma": 18, "sp_frac": 0.5, "sp_lb": 4, "sp_w": -0.05, "sustain_hi": 2, "sustain_lo": 3, "tier_lo": 0.9999, "tier_mid": 0.9999}	15	102.990	-15.506	6.642	100.204	105.682	54.057	-10.381	14.717	beats best on cagr [risk:max_hold=3 select:cagr minyr=-15.0 ystd=172.4]
2026-09-24T09:43:31Z	keep	strat_l21b_spreadz	{"b_hi": 0.69, "b_lo": 0.45, "b_mid": 0.55, "cap_full": 20, "cap_weak": 11, "fast_ma": 5, "floor_lb": 19, "gf_lb": 12, "gf_w": 0.0, "gw_w": 0.15, "ids_lb": 3, "ids_w": -0.13, "la_min": 0, "la_w": 0.5, "lookback": 12, "max_dist": 0.055, "max_hold": 3, "or_lb": 6, "or_w": -0.1, "regime_ma": 18, "sp_frac": 0.5, "sp_lb": 4, "sp_w": -0.05, "sustain_hi": 2, "sustain_lo": 3, "sz_frac": 0.5, "sz_lb": 24, "sz_mode": "z", "sz_w": -0.05, "tier_lo": 0.9999, "tier_mid": 0.9999}	15	104.452	-14.959	6.983	103.998	104.886	54.997	-10.980	14.717	beats best on cagr [risk:max_hold=3 select:cagr minyr=-15.0 ystd=169.9]
