ts	status	candidate	params	top	train_cagr	train_dd	ret_dd	h1	h2	fwd_cagr	fwd_dd	fwd_bench	note
2026-09-20T16:03:06Z	discard	strat_floorhighsustaincond	{"b_hi": 0.57, "b_lo": 0.4, "b_mid": 0.6, "fast_ma": 8, "floor_lb": 19, "lookback": 14, "max_dist": 0.055, "max_hold": 7, "regime_ma": 20, "sustain_hi": 2, "sustain_lo": 6}	15	56.564	-19.946	2.836	50.756	62.309	36.930	-20.245	14.717	TRAIN 56.56% <= best 66.97% [cagr] [risk:max_hold=7 select:cagr]
2026-09-20T16:03:22Z	discard	strat_floorhighsustaincond	{"b_hi": 0.57, "b_lo": 0.4, "b_mid": 0.6, "fast_ma": 8, "floor_lb": 19, "lookback": 14, "max_dist": 0.055, "max_hold": 7, "regime_ma": 20, "sustain_hi": 4, "sustain_lo": 3}	15	65.526	-20.296	3.229	57.013	74.073	40.146	-14.374	14.717	TRAIN 65.53% <= best 66.97% [cagr] [risk:max_hold=7 select:cagr]
2026-09-20T16:03:47Z	discard	strat_floorhighsustaincond	{"b_hi": 0.57, "b_lo": 0.4, "b_mid": 0.6, "fast_ma": 8, "floor_lb": 19, "lookback": 14, "max_dist": 0.055, "max_hold": 7, "regime_ma": 20, "sustain_hi": 2, "sustain_lo": 3}	20	60.887	-18.045	3.374	56.648	65.036	37.825	-13.515	14.717	TRAIN 60.89% <= best 66.97% [cagr] [risk:max_hold=7 select:cagr]
2026-09-20T16:04:05Z	discard	strat_floorhighsustaincond	{"b_hi": 0.57, "b_lo": 0.4, "b_mid": 0.6, "fast_ma": 8, "floor_lb": 19, "lookback": 14, "max_dist": 0.055, "max_hold": 7, "regime_ma": 20, "sustain_hi": 2, "sustain_lo": 3}	25	53.378	-22.985	2.322	50.074	56.595	36.363	-15.452	14.717	TRAIN 53.38% <= best 66.97% [cagr] [risk:max_hold=7 select:cagr]
2026-09-20T16:04:21Z	discard	strat_floorhighsustaincond	{"b_hi": 0.57, "b_lo": 0.4, "b_mid": 0.6, "fast_ma": 9, "floor_lb": 19, "lookback": 14, "max_dist": 0.055, "max_hold": 7, "regime_ma": 19, "sustain_hi": 2, "sustain_lo": 3}	15	65.057	-19.688	3.304	56.104	74.073	39.214	-14.374	14.717	TRAIN 65.06% <= best 66.97% [cagr] [risk:max_hold=7 select:cagr]
2026-09-20T16:04:52Z	discard	strat_floorhighsustaincond	{"b_hi": 0.57, "b_lo": 0.4, "b_mid": 0.6, "fast_ma": 8, "floor_lb": 19, "lookback": 14, "max_dist": 0.055, "max_hold": 7, "regime_ma": 20, "sustain_hi": 3, "sustain_lo": 4}	15	63.214	-21.177	2.985	52.436	74.200	36.444	-18.980	14.717	TRAIN 63.21% <= best 66.97% [cagr] [risk:max_hold=7 select:cagr]
2026-09-20T16:05:49Z	discard	strat_floorhighsustaincond	{"b_hi": 0.57, "b_lo": 0.4, "b_mid": 0.6, "fast_ma": 8, "floor_lb": 18, "lookback": 13, "max_dist": 0.055, "max_hold": 4, "regime_ma": 20, "sustain_hi": 2, "sustain_lo": 3}	15	65.182	-19.429	3.355	63.632	66.673	44.128	-16.379	14.717	TRAIN 65.18% <= best 66.97% [cagr] [risk:max_hold=4 select:cagr]
2026-09-20T16:06:01Z	discard	strat_floorhighsustaincond	{"b_hi": 0.57, "b_lo": 0.4, "b_mid": 0.6, "fast_ma": 8, "floor_lb": 18, "lookback": 14, "max_dist": 0.055, "max_hold": 4, "regime_ma": 20, "sustain_hi": 3, "sustain_lo": 3}	15	64.173	-19.308	3.324	60.201	68.052	45.202	-16.379	14.717	TRAIN 64.17% <= best 66.97% [cagr] [risk:max_hold=4 select:cagr]
2026-09-20T16:06:28Z	discard	strat_floorhighsustaincond	{"b_hi": 0.57, "b_lo": 0.4, "b_mid": 0.6, "fast_ma": 8, "floor_lb": 18, "lookback": 14, "max_dist": 0.055, "max_hold": 4, "regime_ma": 19, "sustain_hi": 2, "sustain_lo": 3}	15	64.121	-19.429	3.300	60.097	68.052	42.869	-16.379	14.717	TRAIN 64.12% <= best 66.97% [cagr] [risk:max_hold=4 select:cagr]
2026-09-20T16:06:37Z	discard	strat_floorhighsustaincond	{"b_hi": 0.57, "b_lo": 0.4, "b_mid": 0.6, "fast_ma": 9, "floor_lb": 18, "lookback": 14, "max_dist": 0.055, "max_hold": 4, "regime_ma": 20, "sustain_hi": 2, "sustain_lo": 3}	15	65.524	-19.429	3.372	62.913	68.052	44.128	-16.379	14.717	TRAIN 65.52% <= best 66.97% [cagr] [risk:max_hold=4 select:cagr]
2026-09-20T16:07:02Z	discard	strat_floorhighsustaincond	{"b_hi": 0.57, "b_lo": 0.4, "b_mid": 0.55, "fast_ma": 8, "floor_lb": 18, "lookback": 14, "max_dist": 0.055, "max_hold": 4, "regime_ma": 20, "sustain_hi": 2, "sustain_lo": 3}	15	64.570	-21.292	3.033	60.995	68.052	45.386	-16.379	14.717	TRAIN 64.57% <= best 66.97% [cagr] [risk:max_hold=4 select:cagr]
2026-09-20T16:07:11Z	discard	strat_floorhighsustaincond	{"b_hi": 0.57, "b_lo": 0.4, "b_mid": 0.6, "fast_ma": 8, "floor_lb": 18, "lookback": 14, "max_dist": 0.055, "max_hold": 5, "regime_ma": 20, "sustain_hi": 2, "sustain_lo": 3}	15	60.983	-20.091	3.035	58.091	63.789	47.283	-16.407	14.717	TRAIN 60.98% <= best 66.97% [cagr] [risk:max_hold=5 select:cagr]
2026-09-20T16:07:23Z	discard	strat_floorhighsustaincond	{"b_hi": 0.57, "b_lo": 0.4, "b_mid": 0.6, "fast_ma": 8, "floor_lb": 18, "lookback": 14, "max_dist": 0.055, "max_hold": 4, "regime_ma": 20, "sustain_hi": 2, "sustain_lo": 2}	15	61.756	-17.796	3.470	63.672	59.950	50.592	-15.799	14.717	TRAIN 61.76% <= best 66.97% [cagr] [risk:max_hold=4 select:cagr]
2026-09-20T16:07:31Z	discard	strat_floorhighsustaincond	{"b_hi": 0.57, "b_lo": 0.4, "b_mid": 0.6, "fast_ma": 8, "floor_lb": 18, "lookback": 15, "max_dist": 0.055, "max_hold": 4, "regime_ma": 20, "sustain_hi": 2, "sustain_lo": 3}	15	65.694	-19.429	3.381	63.590	67.724	44.128	-16.379	14.717	TRAIN 65.69% <= best 66.97% [cagr] [risk:max_hold=4 select:cagr]
2026-09-20T16:07:40Z	discard	strat_floorhighsustaincond	{"b_hi": 0.57, "b_lo": 0.4, "b_mid": 0.6, "fast_ma": 9, "floor_lb": 18, "lookback": 15, "max_dist": 0.055, "max_hold": 4, "regime_ma": 20, "sustain_hi": 2, "sustain_lo": 3}	15	65.358	-19.429	3.364	62.913	67.724	44.128	-16.379	14.717	TRAIN 65.36% <= best 66.97% [cagr] [risk:max_hold=4 select:cagr]
2026-09-20T16:07:49Z	discard	strat_floorhighsustaincond	{"b_hi": 0.57, "b_lo": 0.4, "b_mid": 0.6, "fast_ma": 8, "floor_lb": 18, "lookback": 15, "max_dist": 0.055, "max_hold": 4, "regime_ma": 20, "sustain_hi": 3, "sustain_lo": 3}	15	64.009	-19.308	3.315	60.201	67.724	45.202	-16.379	14.717	TRAIN 64.01% <= best 66.97% [cagr] [risk:max_hold=4 select:cagr]
2026-09-20T16:08:00Z	discard	strat_floorhighsustaincond	{"b_hi": 0.57, "b_lo": 0.4, "b_mid": 0.6, "fast_ma": 8, "floor_lb": 18, "lookback": 15, "max_dist": 0.055, "max_hold": 4, "regime_ma": 20, "sustain_hi": 2, "sustain_lo": 2}	15	61.594	-17.796	3.461	63.672	59.638	50.592	-15.799	14.717	TRAIN 61.59% <= best 66.97% [cagr] [risk:max_hold=4 select:cagr]
2026-09-20T16:08:11Z	discard	strat_floorhighsustaincond	{"b_hi": 0.57, "b_lo": 0.4, "b_mid": 0.6, "fast_ma": 8, "floor_lb": 18, "lookback": 15, "max_dist": 0.055, "max_hold": 4, "regime_ma": 19, "sustain_hi": 2, "sustain_lo": 3}	15	63.957	-19.429	3.292	60.097	67.724	42.869	-16.379	14.717	TRAIN 63.96% <= best 66.97% [cagr] [risk:max_hold=4 select:cagr]
2026-09-20T16:08:23Z	discard	strat_floorhighsector	{"b_hi": 0.57, "b_lo": 0.4, "b_mid": 0.6, "fast_ma": 8, "floor_lb": 19, "ind_q": 0.0, "lookback": 14, "max_dist": 0.055, "max_hold": 7, "regime_ma": 20, "sect_lb": 12, "sustain_hi": 2, "sustain_lo": 3}	15	66.745	-19.688	3.390	59.835	73.611	39.422	-14.374	14.717	TRAIN 66.74% <= best 66.97% [cagr] [risk:max_hold=7 select:cagr]
2026-09-20T16:08:39Z	discard	strat_floorhighsustaincond	{"b_hi": 0.57, "b_lo": 0.4, "b_mid": 0.6, "fast_ma": 8, "floor_lb": 19, "lookback": 14, "max_dist": 0.055, "max_hold": 3, "regime_ma": 20, "sustain_hi": 2, "sustain_lo": 3}	15	62.734	-20.257	3.097	54.283	71.222	38.818	-14.374	14.717	TRAIN 62.73% <= best 66.97% [cagr] [risk:max_hold=3 select:cagr]
2026-09-20T16:08:49Z	discard	strat_floorhighsustaincond	{"b_hi": 0.57, "b_lo": 0.4, "b_mid": 0.6, "fast_ma": 8, "floor_lb": 19, "lookback": 14, "max_dist": 0.055, "max_hold": 7, "regime_ma": 20, "sustain_hi": 4, "sustain_lo": 2}	15	61.520	-18.541	3.318	56.721	66.233	42.318	-14.551	14.717	TRAIN 61.52% <= best 66.97% [cagr] [risk:max_hold=7 select:cagr]
2026-09-20T16:09:01Z	discard	strat_floorhighsustaincond	{"b_hi": 0.57, "b_lo": 0.4, "b_mid": 0.6, "fast_ma": 8, "floor_lb": 19, "lookback": 14, "max_dist": 0.055, "max_hold": 7, "regime_ma": 20, "sustain_hi": 2, "sustain_lo": 1}	15	58.682	-17.517	3.350	55.604	61.673	39.636	-14.518	14.717	TRAIN 58.68% <= best 66.97% [cagr] [risk:max_hold=7 select:cagr]
2026-09-20T16:09:10Z	discard	strat_floorhighsustaincond	{"b_hi": 0.57, "b_lo": 0.4, "b_mid": 0.6, "fast_ma": 8, "floor_lb": 19, "lookback": 14, "max_dist": 0.055, "max_hold": 7, "regime_ma": 20, "sustain_hi": 2, "sustain_lo": 3}	13	57.093	-23.651	2.414	48.797	65.435	37.414	-21.466	14.717	TRAIN 57.09% <= best 66.97% [cagr] [risk:max_hold=7 select:cagr]
2026-09-20T16:10:18Z	discard	strat_floorhighsustaincond	{"b_hi": 0.57, "b_lo": 0.4, "b_mid": 0.6, "fast_ma": 8, "floor_lb": 19, "lookback": 14, "max_dist": 0.055, "max_hold": 7, "regime_ma": 19, "sustain_hi": 1, "sustain_lo": 3}	15	64.417	-19.606	3.286	55.791	73.087	37.575	-14.374	14.717	TRAIN 64.42% <= best 66.97% [cagr] [risk:max_hold=7 select:cagr]
2026-09-20T16:10:29Z	discard	strat_floorhighsustaincond	{"b_hi": 0.57, "b_lo": 0.4, "b_mid": 0.6, "fast_ma": 9, "floor_lb": 19, "lookback": 14, "max_dist": 0.055, "max_hold": 7, "regime_ma": 20, "sustain_hi": 1, "sustain_lo": 3}	15	65.733	-19.606	3.353	58.356	73.087	38.771	-14.374	14.717	TRAIN 65.73% <= best 66.97% [cagr] [risk:max_hold=7 select:cagr]
2026-09-20T16:10:41Z	discard	strat_floorhighsustaincond	{"b_hi": 0.57, "b_lo": 0.4, "b_mid": 0.6, "fast_ma": 9, "floor_lb": 19, "lookback": 13, "max_dist": 0.055, "max_hold": 7, "regime_ma": 20, "sustain_hi": 2, "sustain_lo": 3}	15	65.857	-19.688	3.345	59.279	72.383	40.300	-14.374	14.717	TRAIN 65.86% <= best 66.97% [cagr] [risk:max_hold=7 select:cagr]
2026-09-20T16:10:52Z	discard	strat_floorhighsustaincond	{"b_hi": 0.57, "b_lo": 0.4, "b_mid": 0.6, "fast_ma": 8, "floor_lb": 20, "lookback": 14, "max_dist": 0.055, "max_hold": 7, "regime_ma": 20, "sustain_hi": 1, "sustain_lo": 3}	15	63.911	-21.821	2.929	52.280	75.828	35.818	-20.298	14.717	TRAIN 63.91% <= best 66.97% [cagr] [risk:max_hold=7 select:cagr]
2026-09-20T16:11:02Z	discard	strat_floorhighsustaincond	{"b_hi": 0.57, "b_lo": 0.4, "b_mid": 0.6, "fast_ma": 9, "floor_lb": 19, "lookback": 14, "max_dist": 0.055, "max_hold": 7, "regime_ma": 20, "sustain_hi": 2, "sustain_lo": 4}	15	63.987	-19.885	3.218	53.918	74.200	35.946	-18.980	14.717	TRAIN 63.99% <= best 66.97% [cagr] [risk:max_hold=7 select:cagr]
2026-09-20T16:11:11Z	discard	strat_floorhighsustaincond	{"b_hi": 0.57, "b_lo": 0.4, "b_mid": 0.6, "fast_ma": 9, "floor_lb": 19, "lookback": 11, "max_dist": 0.055, "max_hold": 7, "regime_ma": 20, "sustain_hi": 2, "sustain_lo": 3}	15	66.643	-19.688	3.385	61.511	71.689	40.699	-14.374	14.717	TRAIN 66.64% <= best 66.97% [cagr] [risk:max_hold=7 select:cagr]
2026-09-20T16:11:23Z	discard	strat_floorhighsustaincond	{"b_hi": 0.57, "b_lo": 0.4, "b_mid": 0.6, "fast_ma": 8, "floor_lb": 19, "lookback": 11, "max_dist": 0.055, "max_hold": 7, "regime_ma": 19, "sustain_hi": 2, "sustain_lo": 3}	15	65.335	-19.688	3.319	58.924	71.689	39.609	-14.374	14.717	TRAIN 65.33% <= best 66.97% [cagr] [risk:max_hold=7 select:cagr]
2026-09-20T16:11:35Z	discard	strat_floorhighsustaincond	{"b_hi": 0.57, "b_lo": 0.4, "b_mid": 0.55, "fast_ma": 8, "floor_lb": 19, "lookback": 14, "max_dist": 0.055, "max_hold": 7, "regime_ma": 20, "sustain_hi": 1, "sustain_lo": 3}	15	64.629	-19.876	3.252	56.203	73.087	39.550	-14.374	14.717	TRAIN 64.63% <= best 66.97% [cagr] [risk:max_hold=7 select:cagr]
2026-09-20T16:11:49Z	discard	strat_floorhighsustaincond	{"b_hi": 0.57, "b_lo": 0.4, "b_mid": 0.6, "fast_ma": 8, "floor_lb": 19, "lookback": 12, "max_dist": 0.055, "max_hold": 7, "regime_ma": 20, "sustain_hi": 2, "sustain_lo": 5}	15	62.181	-19.885	3.127	54.517	69.842	37.732	-18.980	14.717	TRAIN 62.18% <= best 66.97% [cagr] [risk:max_hold=7 select:cagr]
2026-09-20T16:11:59Z	discard	strat_floorhighsustaincond	{"b_hi": 0.57, "b_lo": 0.4, "b_mid": 0.6, "fast_ma": 8, "floor_lb": 19, "lookback": 11, "max_dist": 0.055, "max_hold": 7, "regime_ma": 20, "sustain_hi": 4, "sustain_lo": 3}	15	65.426	-20.296	3.224	59.600	71.179	40.466	-14.374	14.717	TRAIN 65.43% <= best 66.97% [cagr] [risk:max_hold=7 select:cagr]
2026-09-20T16:12:08Z	discard	strat_floorhighsustaincond	{"b_hi": 0.57, "b_lo": 0.4, "b_mid": 0.6, "fast_ma": 8, "floor_lb": 19, "lookback": 14, "max_dist": 0.055, "max_hold": 7, "regime_ma": 20, "sustain_hi": 1, "sustain_lo": 2}	15	62.017	-18.541	3.345	58.653	65.291	40.912	-15.279	14.717	TRAIN 62.02% <= best 66.97% [cagr] [risk:max_hold=7 select:cagr]
2026-09-20T16:12:18Z	discard	strat_floorhighsustaincond	{"b_hi": 0.58, "b_lo": 0.4, "b_mid": 0.6, "fast_ma": 8, "floor_lb": 19, "lookback": 12, "max_dist": 0.055, "max_hold": 7, "regime_ma": 20, "sustain_hi": 2, "sustain_lo": 3}	15	65.335	-19.688	3.319	58.924	71.689	40.632	-14.374	14.717	TRAIN 65.33% <= best 66.97% [cagr] [risk:max_hold=7 select:cagr]
2026-09-20T16:12:31Z	discard	strat_floorhighsustaincond	{"b_hi": 0.56, "b_lo": 0.4, "b_mid": 0.6, "fast_ma": 8, "floor_lb": 19, "lookback": 12, "max_dist": 0.055, "max_hold": 7, "regime_ma": 20, "sustain_hi": 2, "sustain_lo": 3}	15	64.352	-19.688	3.269	56.994	71.689	40.632	-14.374	14.717	TRAIN 64.35% <= best 66.97% [cagr] [risk:max_hold=7 select:cagr]
2026-09-20T16:12:42Z	discard	strat_floorhighsustaincond	{"b_hi": 0.57, "b_lo": 0.4, "b_mid": 0.6, "fast_ma": 8, "floor_lb": 19, "lookback": 12, "max_dist": 0.055, "max_hold": 7, "regime_ma": 19, "sustain_hi": 2, "sustain_lo": 3}	15	65.335	-19.688	3.319	58.924	71.689	39.543	-14.374	14.717	TRAIN 65.33% <= best 66.97% [cagr] [risk:max_hold=7 select:cagr]
2026-09-20T16:12:54Z	discard	strat_floorhighsustaincond	{"b_hi": 0.57, "b_lo": 0.4, "b_mid": 0.6, "fast_ma": 8, "floor_lb": 19, "lookback": 12, "max_dist": 0.055, "max_hold": 7, "regime_ma": 20, "sustain_hi": 3, "sustain_lo": 3}	15	66.001	-20.235	3.262	60.739	71.179	41.148	-14.374	14.717	TRAIN 66.00% <= best 66.97% [cagr] [risk:max_hold=7 select:cagr]
2026-09-20T16:13:03Z	discard	strat_floorhighsustaincond	{"b_hi": 0.57, "b_lo": 0.4, "b_mid": 0.6, "fast_ma": 8, "floor_lb": 19, "lookback": 12, "max_dist": 0.055, "max_hold": 7, "regime_ma": 20, "sustain_hi": 1, "sustain_lo": 3}	15	66.276	-19.606	3.380	61.562	70.898	39.181	-14.374	14.717	TRAIN 66.28% <= best 66.97% [cagr] [risk:max_hold=7 select:cagr]
2026-09-20T16:13:12Z	discard	strat_floorhighsustaincond	{"b_hi": 0.57, "b_lo": 0.4, "b_mid": 0.6, "fast_ma": 8, "floor_lb": 19, "lookback": 12, "max_dist": 0.055, "max_hold": 7, "regime_ma": 20, "sustain_hi": 2, "sustain_lo": 2}	15	63.497	-18.541	3.425	61.814	65.118	42.807	-15.543	14.717	TRAIN 63.50% <= best 66.97% [cagr] [risk:max_hold=7 select:cagr]
2026-09-20T16:13:28Z	discard	strat_floorhighsustaincond	{"b_hi": 0.57, "b_lo": 0.4, "b_mid": 0.6, "fast_ma": 8, "floor_lb": 19, "lookback": 12, "max_dist": 0.055, "max_hold": 7, "regime_ma": 20, "sustain_hi": 2, "sustain_lo": 4}	15	64.721	-19.885	3.255	56.707	72.744	36.268	-18.980	14.717	TRAIN 64.72% <= best 66.97% [cagr] [risk:max_hold=7 select:cagr]
2026-09-20T16:13:36Z	discard	strat_floorhighsustaincond	{"b_hi": 0.57, "b_lo": 0.4, "b_mid": 0.6, "fast_ma": 7, "floor_lb": 19, "lookback": 12, "max_dist": 0.055, "max_hold": 7, "regime_ma": 20, "sustain_hi": 2, "sustain_lo": 3}	15	66.947	-19.688	3.400	62.116	71.689	40.626	-14.374	14.717	TRAIN 66.95% <= best 66.97% [cagr] [risk:max_hold=7 select:cagr]
2026-09-20T16:13:46Z	discard	strat_floorhighsustaincond	{"b_hi": 0.57, "b_lo": 0.4, "b_mid": 0.6, "fast_ma": 9, "floor_lb": 19, "lookback": 12, "max_dist": 0.055, "max_hold": 7, "regime_ma": 20, "sustain_hi": 2, "sustain_lo": 3}	15	66.643	-19.688	3.385	61.511	71.689	40.632	-14.374	14.717	TRAIN 66.64% <= best 66.97% [cagr] [risk:max_hold=7 select:cagr]
2026-09-20T16:13:59Z	discard	strat_floorhighsustaincond	{"b_hi": 0.57, "b_lo": 0.4, "b_mid": 0.6, "fast_ma": 8, "floor_lb": 19, "lookback": 12, "max_dist": 0.055, "max_hold": 7, "regime_ma": 21, "sustain_hi": 2, "sustain_lo": 3}	15	64.352	-19.688	3.269	56.994	71.689	42.406	-14.374	14.717	TRAIN 64.35% <= best 66.97% [cagr] [risk:max_hold=7 select:cagr]
2026-09-20T16:14:11Z	discard	strat_floorhighsustaincond	{"b_hi": 0.57, "b_lo": 0.4, "b_mid": 0.6, "fast_ma": 8, "floor_lb": 20, "lookback": 12, "max_dist": 0.055, "max_hold": 7, "regime_ma": 20, "sustain_hi": 2, "sustain_lo": 3}	15	65.771	-21.821	3.014	56.328	75.304	37.757	-20.298	14.717	TRAIN 65.77% <= best 66.97% [cagr] [risk:max_hold=7 select:cagr]
2026-09-20T16:14:23Z	discard	strat_floorhighsustaincond	{"b_hi": 0.57, "b_lo": 0.4, "b_mid": 0.6, "fast_ma": 8, "floor_lb": 18, "lookback": 12, "max_dist": 0.055, "max_hold": 7, "regime_ma": 19, "sustain_hi": 2, "sustain_lo": 3}	15	61.971	-20.091	3.085	58.203	65.648	42.338	-16.379	14.717	TRAIN 61.97% <= best 66.97% [cagr] [risk:max_hold=7 select:cagr]
2026-09-20T16:14:38Z	discard	strat_floorhighsustaincond	{"b_hi": 0.57, "b_lo": 0.4, "b_mid": 0.6, "fast_ma": 8, "floor_lb": 19, "lookback": 12, "max_dist": 0.055, "max_hold": 7, "regime_ma": 20, "sustain_hi": 4, "sustain_lo": 3}	15	65.426	-20.296	3.224	59.600	71.179	40.471	-14.374	14.717	TRAIN 65.43% <= best 66.97% [cagr] [risk:max_hold=7 select:cagr]
2026-09-20T16:14:53Z	discard	strat_floorhighsustaincond	{"b_hi": 0.57, "b_lo": 0.4, "b_mid": 0.6, "fast_ma": 8, "floor_lb": 19, "lookback": 12, "max_dist": 0.055, "max_hold": 7, "regime_ma": 20, "sustain_hi": 1, "sustain_lo": 2}	15	62.839	-18.541	3.389	61.262	64.358	41.328	-15.279	14.717	TRAIN 62.84% <= best 66.97% [cagr] [risk:max_hold=7 select:cagr]
2026-09-20T16:15:06Z	discard	strat_floorhighsustaincond	{"b_hi": 0.58, "b_lo": 0.4, "b_mid": 0.6, "fast_ma": 8, "floor_lb": 19, "lookback": 11, "max_dist": 0.055, "max_hold": 7, "regime_ma": 20, "sustain_hi": 2, "sustain_lo": 3}	15	65.335	-19.688	3.319	58.924	71.689	40.699	-14.374	14.717	TRAIN 65.33% <= best 66.97% [cagr] [risk:max_hold=7 select:cagr]
2026-09-20T16:15:18Z	discard	strat_floorhighsustaincond	{"b_hi": 0.56, "b_lo": 0.4, "b_mid": 0.6, "fast_ma": 8, "floor_lb": 19, "lookback": 11, "max_dist": 0.055, "max_hold": 7, "regime_ma": 20, "sustain_hi": 2, "sustain_lo": 3}	15	64.352	-19.688	3.269	56.994	71.689	40.699	-14.374	14.717	TRAIN 64.35% <= best 66.97% [cagr] [risk:max_hold=7 select:cagr]
2026-09-20T16:15:33Z	discard	strat_floorhighsustaincond	{"b_hi": 0.57, "b_lo": 0.4, "b_mid": 0.6, "fast_ma": 7, "floor_lb": 19, "lookback": 11, "max_dist": 0.055, "max_hold": 7, "regime_ma": 20, "sustain_hi": 2, "sustain_lo": 3}	15	66.947	-19.688	3.400	62.116	71.689	40.692	-14.374	14.717	TRAIN 66.95% <= best 66.97% [cagr] [risk:max_hold=7 select:cagr]
2026-09-20T16:16:46Z	discard	strat_floorhighsustaincond	{"b_hi": 0.57, "b_lo": 0.4, "b_mid": 0.6, "fast_ma": 9, "floor_lb": 19, "lookback": 11, "max_dist": 0.055, "max_hold": 7, "regime_ma": 20, "sustain_hi": 1, "sustain_lo": 3}	15	65.935	-19.606	3.363	60.885	70.898	39.126	-14.374	14.717	TRAIN 65.94% <= best 66.97% [cagr] [risk:max_hold=7 select:cagr]
2026-09-20T16:16:56Z	discard	strat_floorhighsustaincond	{"b_hi": 0.57, "b_lo": 0.4, "b_mid": 0.6, "fast_ma": 8, "floor_lb": 19, "lookback": 11, "max_dist": 0.055, "max_hold": 7, "regime_ma": 20, "sustain_hi": 1, "sustain_lo": 2}	15	62.803	-18.541	3.387	61.188	64.358	41.271	-15.279	14.717	TRAIN 62.80% <= best 66.97% [cagr] [risk:max_hold=7 select:cagr]
2026-09-20T16:17:12Z	discard	strat_floorhighsector	{"b_hi": 0.57, "b_lo": 0.4, "b_mid": 0.6, "fast_ma": 8, "floor_lb": 19, "ind_q": 0.0, "lookback": 11, "max_dist": 0.055, "max_hold": 7, "regime_ma": 20, "sect_lb": 12, "sustain_hi": 2, "sustain_lo": 3}	15	66.721	-19.688	3.389	62.116	71.233	39.817	-14.374	14.717	TRAIN 66.72% <= best 66.97% [cagr] [risk:max_hold=7 select:cagr]
2026-09-20T16:17:21Z	discard	strat_floorhighsustaincond	{"b_hi": 0.57, "b_lo": 0.4, "b_mid": 0.6, "fast_ma": 8, "floor_lb": 19, "lookback": 11, "max_dist": 0.055, "max_hold": 7, "regime_ma": 20, "sustain_hi": 3, "sustain_lo": 3}	15	66.001	-20.235	3.262	60.739	71.179	41.214	-14.374	14.717	TRAIN 66.00% <= best 66.97% [cagr] [risk:max_hold=7 select:cagr]
2026-09-20T16:17:30Z	discard	strat_floorhighsustaincond	{"b_hi": 0.57, "b_lo": 0.4, "b_mid": 0.6, "fast_ma": 8, "floor_lb": 19, "lookback": 11, "max_dist": 0.055, "max_hold": 7, "regime_ma": 20, "sustain_hi": 2, "sustain_lo": 4}	15	64.721	-19.885	3.255	56.707	72.744	36.332	-18.980	14.717	TRAIN 64.72% <= best 66.97% [cagr] [risk:max_hold=7 select:cagr]
2026-09-20T16:17:43Z	discard	strat_floorhighsustaincond	{"b_hi": 0.57, "b_lo": 0.4, "b_mid": 0.6, "fast_ma": 8, "floor_lb": 19, "lookback": 11, "max_dist": 0.055, "max_hold": 7, "regime_ma": 20, "sustain_hi": 2, "sustain_lo": 2}	15	63.497	-18.541	3.425	61.814	65.118	42.874	-15.543	14.717	TRAIN 63.50% <= best 66.97% [cagr] [risk:max_hold=7 select:cagr]
2026-09-20T16:18:27Z	keep	strat_floorhightiershape	{"b_hi": 0.69, "b_lo": 0.45, "b_mid": 0.55, "fast_ma": 5, "floor_lb": 19, "lookback": 10, "max_dist": 0.055, "regime_ma": 18, "sustain_hi": 2, "sustain_lo": 3, "tier_lo": 1.0, "tier_mid": 1.0}	15	77.865	-18.973	4.104	70.219	85.475	49.955	-14.374	14.717	beats best on cagr [risk:none select:cagr]
2026-09-20T16:18:32Z	discard	strat_floorhightiershapeconc	{"b_hi": 0.65, "b_lo": 0.45, "b_mid": 0.55, "cap_full": 20, "cap_weak": 12, "fast_ma": 9, "floor_lb": 20, "lookback": 16, "max_dist": 0.055, "max_hold": 9, "regime_ma": 18, "sustain_hi": 2, "sustain_lo": 4, "tier_lo": 0.99, "tier_mid": 1.0}	20	77.621	-23.023	3.371	64.312	91.315	48.140	-14.302	14.717	TRAIN 77.62% <= best 77.87% [cagr] [risk:max_hold=9 select:cagr]
2026-09-20T16:18:36Z	discard	strat_floorhightiershapegate	{"b_hi": 0.65, "b_lo": 0.45, "b_mid": 0.55, "fast_ma": 9, "floor_lb": 19, "lookback": 16, "max_dist": 0.055, "regime_ma": 18, "sustain_hi": 2, "sustain_lo": 4, "tier_lo": 0.55, "tier_mid": 1.0}	20	57.899	-19.229	3.011	45.976	70.174	41.330	-12.121	14.717	TRAIN 57.90% <= best 77.87% [cagr] [risk:none select:cagr]
2026-09-20T16:18:42Z	discard	strat_concvolgate	{"b_hi": 0.65, "b_lo": 0.45, "b_mid": 0.55, "cap_full": 20, "cap_weak": 12, "fast_ma": 9, "floor_lb": 19, "lookback": 16, "max_dist": 0.055, "regime_ma": 18, "sustain_hi": 2, "sustain_lo": 4, "tier_lo": 0.55, "tier_mid": 1.0, "vol_lb": 6, "vol_q": 0.5}	20	47.474	-19.518	2.432	39.747	55.240	31.321	-16.156	14.717	TRAIN 47.47% <= best 77.87% [cagr] [risk:none select:cagr]
