ts	status	candidate	params	top	train_cagr	train_dd	ret_dd	h1	h2	fwd_cagr	fwd_dd	fwd_bench	note
2026-09-20T14:08:39Z	discard	strat_floorhighsustainprint	{"b_hi": 0.65, "b_lo": 0.45, "b_mid": 0.55, "fast_ma": 6, "floor_lb": 19, "lookback": 16, "max_dist": 0.055, "regime_ma": 18, "sustain_lb": 3}	25	45.592	-16.996	2.682	34.204	57.349	31.464	-15.452	14.717	TRAIN 45.59% <= best 46.05% [cagr] [risk:none select:cagr]
2026-09-20T14:08:48Z	keep	strat_floorhighsustainprint	{"b_hi": 0.65, "b_lo": 0.45, "b_mid": 0.55, "fast_ma": 6, "floor_lb": 19, "lookback": 16, "max_dist": 0.055, "regime_ma": 18, "sustain_lb": 6}	25	47.573	-16.912	2.813	35.136	60.496	32.256	-13.506	14.717	beats best on cagr [risk:none select:cagr]
2026-09-20T14:10:31Z	discard	strat_floorhighprintcount	{"b_hi": 0.65, "b_lo": 0.45, "b_mid": 0.55, "fast_ma": 6, "floor_lb": 19, "lookback": 16, "max_dist": 0.055, "regime_ma": 18, "sustain_lb": 6}	25	24.084	-15.345	1.570	16.008	32.309	20.042	-12.296	14.717	TRAIN 24.08% <= best 47.57% [cagr] [risk:none select:cagr]
2026-09-20T14:10:41Z	discard	strat_floorhighsustainprint	{"b_hi": 0.65, "b_lo": 0.45, "b_mid": 0.55, "fast_ma": 6, "floor_lb": 19, "lookback": 16, "max_dist": 0.055, "regime_ma": 18, "sustain_lb": 12}	25	45.763	-17.567	2.605	32.569	59.564	32.588	-13.539	14.717	TRAIN 45.76% <= best 47.57% [cagr] [risk:none select:cagr]
2026-09-20T14:11:44Z	keep	strat_floorhighsustaincond	{"b_hi": 0.65, "b_lo": 0.45, "b_mid": 0.55, "fast_ma": 6, "floor_lb": 19, "lookback": 16, "max_dist": 0.055, "regime_ma": 18, "sustain_hi": 2, "sustain_lo": 6}	25	47.987	-16.384	2.929	35.952	60.452	32.233	-13.506	14.717	beats best on cagr [risk:none select:cagr]
2026-09-20T14:11:54Z	discard	strat_floorhighsustaincond	{"b_hi": 0.65, "b_lo": 0.45, "b_mid": 0.55, "fast_ma": 6, "floor_lb": 19, "lookback": 16, "max_dist": 0.055, "regime_ma": 18, "sustain_hi": 3, "sustain_lo": 6}	25	47.694	-16.580	2.877	35.401	60.452	32.660	-13.506	14.717	TRAIN 47.69% <= best 47.99% [cagr] [risk:none select:cagr]
2026-09-20T14:13:58Z	discard	strat_floorhighsustaincond	{"b_hi": 0.65, "b_lo": 0.45, "b_mid": 0.55, "fast_ma": 6, "floor_lb": 19, "lookback": 16, "max_dist": 0.055, "regime_ma": 18, "sustain_hi": 1, "sustain_lo": 6}	25	48.007	-16.981	2.827	35.748	60.725	31.471	-13.506	14.717	TRAIN 48.01% <= best 47.99% [cagr] [risk:none select:cagr]
2026-09-20T14:14:07Z	discard	strat_floorhighsustaincond	{"b_hi": 0.65, "b_lo": 0.45, "b_mid": 0.55, "fast_ma": 6, "floor_lb": 19, "lookback": 16, "max_dist": 0.055, "regime_ma": 18, "sustain_hi": 4, "sustain_lo": 6}	25	47.293	-17.250	2.742	34.611	60.496	32.642	-13.506	14.717	TRAIN 47.29% <= best 47.99% [cagr] [risk:none select:cagr]
2026-09-20T14:15:31Z	discard	strat_floorhighsustainplain	{"b_hi": 0.65, "b_lo": 0.45, "b_mid": 0.55, "floor_lb": 19, "lookback": 16, "max_dist": 0.055, "regime_ma": 18, "sustain_lb": 6}	25	47.675	-16.912	2.819	35.327	60.496	32.256	-13.506	14.717	TRAIN 47.67% <= best 47.99% [cagr] [risk:none select:cagr]
2026-09-20T14:15:42Z	discard	strat_floorhighsustain2	{"b_hi": 0.65, "b_lo": 0.45, "b_mid": 0.55, "fast_ma": 6, "floor_lb": 19, "lookback": 16, "max_dist": 0.055, "min_prints": 2, "regime_ma": 18, "sustain_lb": 6}	25	47.573	-16.912	2.813	35.136	60.496	32.256	-13.506	14.717	TRAIN 47.57% <= best 47.99% [cagr] [risk:none select:cagr]
2026-09-20T14:15:53Z	discard	strat_floorhighsustain2	{"b_hi": 0.65, "b_lo": 0.45, "b_mid": 0.55, "fast_ma": 6, "floor_lb": 19, "lookback": 16, "max_dist": 0.055, "min_prints": 3, "regime_ma": 18, "sustain_lb": 6}	25	39.998	-17.282	2.314	27.425	53.140	31.923	-14.952	14.717	TRAIN 40.00% <= best 47.99% [cagr] [risk:none select:cagr]
2026-09-20T14:16:03Z	discard	strat_floorhighsustaincond	{"b_hi": 0.65, "b_lo": 0.45, "b_mid": 0.55, "fast_ma": 6, "floor_lb": 19, "lookback": 16, "max_dist": 0.055, "regime_ma": 18, "sustain_hi": 2, "sustain_lo": 9}	25	46.605	-16.871	2.763	33.328	60.495	33.447	-13.506	14.717	TRAIN 46.61% <= best 47.99% [cagr] [risk:none select:cagr]
2026-09-20T14:16:40Z	discard	strat_floorhighsustainprint	{"b_hi": 0.65, "b_lo": 0.45, "b_mid": 0.55, "fast_ma": 3, "floor_lb": 19, "lookback": 16, "max_dist": 0.055, "regime_ma": 18, "sustain_lb": 6}	25	47.606	-16.912	2.815	34.950	60.777	32.256	-13.506	14.717	TRAIN 47.61% <= best 47.99% [cagr] [risk:none select:cagr]
2026-09-20T14:16:54Z	discard	strat_floorhighsustaincond	{"b_hi": 0.65, "b_lo": 0.45, "b_mid": 0.55, "fast_ma": 6, "floor_lb": 19, "lookback": 16, "max_dist": 0.055, "regime_ma": 18, "sustain_hi": 2, "sustain_lo": 3}	25	45.881	-16.801	2.731	34.750	57.349	31.040	-15.452	14.717	TRAIN 45.88% <= best 47.99% [cagr] [risk:none select:cagr]
2026-09-20T14:17:38Z	discard	strat_floorhighsustaincond	{"b_hi": 0.65, "b_lo": 0.45, "b_mid": 0.55, "fast_ma": 6, "floor_lb": 19, "lookback": 16, "max_dist": 0.055, "regime_ma": 18, "sustain_hi": 2, "sustain_lo": 12}	25	45.313	-16.871	2.686	31.616	59.698	32.331	-13.539	14.717	TRAIN 45.31% <= best 47.99% [cagr] [risk:none select:cagr]
2026-09-20T14:17:49Z	discard	strat_floorhighsustainprint	{"b_hi": 0.65, "b_lo": 0.45, "b_mid": 0.55, "fast_ma": 12, "floor_lb": 19, "lookback": 16, "max_dist": 0.055, "regime_ma": 18, "sustain_lb": 6}	25	47.674	-16.912	2.819	35.325	60.496	32.256	-13.506	14.717	TRAIN 47.67% <= best 47.99% [cagr] [risk:none select:cagr]
2026-09-20T14:18:14Z	discard	strat_floorhighheatgate	{"b_hi": 0.65, "b_lo": 0.45, "b_mid": 0.55, "fast_ma": 6, "floor_lb": 19, "h_min": 0.05, "lookback": 16, "max_dist": 0.055, "regime_ma": 18, "sustain_lb": 6}	25	41.822	-22.359	1.870	28.086	56.289	35.633	-14.048	14.717	TRAIN 41.82% <= best 47.99% [cagr] [risk:none select:cagr]
2026-09-20T14:18:24Z	discard	strat_floorhighheatgate	{"b_hi": 0.65, "b_lo": 0.45, "b_mid": 0.55, "fast_ma": 6, "floor_lb": 19, "h_min": 0.1, "lookback": 16, "max_dist": 0.055, "regime_ma": 18, "sustain_lb": 6}	25	41.383	-23.669	1.748	30.006	53.157	38.715	-13.053	14.717	TRAIN 41.38% <= best 47.99% [cagr] [risk:none select:cagr]
2026-09-20T14:20:26Z	discard	strat_floorhighsustaincondplain	{"b_hi": 0.65, "b_lo": 0.45, "b_mid": 0.55, "floor_lb": 19, "lookback": 16, "max_dist": 0.055, "regime_ma": 18, "sustain_hi": 2, "sustain_lo": 6}	25	47.743	-16.384	2.914	35.493	60.452	32.233	-13.506	14.717	TRAIN 47.74% <= best 47.99% [cagr] [risk:none select:cagr]
2026-09-20T14:20:36Z	discard	strat_floorhightier	{"b_hi": 0.65, "b_lo": 0.45, "b_mid": 0.55, "floor_lb": 19, "lookback": 16, "max_dist": 0.055, "regime_ma": 18}	25	45.233	-16.811	2.691	32.320	58.717	33.121	-13.639	14.717	TRAIN 45.23% <= best 47.99% [cagr] [risk:none select:cagr]
2026-09-20T14:21:28Z	discard	strat_floorhighsustaincondplain	{"b_hi": 0.65, "b_lo": 0.45, "b_mid": 0.55, "floor_lb": 19, "lookback": 16, "max_dist": 0.055, "regime_ma": 18, "sustain_hi": 1, "sustain_lo": 6}	25	47.732	-16.978	2.811	35.233	60.725	31.471	-13.506	14.717	TRAIN 47.73% <= best 47.99% [cagr] [risk:none select:cagr]
2026-09-20T14:21:39Z	discard	strat_floorhighsustain2	{"b_hi": 0.65, "b_lo": 0.45, "b_mid": 0.55, "fast_ma": 6, "floor_lb": 19, "lookback": 16, "max_dist": 0.055, "min_prints": 4, "regime_ma": 18, "sustain_lb": 6}	25	36.797	-18.779	1.959	26.748	47.120	27.367	-16.856	14.717	TRAIN 36.80% <= best 47.99% [cagr] [risk:none select:cagr]
2026-09-20T14:21:48Z	discard	strat_floorhighsustainprint	{"b_hi": 0.65, "b_lo": 0.45, "b_mid": 0.55, "fast_ma": 6, "floor_lb": 19, "lookback": 16, "max_dist": 0.055, "regime_ma": 18, "sustain_lb": 9}	25	46.726	-17.567	2.660	33.671	60.360	32.963	-13.506	14.717	TRAIN 46.73% <= best 47.99% [cagr] [risk:none select:cagr]
2026-09-20T14:22:11Z	discard	strat_floorhighsustaincond	{"b_hi": 0.65, "b_lo": -1.0, "b_mid": 0.55, "fast_ma": 6, "floor_lb": 19, "lookback": 16, "max_dist": 0.055, "regime_ma": 18, "sustain_hi": 2, "sustain_lo": 6}	25	46.893	-32.546	1.441	35.612	58.522	36.892	-14.017	14.717	TRAIN 46.89% <= best 47.99% [cagr] [risk:none select:cagr]
2026-09-20T14:22:29Z	keep	strat_floorhighsustaincond	{"b_hi": 0.65, "b_lo": 0.45, "b_mid": 0.55, "fast_ma": 9, "floor_lb": 19, "lookback": 16, "max_dist": 0.055, "regime_ma": 18, "sustain_hi": 2, "sustain_lo": 6}	25	48.139	-16.384	2.938	36.240	60.452	32.233	-13.506	14.717	beats best on cagr [risk:none select:cagr]
2026-09-20T14:23:47Z	discard	strat_floorhighliqw	{"b_hi": 0.65, "b_lo": 0.45, "b_mid": 0.55, "fast_ma": 9, "floor_lb": 19, "liq_lb": 6, "liq_w": 0.5, "lookback": 16, "max_dist": 0.055, "regime_ma": 18, "sustain_hi": 2, "sustain_lo": 6}	25	33.715	-16.907	1.994	23.993	43.694	20.443	-23.189	14.717	TRAIN 33.71% <= best 48.14% [cagr] [risk:none select:cagr]
2026-09-20T14:24:12Z	discard	strat_floorhighliqw	{"b_hi": 0.65, "b_lo": 0.45, "b_mid": 0.55, "fast_ma": 9, "floor_lb": 19, "liq_lb": 6, "liq_w": 1.0, "lookback": 16, "max_dist": 0.055, "regime_ma": 18, "sustain_hi": 2, "sustain_lo": 6}	25	25.117	-16.708	1.503	18.968	31.277	16.246	-18.907	14.717	TRAIN 25.12% <= best 48.14% [cagr] [risk:none select:cagr]
2026-09-20T15:22:16Z	discard	strat_floorhighsustaincond	{"b_hi": 0.65, "b_lo": 0.45, "b_mid": 0.55, "fast_ma": 9, "floor_lb": 19, "lookback": 16, "max_dist": 0.055, "regime_ma": 18, "sustain_hi": 2, "sustain_lo": 6, "trail_k": 0.1}	25	36.503	-16.882	2.162	28.882	44.189	31.033	-15.949	14.717	TRAIN 36.50% <= best 48.14% [cagr] [risk:trail_k=0.1 select:cagr]
2026-09-20T15:22:30Z	discard	strat_floorhighsustaincond	{"b_hi": 0.65, "b_lo": 0.45, "b_mid": 0.55, "fast_ma": 9, "floor_lb": 19, "lookback": 16, "max_dist": 0.055, "regime_ma": 18, "sustain_hi": 2, "sustain_lo": 6, "trail_k": 0.15}	25	39.066	-16.719	2.337	31.676	46.499	35.870	-12.563	14.717	TRAIN 39.07% <= best 48.14% [cagr] [risk:trail_k=0.15 select:cagr]
2026-09-20T15:22:54Z	discard	strat_floorhighsustaincond	{"b_hi": 0.65, "b_lo": 0.45, "b_mid": 0.55, "fast_ma": 9, "floor_lb": 19, "lookback": 16, "max_dist": 0.055, "regime_ma": 18, "sustain_hi": 2, "sustain_lo": 6, "trail_k": 0.2}	25	36.616	-16.449	2.226	30.035	43.200	35.958	-12.024	14.717	TRAIN 36.62% <= best 48.14% [cagr] [risk:trail_k=0.2 select:cagr]
2026-09-20T15:23:13Z	discard	strat_floorhighsustaincond	{"b_hi": 0.65, "b_lo": 0.45, "b_mid": 0.55, "fast_ma": 9, "floor_lb": 19, "lookback": 16, "max_dist": 0.055, "regime_ma": 18, "sustain_hi": 2, "sustain_lo": 6, "trail_k": 0.25}	25	36.559	-17.425	2.098	31.122	41.953	32.131	-12.024	14.717	TRAIN 36.56% <= best 48.14% [cagr] [risk:trail_k=0.25 select:cagr]
2026-09-20T15:23:22Z	discard	strat_floorhighsustaincond	{"b_hi": 0.65, "b_lo": 0.45, "b_mid": 0.55, "fast_ma": 9, "floor_lb": 19, "lookback": 16, "max_dist": 0.055, "max_hold": 3, "regime_ma": 18, "sustain_hi": 2, "sustain_lo": 6}	25	44.488	-18.154	2.451	34.124	55.114	36.163	-13.498	14.717	TRAIN 44.49% <= best 48.14% [cagr] [risk:max_hold=3 select:cagr]
2026-09-20T15:23:29Z	discard	strat_floorhighsustaincond	{"b_hi": 0.65, "b_lo": 0.45, "b_mid": 0.55, "fast_ma": 9, "floor_lb": 19, "lookback": 16, "max_dist": 0.055, "max_hold": 6, "regime_ma": 18, "sustain_hi": 2, "sustain_lo": 6}	25	46.976	-17.850	2.632	34.737	59.679	34.118	-12.390	14.717	TRAIN 46.98% <= best 48.14% [cagr] [risk:max_hold=6 select:cagr]
2026-09-20T15:23:37Z	discard	strat_floorhighsustaincond	{"b_hi": 0.65, "b_lo": 0.45, "b_mid": 0.55, "fast_ma": 9, "floor_lb": 19, "lookback": 16, "max_dist": 0.055, "max_hold": 9, "regime_ma": 18, "sustain_hi": 2, "sustain_lo": 6}	25	48.176	-16.384	2.940	36.240	60.530	32.162	-13.790	14.717	TRAIN 48.18% <= best 48.14% [cagr] [risk:max_hold=9 select:cagr]
2026-09-20T15:23:45Z	discard	strat_floorhighsustaincond	{"b_hi": 0.65, "b_lo": 0.45, "b_mid": 0.55, "fast_ma": 9, "floor_lb": 19, "lookback": 16, "max_dist": 0.055, "max_hold": 12, "regime_ma": 18, "sustain_hi": 2, "sustain_lo": 6}	25	48.139	-16.384	2.938	36.240	60.452	32.233	-13.506	14.717	TRAIN 48.14% <= best 48.14% [cagr] [risk:max_hold=12 select:cagr]
2026-09-20T15:23:55Z	discard	strat_floorhighsustaincond	{"b_hi": 0.65, "b_lo": 0.45, "b_mid": 0.55, "fast_ma": 9, "floor_lb": 19, "lookback": 16, "max_dist": 0.055, "regime_ma": 18, "sustain_hi": 2, "sustain_lo": 6}	15	47.473	-17.902	2.652	34.377	61.147	33.489	-17.869	14.717	TRAIN 47.47% <= best 48.14% [cagr] [risk:none select:cagr]
2026-09-20T15:24:02Z	keep	strat_floorhighsustaincond	{"b_hi": 0.65, "b_lo": 0.45, "b_mid": 0.55, "fast_ma": 9, "floor_lb": 19, "lookback": 16, "max_dist": 0.055, "regime_ma": 18, "sustain_hi": 2, "sustain_lo": 6}	20	48.933	-17.012	2.876	32.312	66.720	37.828	-11.103	14.717	beats best on cagr [risk:none select:cagr]
2026-09-20T15:24:10Z	discard	strat_floorhighsustaincond	{"b_hi": 0.65, "b_lo": 0.45, "b_mid": 0.55, "fast_ma": 9, "floor_lb": 19, "lookback": 16, "max_dist": 0.055, "regime_ma": 18, "sustain_hi": 2, "sustain_lo": 6}	30	41.616	-16.860	2.468	31.804	51.651	32.102	-14.597	14.717	TRAIN 41.62% <= best 48.93% [cagr] [risk:none select:cagr]
2026-09-20T15:24:19Z	discard	strat_floorhighsustaincond	{"b_hi": 0.65, "b_lo": 0.45, "b_mid": 0.55, "fast_ma": 9, "floor_lb": 19, "lookback": 16, "max_dist": 0.055, "regime_ma": 18, "sustain_hi": 2, "sustain_lo": 6}	40	36.971	-16.826	2.197	27.719	46.417	31.705	-15.200	14.717	TRAIN 36.97% <= best 48.93% [cagr] [risk:none select:cagr]
2026-09-20T15:24:31Z	discard	strat_floorhighsustaincond	{"b_hi": 0.65, "b_lo": 0.45, "b_mid": 0.55, "fast_ma": 8, "floor_lb": 19, "lookback": 16, "max_dist": 0.055, "regime_ma": 18, "sustain_hi": 2, "sustain_lo": 6}	25	48.143	-16.384	2.938	36.246	60.452	32.233	-13.506	14.717	TRAIN 48.14% <= best 48.93% [cagr] [risk:none select:cagr]
2026-09-20T15:24:39Z	discard	strat_floorhighsustaincond	{"b_hi": 0.65, "b_lo": 0.45, "b_mid": 0.55, "fast_ma": 10, "floor_lb": 19, "lookback": 16, "max_dist": 0.055, "regime_ma": 18, "sustain_hi": 2, "sustain_lo": 6}	25	48.085	-16.384	2.935	36.138	60.452	32.233	-13.506	14.717	TRAIN 48.09% <= best 48.93% [cagr] [risk:none select:cagr]
2026-09-20T15:24:52Z	discard	strat_floorhighsustaincond	{"b_hi": 0.65, "b_lo": 0.45, "b_mid": 0.55, "fast_ma": 12, "floor_lb": 19, "lookback": 16, "max_dist": 0.055, "regime_ma": 18, "sustain_hi": 2, "sustain_lo": 6}	25	47.740	-16.384	2.914	35.488	60.452	32.233	-13.506	14.717	TRAIN 47.74% <= best 48.93% [cagr] [risk:none select:cagr]
2026-09-20T15:25:00Z	discard	strat_floorhighsustaincond	{"b_hi": 0.65, "b_lo": 0.45, "b_mid": 0.55, "fast_ma": 9, "floor_lb": 19, "lookback": 16, "max_dist": 0.055, "regime_ma": 18, "sustain_hi": 2, "sustain_lo": 5}	25	46.839	-16.384	2.859	35.429	58.612	32.555	-14.060	14.717	TRAIN 46.84% <= best 48.93% [cagr] [risk:none select:cagr]
2026-09-20T15:25:08Z	discard	strat_floorhighsustaincond	{"b_hi": 0.65, "b_lo": 0.45, "b_mid": 0.55, "fast_ma": 9, "floor_lb": 19, "lookback": 16, "max_dist": 0.055, "regime_ma": 18, "sustain_hi": 2, "sustain_lo": 7}	25	46.766	-16.392	2.853	34.025	60.041	32.655	-13.506	14.717	TRAIN 46.77% <= best 48.93% [cagr] [risk:none select:cagr]
2026-09-20T15:25:14Z	discard	strat_floorhighsustaincond	{"b_hi": 0.65, "b_lo": 0.45, "b_mid": 0.55, "fast_ma": 9, "floor_lb": 19, "lookback": 16, "max_dist": 0.055, "regime_ma": 18, "sustain_hi": 2, "sustain_lo": 8}	25	46.834	-16.392	2.857	33.755	60.495	32.655	-13.506	14.717	TRAIN 46.83% <= best 48.93% [cagr] [risk:none select:cagr]
2026-09-20T15:25:23Z	discard	strat_floorhighsustaincond	{"b_hi": 0.65, "b_lo": 0.45, "b_mid": 0.55, "fast_ma": 9, "floor_lb": 19, "lookback": 16, "max_dist": 0.055, "regime_ma": 18, "sustain_hi": 3, "sustain_lo": 6}	25	47.746	-16.580	2.880	35.500	60.452	32.660	-13.506	14.717	TRAIN 47.75% <= best 48.93% [cagr] [risk:none select:cagr]
2026-09-20T15:25:32Z	discard	strat_floorhighsustaincond	{"b_hi": 0.65, "b_lo": 0.45, "b_mid": 0.55, "fast_ma": 9, "floor_lb": 19, "lookback": 16, "max_dist": 0.055, "regime_ma": 18, "sustain_hi": 4, "sustain_lo": 6}	25	47.345	-17.250	2.745	34.709	60.496	32.642	-13.506	14.717	TRAIN 47.35% <= best 48.93% [cagr] [risk:none select:cagr]
2026-09-20T15:25:39Z	discard	strat_floorhighsustaincond	{"b_hi": 0.65, "b_lo": 0.45, "b_mid": 0.55, "fast_ma": 9, "floor_lb": 18, "lookback": 16, "max_dist": 0.055, "regime_ma": 18, "sustain_hi": 2, "sustain_lo": 6}	25	44.628	-16.152	2.763	32.938	56.730	35.252	-18.169	14.717	TRAIN 44.63% <= best 48.93% [cagr] [risk:none select:cagr]
2026-09-20T15:25:46Z	discard	strat_floorhighsustaincond	{"b_hi": 0.65, "b_lo": 0.45, "b_mid": 0.55, "fast_ma": 9, "floor_lb": 20, "lookback": 16, "max_dist": 0.055, "regime_ma": 18, "sustain_hi": 2, "sustain_lo": 6}	25	46.322	-18.298	2.532	31.530	61.973	33.760	-12.645	14.717	TRAIN 46.32% <= best 48.93% [cagr] [risk:none select:cagr]
2026-09-20T15:25:53Z	discard	strat_floorhighsustaincond	{"b_hi": 0.65, "b_lo": 0.45, "b_mid": 0.55, "fast_ma": 9, "floor_lb": 19, "lookback": 15, "max_dist": 0.055, "regime_ma": 18, "sustain_hi": 2, "sustain_lo": 6}	25	47.217	-16.384	2.882	35.838	58.953	32.233	-13.506	14.717	TRAIN 47.22% <= best 48.93% [cagr] [risk:none select:cagr]
2026-09-20T15:26:01Z	discard	strat_floorhighsustaincond	{"b_hi": 0.65, "b_lo": 0.45, "b_mid": 0.55, "fast_ma": 9, "floor_lb": 19, "lookback": 17, "max_dist": 0.055, "regime_ma": 18, "sustain_hi": 2, "sustain_lo": 6}	25	47.681	-16.384	2.910	36.120	59.619	32.233	-13.506	14.717	TRAIN 47.68% <= best 48.93% [cagr] [risk:none select:cagr]
2026-09-20T15:26:16Z	discard	strat_floorhighsustaincond	{"b_hi": 0.65, "b_lo": 0.45, "b_mid": 0.55, "fast_ma": 9, "floor_lb": 19, "lookback": 16, "max_dist": 0.05, "regime_ma": 18, "sustain_hi": 2, "sustain_lo": 6}	25	48.139	-16.384	2.938	36.240	60.452	32.233	-13.506	14.717	TRAIN 48.14% <= best 48.93% [cagr] [risk:none select:cagr]
2026-09-20T15:26:25Z	discard	strat_floorhighsustaincond	{"b_hi": 0.65, "b_lo": 0.45, "b_mid": 0.55, "fast_ma": 9, "floor_lb": 19, "lookback": 16, "max_dist": 0.06, "regime_ma": 18, "sustain_hi": 2, "sustain_lo": 6}	25	48.139	-16.384	2.938	36.240	60.452	32.233	-13.506	14.717	TRAIN 48.14% <= best 48.93% [cagr] [risk:none select:cagr]
2026-09-20T15:27:01Z	discard	strat_floorhighsustaincond	{"b_hi": 0.65, "b_lo": 0.45, "b_mid": 0.55, "fast_ma": 9, "floor_lb": 19, "lookback": 16, "max_dist": 0.065, "regime_ma": 18, "sustain_hi": 2, "sustain_lo": 6}	25	48.139	-16.384	2.938	36.240	60.452	32.233	-13.506	14.717	TRAIN 48.14% <= best 48.93% [cagr] [risk:none select:cagr]
2026-09-20T15:27:18Z	discard	strat_floorhighsustaincond	{"b_hi": 0.65, "b_lo": 0.45, "b_mid": 0.55, "fast_ma": 9, "floor_lb": 19, "lookback": 16, "max_dist": 0.055, "regime_ma": 17, "sustain_hi": 2, "sustain_lo": 6}	25	47.533	-16.384	2.901	35.100	60.452	27.579	-13.506	14.717	TRAIN 47.53% <= best 48.93% [cagr] [risk:none select:cagr]
2026-09-20T15:27:29Z	discard	strat_floorhighsustaincond	{"b_hi": 0.65, "b_lo": 0.45, "b_mid": 0.55, "fast_ma": 9, "floor_lb": 19, "lookback": 16, "max_dist": 0.055, "regime_ma": 19, "sustain_hi": 2, "sustain_lo": 6}	25	48.848	-21.133	2.311	37.578	60.452	31.951	-13.506	14.717	TRAIN 48.85% <= best 48.93% [cagr] [risk:none select:cagr]
2026-09-20T15:27:36Z	discard	strat_floorhighsustaincond	{"b_hi": 0.65, "b_lo": 0.45, "b_mid": 0.55, "fast_ma": 9, "floor_lb": 19, "lookback": 16, "max_dist": 0.055, "regime_ma": 20, "sustain_hi": 2, "sustain_lo": 6}	25	45.277	-21.133	2.142	37.993	52.580	33.621	-13.506	14.717	TRAIN 45.28% <= best 48.93% [cagr] [risk:none select:cagr]
2026-09-20T15:27:46Z	discard	strat_floorhighsustaincond	{"b_hi": 0.6, "b_lo": 0.45, "b_mid": 0.55, "fast_ma": 9, "floor_lb": 19, "lookback": 16, "max_dist": 0.055, "regime_ma": 18, "sustain_hi": 2, "sustain_lo": 6}	25	51.533	-19.042	2.706	42.712	60.452	33.155	-13.506	14.717	DD -19.0% breaches floor/slack [risk:none select:cagr]
2026-09-20T15:27:56Z	discard	strat_floorhighsustaincond	{"b_hi": 0.7, "b_lo": 0.45, "b_mid": 0.55, "fast_ma": 9, "floor_lb": 19, "lookback": 16, "max_dist": 0.055, "regime_ma": 18, "sustain_hi": 2, "sustain_lo": 6}	25	45.130	-16.384	2.755	32.149	58.694	28.776	-13.506	14.717	TRAIN 45.13% <= best 48.93% [cagr] [risk:none select:cagr]
2026-09-20T15:28:05Z	discard	strat_floorhighsustaincond	{"b_hi": 0.65, "b_lo": 0.45, "b_mid": 0.5, "fast_ma": 9, "floor_lb": 19, "lookback": 16, "max_dist": 0.055, "regime_ma": 18, "sustain_hi": 2, "sustain_lo": 6}	25	50.482	-20.400	2.475	40.690	60.452	33.670	-13.506	14.717	DD -20.4% breaches floor/slack [risk:none select:cagr]
2026-09-20T15:28:19Z	discard	strat_floorhighsustaincond	{"b_hi": 0.65, "b_lo": 0.45, "b_mid": 0.6, "fast_ma": 9, "floor_lb": 19, "lookback": 16, "max_dist": 0.055, "regime_ma": 18, "sustain_hi": 2, "sustain_lo": 6}	25	47.358	-15.838	2.990	34.771	60.452	29.292	-13.506	14.717	TRAIN 47.36% <= best 48.93% [cagr] [risk:none select:cagr]
2026-09-20T15:28:28Z	discard	strat_floorhighsustaincond	{"b_hi": 0.65, "b_lo": 0.4, "b_mid": 0.55, "fast_ma": 9, "floor_lb": 19, "lookback": 16, "max_dist": 0.055, "regime_ma": 18, "sustain_hi": 2, "sustain_lo": 6}	25	47.958	-18.543	2.586	35.899	60.452	32.845	-13.506	14.717	TRAIN 47.96% <= best 48.93% [cagr] [risk:none select:cagr]
2026-09-20T15:28:38Z	discard	strat_floorhighsustaincond	{"b_hi": 0.65, "b_lo": 0.5, "b_mid": 0.55, "fast_ma": 9, "floor_lb": 19, "lookback": 16, "max_dist": 0.055, "regime_ma": 18, "sustain_hi": 2, "sustain_lo": 6}	25	44.359	-19.675	2.255	34.648	54.269	29.851	-13.506	14.717	TRAIN 44.36% <= best 48.93% [cagr] [risk:none select:cagr]
2026-09-20T15:29:05Z	discard	strat_floorhighvoltarget	{"b_hi": 0.65, "b_lo": 0.45, "b_mid": 0.55, "fast_ma": 9, "floor_lb": 19, "lookback": 16, "max_dist": 0.055, "regime_ma": 18, "sustain_hi": 2, "sustain_lo": 6}	25	35.357	-13.796	2.563	30.647	40.005	22.437	-10.456	14.717	TRAIN 35.36% <= best 48.93% [cagr] [risk:none select:cagr]
2026-09-20T15:29:14Z	discard	strat_floorhighvoltarget	{"b_hi": 0.65, "b_lo": 0.45, "b_mid": 0.55, "fast_ma": 9, "floor_lb": 19, "lookback": 16, "max_dist": 0.055, "regime_ma": 18, "sustain_hi": 2, "sustain_lo": 6, "vt_lb": 6, "vt_target": 0.12}	25	29.409	-11.378	2.585	27.589	31.168	19.246	-8.401	14.717	TRAIN 29.41% <= best 48.93% [cagr] [risk:none select:cagr]
