ts	status	candidate	params	top	train_cagr	train_dd	ret_dd	h1	h2	fwd_cagr	fwd_dd	fwd_bench	note
2026-09-15T03:17:15Z	baseline	strat_floorhigh	{"floor_lb": 24, "lookback": 15, "max_dist": 0.07, "regime_ma": 6, "weak_exp": 0.4}	25	33.906	-33.991	0.998	24.895	43.103	34.380	-21.442	19.528	first entry [risk:none select:cagr]
2026-09-15T03:17:17Z	keep	strat_floorhigh	{"floor_lb": 24, "lookback": 15, "max_dist": 0.1, "regime_ma": 6, "weak_exp": 0.4}	25	34.281	-34.632	0.990	24.405	44.426	32.456	-22.418	19.528	beats best on cagr [risk:none select:cagr]
2026-09-15T03:17:19Z	discard	strat_floorlift	{"max_hold": 12, "weak_exp": 0.4}	25	32.480	-28.526	1.139	22.412	42.849	28.257	-19.215	19.528	TRAIN 32.48% <= best 34.28% [cagr] [risk:max_hold=12 select:cagr]
2026-09-15T03:17:21Z	discard	strat_floorlift	{"weak_exp": 0.4}	25	33.566	-29.385	1.142	23.078	44.397	27.189	-19.414	19.528	TRAIN 33.57% <= best 34.28% [cagr] [risk:none select:cagr]
2026-09-15T03:17:25Z	discard	strat_newhigh	{"lookback": 15, "max_dist": 0.1, "regime_ma": 6, "trail_k": 0.05}	25	14.196	-26.301	0.540	6.971	21.539	25.478	-11.232	19.528	TRAIN 14.20% <= best 34.28% [cagr] [risk:trail_k=0.05 select:cagr]
2026-09-15T03:17:47Z	discard	strat_floorhigh	{"floor_lb": 24, "lookback": 15, "max_dist": 0.07, "regime_ma": 10, "weak_exp": 0.4}	25	32.947	-45.598	0.723	32.779	33.108	37.550	-20.601	19.528	TRAIN 32.95% <= best 34.28% [cagr] [risk:none select:cagr]
2026-09-15T03:28:34Z	discard	strat_floorhigh	{"floor_lb": 18, "lookback": 15, "max_dist": 0.07, "regime_ma": 10, "weak_exp": 0.4}	25	31.316	-47.879	0.654	34.069	28.743	30.332	-23.681	19.528	TRAIN 31.32% <= best 34.28% [cagr] [risk:none select:cagr]
2026-09-15T03:28:36Z	discard	strat_floorhightier	{"floor_lb": 18, "lookback": 15, "max_dist": 0.07, "regime_ma": 10}	25	33.459	-35.005	0.956	30.642	36.201	27.095	-16.013	19.528	TRAIN 33.46% <= best 34.28% [cagr] [risk:none select:cagr]
2026-09-15T03:28:42Z	discard	strat_floorhigh	{"floor_lb": 12, "lookback": 15, "max_dist": 0.07, "regime_ma": 10, "weak_exp": 0.4}	25	33.362	-38.595	0.864	33.827	32.919	30.165	-20.223	19.528	TRAIN 33.36% <= best 34.28% [cagr] [risk:none select:cagr]
2026-09-15T03:29:51Z	discard	strat_floorhigh	{"floor_lb": 18, "lookback": 15, "max_dist": 0.03, "regime_ma": 10, "weak_exp": 0.4}	25	29.914	-46.672	0.641	33.790	26.323	28.734	-22.901	19.528	TRAIN 29.91% <= best 34.28% [cagr] [risk:none select:cagr]
2026-09-15T03:29:53Z	discard	strat_floorhightier	{"floor_lb": 18, "lookback": 15, "max_dist": 0.03, "regime_ma": 10}	25	31.659	-33.952	0.932	29.412	33.838	26.964	-13.960	19.528	TRAIN 31.66% <= best 34.28% [cagr] [risk:none select:cagr]
2026-09-15T03:32:37Z	discard	strat_floorhigh	{"floor_lb": 18, "lookback": 15, "max_dist": 0.03, "regime_ma": 10, "weak_exp": 1.0}	25	31.117	-45.289	0.687	32.242	30.054	30.173	-28.063	19.528	TRAIN 31.12% <= best 34.28% [cagr] [risk:none select:cagr]
2026-09-15T03:32:45Z	discard	strat_floorhigh	{"floor_lb": 18, "lookback": 15, "max_dist": 0.03, "max_hold": 6, "regime_ma": 10, "weak_exp": 0.8}	25	30.227	-44.825	0.674	32.186	28.385	29.526	-25.929	19.528	TRAIN 30.23% <= best 34.28% [cagr] [risk:max_hold=6 select:cagr]
2026-09-15T03:32:47Z	discard	strat_floorhigh	{"floor_lb": 18, "lookback": 15, "max_dist": 0.03, "max_hold": 6, "regime_ma": 10, "weak_exp": 0.4}	25	29.352	-46.470	0.632	33.202	25.785	28.439	-22.469	19.528	TRAIN 29.35% <= best 34.28% [cagr] [risk:max_hold=6 select:cagr]
2026-09-15T03:35:04Z	discard	strat_floorhigh	{"floor_lb": 16, "lookback": 15, "max_dist": 0.03, "max_hold": 6, "regime_ma": 10, "weak_exp": 0.9}	25	31.143	-45.145	0.690	32.656	29.717	26.685	-27.941	19.528	TRAIN 31.14% <= best 34.28% [cagr] [risk:max_hold=6 select:cagr]
2026-09-15T03:35:06Z	discard	strat_floorhigh	{"floor_lb": 17, "lookback": 15, "max_dist": 0.03, "regime_ma": 10, "weak_exp": 1.0}	25	29.888	-44.806	0.667	29.510	30.249	27.783	-28.922	19.528	TRAIN 29.89% <= best 34.28% [cagr] [risk:none select:cagr]
2026-09-15T03:35:08Z	discard	strat_floorhigh	{"floor_lb": 16, "lookback": 15, "max_dist": 0.03, "regime_ma": 10, "weak_exp": 1.0}	25	31.596	-45.395	0.696	32.795	30.463	26.705	-28.862	19.528	TRAIN 31.60% <= best 34.28% [cagr] [risk:none select:cagr]
2026-09-15T03:36:35Z	discard	strat_highbase	{"floor_lb": 18, "lookback": 15, "max_dist": 0.03, "regime_ma": 10, "weak_exp": 0.4}	25	16.057	-33.643	0.477	17.523	14.677	17.188	-24.141	19.528	TRAIN 16.06% <= best 34.28% [cagr] [risk:none select:cagr]
2026-09-15T03:36:57Z	discard	strat_floorhighskiptier	{"b_hi": 0.65, "b_lo": 0.45, "b_mid": 0.55, "floor_lb": 18, "lookback": 15, "max_dist": 0.03, "regime_ma": 10, "skip_q": 0.9}	25	27.771	-15.679	1.771	17.683	38.193	26.001	-9.892	19.528	TRAIN 27.77% <= best 34.28% [cagr] [risk:none select:cagr]
2026-09-20T12:49:41Z	discard	strat_floorhightier	{"b_hi": 0.65, "b_lo": 0.45, "b_mid": 0.55, "floor_lb": 18, "lookback": 15, "max_dist": 0.03, "regime_ma": 10}	25	32.863	-18.378	1.788	26.983	38.723	26.268	-10.173	19.528	TRAIN 32.86% <= best 34.28% [cagr] [risk:none select:cagr]
2026-09-20T13:08:15Z	discard	strat_floorhightier	{"b_hi": 0.65, "b_lo": 0.45, "b_mid": 0.55, "floor_lb": 18, "lookback": 15, "max_dist": 0.05, "regime_ma": 10}	25	33.110	-19.247	1.720	26.531	39.702	26.110	-10.189	19.528	TRAIN 33.11% <= best 34.28% [cagr] [risk:none select:cagr]
2026-09-20T13:13:25Z	discard	strat_floorhightier	{"b_hi": 0.65, "b_lo": 0.45, "b_mid": 0.55, "floor_lb": 18, "lookback": 15, "max_dist": 0.05, "regime_ma": 14}	25	33.376	-22.366	1.492	29.113	37.571	23.896	-15.726	19.528	TRAIN 33.38% <= best 34.28% [cagr] [risk:none select:cagr]
2026-09-20T13:14:01Z	discard	strat_floorhightier	{"b_hi": 0.65, "b_lo": 0.45, "b_mid": 0.55, "floor_lb": 18, "lookback": 15, "max_dist": 0.05, "regime_ma": 18}	25	33.095	-16.832	1.966	29.888	36.227	24.582	-22.055	19.528	TRAIN 33.10% <= best 34.28% [cagr] [risk:none select:cagr]
2026-09-20T13:14:34Z	discard	strat_floorhightier	{"b_hi": 0.65, "b_lo": 0.45, "b_mid": 0.55, "floor_lb": 18, "lookback": 15, "max_dist": 0.05, "regime_ma": 18}	25	17.327	-18.074	0.959	14.321	20.267	23.840	-20.328	18.846	TRAIN 17.33% <= best 34.28% [cagr] [risk:none select:cagr]
2026-09-20T13:15:53Z	discard	strat_floorhightier	{"b_hi": 0.65, "b_lo": 0.45, "b_mid": 0.55, "floor_lb": 18, "lookback": 15, "max_dist": 0.05, "regime_ma": 18}	25	33.000	-14.791	2.231	25.718	40.336	21.604	-20.837	20.221	TRAIN 33.00% <= best 34.28% [cagr] [risk:none select:cagr]
2026-09-20T13:15:55Z	discard	strat_floorhightier	{"b_hi": 0.65, "b_lo": 0.45, "b_mid": 0.55, "floor_lb": 18, "lookback": 15, "max_dist": 0.05, "regime_ma": 18}	25	19.407	-15.221	1.275	18.377	20.398	20.043	-18.416	19.058	TRAIN 19.41% <= best 34.28% [cagr] [risk:none select:cagr]
2026-09-20T13:37:04Z	keep	strat_floorhightier	{"b_hi": 0.65, "b_lo": 0.45, "b_mid": 0.55, "floor_lb": 19, "lookback": 16, "max_dist": 0.055, "regime_ma": 18}	25	34.440	-17.676	1.948	33.594	35.252	23.774	-21.514	19.528	beats best on cagr [risk:none select:cagr]
2026-09-20T13:38:33Z	discard	strat_floorhightier	{"b_hi": 0.65, "b_lo": 0.45, "b_mid": 0.55, "floor_lb": 19, "lookback": 16, "max_dist": 0.055, "regime_ma": 18}	25	19.548	-15.268	1.280	18.736	20.327	19.489	-18.856	19.058	TRAIN 19.55% <= best 34.44% [cagr] [risk:none select:cagr]
2026-09-20T13:38:40Z	discard	strat_floorhightier	{"b_hi": 0.65, "b_lo": 0.45, "b_mid": 0.55, "floor_lb": 19, "lookback": 16, "max_dist": 0.055, "regime_ma": 18}	25	17.673	-17.941	0.985	15.944	19.345	23.529	-20.527	18.846	TRAIN 17.67% <= best 34.44% [cagr] [risk:none select:cagr]
2026-09-20T13:44:23Z	keep	strat_floorhighfresh	{"b_hi": 0.65, "b_lo": 0.45, "b_mid": 0.55, "floor_lb": 19, "lookback": 16, "max_dist": 0.055, "regime_ma": 18}	25	34.586	-12.819	2.698	33.615	35.520	23.678	-20.787	19.528	beats best on cagr [risk:none select:cagr]
2026-09-20T13:44:30Z	discard	strat_floorhighfresh	{"b_hi": 0.65, "b_lo": 0.45, "b_mid": 0.55, "floor_lb": 19, "lookback": 16, "max_dist": 0.055, "regime_ma": 18}	25	14.785	-25.581	0.578	11.266	18.245	19.312	-15.048	19.058	TRAIN 14.79% <= best 34.59% [cagr] [risk:none select:cagr]
2026-09-20T13:59:24Z	discard	strat_floorhighfastgate	{"b_hi": 0.65, "b_lo": 0.45, "b_mid": 0.55, "fast_ma": 6, "floor_lb": 19, "lookback": 16, "max_dist": 0.055, "regime_ma": 18}	25	34.586	-12.819	2.698	33.615	35.520	23.678	-20.787	19.528	TRAIN 34.59% <= best 34.59% [cagr] [risk:none select:cagr]
2026-09-20T13:59:32Z	discard	strat_floorhighfastgate	{"b_hi": 0.65, "b_lo": 0.45, "b_mid": 0.55, "fast_ma": 6, "floor_lb": 19, "lookback": 16, "max_dist": 0.055, "regime_ma": 18}	25	14.785	-25.581	0.578	11.266	18.245	19.312	-15.048	19.058	TRAIN 14.79% <= best 34.59% [cagr] [risk:none select:cagr]
2026-09-20T14:06:50Z	discard	strat_floorhighfastgate	{"b_hi": 0.65, "b_lo": 0.45, "b_mid": 0.55, "fast_ma": 6, "floor_lb": 19, "lookback": 16, "max_dist": 0.055, "regime_ma": 18}	25	14.344	-24.929	0.575	10.757	17.873	25.155	-14.821	18.846	TRAIN 14.34% <= best 34.59% [cagr] [risk:none select:cagr]
2026-09-20T14:09:25Z	discard	strat_floorhighsustainprint	{"b_hi": 0.65, "b_lo": 0.45, "b_mid": 0.55, "fast_ma": 6, "floor_lb": 19, "lookback": 16, "max_dist": 0.055, "regime_ma": 18, "sustain_lb": 6}	25	33.590	-11.731	2.863	31.389	35.724	22.088	-21.844	19.528	TRAIN 33.59% <= best 34.59% [cagr] [risk:none select:cagr]
2026-09-20T14:09:32Z	discard	strat_floorhighsustainprint	{"b_hi": 0.65, "b_lo": 0.45, "b_mid": 0.55, "fast_ma": 6, "floor_lb": 19, "lookback": 16, "max_dist": 0.055, "regime_ma": 18, "sustain_lb": 6}	25	13.763	-24.636	0.559	9.451	18.032	17.378	-15.591	19.058	TRAIN 13.76% <= best 34.59% [cagr] [risk:none select:cagr]
2026-09-20T14:11:18Z	discard	strat_floorhighsustainprint	{"b_hi": 0.65, "b_lo": 0.45, "b_mid": 0.55, "fast_ma": 6, "floor_lb": 19, "lookback": 16, "max_dist": 0.055, "regime_ma": 18, "sustain_lb": 6}	25	13.048	-23.918	0.546	9.191	16.851	23.340	-14.222	18.846	TRAIN 13.05% <= best 34.59% [cagr] [risk:none select:cagr]
2026-09-20T14:12:34Z	discard	strat_floorhighsustaincond	{"b_hi": 0.65, "b_lo": 0.45, "b_mid": 0.55, "fast_ma": 6, "floor_lb": 19, "lookback": 16, "max_dist": 0.055, "regime_ma": 18, "sustain_hi": 2, "sustain_lo": 6}	25	33.659	-11.565	2.910	31.217	36.030	22.821	-17.599	19.528	TRAIN 33.66% <= best 34.59% [cagr] [risk:none select:cagr]
2026-09-20T14:12:40Z	discard	strat_floorhighsustaincond	{"b_hi": 0.65, "b_lo": 0.45, "b_mid": 0.55, "fast_ma": 6, "floor_lb": 19, "lookback": 16, "max_dist": 0.055, "regime_ma": 18, "sustain_hi": 2, "sustain_lo": 6}	25	12.302	-29.346	0.419	8.426	16.126	14.385	-21.544	19.058	TRAIN 12.30% <= best 34.59% [cagr] [risk:none select:cagr]
2026-09-20T14:18:31Z	discard	strat_floorhighsustaincond	{"b_hi": 0.65, "b_lo": 0.45, "b_mid": 0.55, "fast_ma": 6, "floor_lb": 19, "lookback": 16, "max_dist": 0.055, "regime_ma": 18, "sustain_hi": 2, "sustain_lo": 6}	25	14.127	-26.432	0.534	12.185	16.010	22.361	-18.397	18.846	TRAIN 14.13% <= best 34.59% [cagr] [risk:none select:cagr]
2026-09-20T14:20:43Z	discard	strat_floorhightier	{"b_hi": 0.65, "b_lo": 0.45, "b_mid": 0.55, "floor_lb": 19, "lookback": 16, "max_dist": 0.055, "regime_ma": 18}	25	19.548	-15.268	1.280	18.736	20.327	19.489	-18.856	19.058	TRAIN 19.55% <= best 34.59% [cagr] [risk:none select:cagr]
2026-09-20T14:22:42Z	discard	strat_floorhighsustaincond	{"b_hi": 0.65, "b_lo": 0.45, "b_mid": 0.55, "fast_ma": 9, "floor_lb": 19, "lookback": 16, "max_dist": 0.055, "regime_ma": 18, "sustain_hi": 2, "sustain_lo": 6}	25	33.659	-11.565	2.910	31.217	36.030	22.821	-17.599	19.528	TRAIN 33.66% <= best 34.59% [cagr] [risk:none select:cagr]
2026-09-20T14:22:49Z	discard	strat_floorhighsustaincond	{"b_hi": 0.65, "b_lo": 0.45, "b_mid": 0.55, "fast_ma": 9, "floor_lb": 19, "lookback": 16, "max_dist": 0.055, "regime_ma": 18, "sustain_hi": 2, "sustain_lo": 6}	25	12.302	-29.346	0.419	8.426	16.126	14.385	-21.544	19.058	TRAIN 12.30% <= best 34.59% [cagr] [risk:none select:cagr]
2026-09-20T15:36:01Z	discard	strat_floorhighsustaincond	{"b_hi": 0.6, "b_lo": 0.45, "b_mid": 0.6, "fast_ma": 9, "floor_lb": 19, "lookback": 16, "max_dist": 0.055, "regime_ma": 18, "sustain_hi": 2, "sustain_lo": 6}	20	33.651	-15.908	2.115	30.882	36.346	16.661	-24.427	19.528	TRAIN 33.65% <= best 34.59% [cagr] [risk:none select:cagr]
2026-09-20T15:36:04Z	keep	strat_floorhightiershape	{"b_hi": 0.65, "b_lo": 0.45, "b_mid": 0.55, "fast_ma": 9, "floor_lb": 19, "lookback": 16, "max_dist": 0.055, "regime_ma": 18, "sustain_hi": 2, "sustain_lo": 4, "tier_lo": 0.55, "tier_mid": 1.0}	20	36.602	-14.341	2.552	36.258	36.932	20.866	-25.410	19.528	beats best on cagr [risk:none select:cagr]
2026-09-20T15:39:15Z	discard	strat_floorhightiershapeconc	{"b_hi": 0.65, "b_lo": 0.45, "b_mid": 0.55, "cap_full": 20, "cap_weak": 12, "fast_ma": 9, "floor_lb": 19, "lookback": 16, "max_dist": 0.055, "regime_ma": 18, "sustain_hi": 2, "sustain_lo": 4, "tier_lo": 0.55, "tier_mid": 1.0}	20	35.618	-18.518	1.923	35.912	35.337	21.096	-25.410	19.528	TRAIN 35.62% <= best 36.60% [cagr] [risk:none select:cagr]
2026-09-20T16:19:01Z	discard	strat_floorhightiershape	{"b_hi": 0.69, "b_lo": 0.45, "b_mid": 0.55, "fast_ma": 5, "floor_lb": 19, "lookback": 10, "max_dist": 0.055, "regime_ma": 18, "sustain_hi": 2, "sustain_lo": 3, "tier_lo": 1.0, "tier_mid": 1.0}	15	41.923	-25.330	1.655	43.903	40.061	19.020	-33.936	19.528	DD -25.3% breaches floor/slack [risk:none select:cagr]
2026-09-20T16:50:29Z	discard	strat_floorhighrankpersist	{"b_hi": 0.69, "b_lo": 0.45, "b_mid": 0.55, "fast_ma": 5, "floor_lb": 19, "lookback": 10, "max_dist": 0.055, "pers_lb": 22, "pers_w": -0.4, "regime_ma": 18, "sustain_hi": 2, "sustain_lo": 3, "tier_lo": 1.0, "tier_mid": 1.0}	15	42.800	-23.162	1.848	46.977	38.929	18.853	-33.460	19.528	DD -23.2% breaches floor/slack [risk:none select:cagr]
2026-09-20T17:02:18Z	discard	strat_floorhighrankpersist	{"b_hi": 0.69, "b_lo": 0.45, "b_mid": 0.55, "fast_ma": 5, "floor_lb": 19, "lookback": 10, "max_dist": 0.055, "max_hold": 4, "pers_lb": 6, "pers_w": -0.16, "regime_ma": 18, "sustain_hi": 2, "sustain_lo": 3, "tier_lo": 1.0, "tier_mid": 1.0}	15	43.801	-20.581	2.128	46.377	41.387	20.164	-33.361	19.528	DD -20.6% breaches floor/slack [risk:max_hold=4 select:cagr]
2026-09-20T18:36:25Z	discard	strat_l12b2_symcap	{"b_hi": 0.69, "b_lo": 0.45, "b_mid": 0.55, "cap_full": 18, "cap_weak": 12, "fast_ma": 5, "floor_lb": 19, "lookback": 10, "max_dist": 0.055, "max_hold": 4, "pers_lb": 6, "pers_w": -0.16, "regime_ma": 18, "sustain_hi": 2, "sustain_lo": 3, "tier_lo": 0.999, "tier_mid": 0.999}	15	42.985	-24.313	1.768	44.603	41.459	19.154	-33.461	19.528	DD -24.3% breaches floor/slack [risk:max_hold=4 select:cagr]
2026-09-20T18:43:31Z	discard	strat_floorhightiershapeconc	{"b_hi": 0.69, "b_lo": 0.45, "b_mid": 0.55, "cap_full": 20, "cap_weak": 11, "fast_ma": 5, "floor_lb": 19, "lookback": 10, "max_dist": 0.055, "max_hold": 3, "regime_ma": 18, "sustain_hi": 2, "sustain_lo": 3, "tier_lo": 0.9999, "tier_mid": 0.9999}	15	39.479	-26.585	1.485	38.980	39.957	21.495	-30.401	19.528	DD -26.6% breaches floor/slack [risk:max_hold=3 select:cagr]
2026-09-20T18:47:14Z	baseline	strat_floorhighrankpersist	{"b_hi": 0.69, "b_lo": 0.45, "b_mid": 0.55, "fast_ma": 5, "floor_lb": 19, "lookback": 10, "max_dist": 0.055, "max_hold": 2, "pers_lb": 4, "pers_w": -0.18, "regime_ma": 18, "sustain_hi": 2, "sustain_lo": 3, "tier_lo": 1.0, "tier_mid": 1.0}	13	40.128	-23.069	1.739	45.550	35.146	21.121	-38.323	19.528	first entry [risk:max_hold=2 select:cagr]
2026-09-20T18:47:17Z	discard	strat_floorhighrankpersist	{"b_hi": 0.69, "b_lo": 0.45, "b_mid": 0.55, "fast_ma": 5, "floor_lb": 19, "lookback": 10, "max_dist": 0.055, "max_hold": 2, "pers_lb": 5, "pers_w": -0.18, "regime_ma": 18, "sustain_hi": 2, "sustain_lo": 3, "tier_lo": 1.0, "tier_mid": 1.0}	13	40.069	-24.713	1.621	44.423	36.041	24.448	-35.938	19.528	TRAIN 40.07% <= best 40.13% [cagr] [risk:max_hold=2 select:cagr]
2026-09-20T19:49:00Z	discard	strat_l13a_concwobble	{"b_hi": 0.69, "b_lo": 0.45, "b_mid": 0.55, "cap_full": 20, "cap_weak": 11, "fast_ma": 5, "floor_lb": 19, "gf_lb": 12, "gf_w": 0.0, "gw_w": 0.12, "lookback": 10, "max_dist": 0.055, "max_hold": 3, "regime_ma": 18, "sustain_hi": 2, "sustain_lo": 3, "tier_lo": 0.9999, "tier_mid": 0.9999}	15	39.103	-26.229	1.491	38.109	40.057	22.105	-30.401	19.528	DD -26.2% breaches floor/slack [risk:max_hold=3 select:cagr]
2026-09-20T19:52:25Z	discard	strat_l13a_concwobble	{"b_hi": 0.69, "b_lo": 0.45, "b_mid": 0.55, "cap_full": 20, "cap_weak": 11, "fast_ma": 5, "floor_lb": 19, "gf_lb": 12, "gf_w": 0.0, "gw_w": 0.13, "lookback": 10, "max_dist": 0.055, "max_hold": 3, "regime_ma": 18, "sustain_hi": 2, "sustain_lo": 3, "tier_lo": 0.9999, "tier_mid": 0.9999}	15	38.958	-26.654	1.462	37.814	40.057	21.312	-30.401	19.528	DD -26.7% breaches floor/slack [risk:max_hold=3 select:cagr]
2026-09-20T20:37:37Z	discard	strat_l13a_concwobble	{"b_hi": 0.69, "b_lo": 0.45, "b_mid": 0.55, "cap_full": 20, "cap_weak": 11, "fast_ma": 5, "floor_lb": 19, "gf_lb": 12, "gf_w": 0.0, "gw_w": 0.13, "lookback": 12, "max_dist": 0.055, "max_hold": 3, "regime_ma": 18, "sustain_hi": 2, "sustain_lo": 3, "tier_lo": 0.9999, "tier_mid": 0.9999}	15	39.199	-26.654	1.471	37.814	40.532	21.153	-30.401	19.528	DD -26.7% breaches floor/slack [risk:max_hold=3 select:cagr]
2026-09-21T08:21:36Z	discard	strat_l13a_concwobble	{"b_hi": 0.69, "b_lo": 0.45, "b_mid": 0.55, "cap_full": 20, "cap_weak": 11, "fast_ma": 5, "floor_lb": 19, "gf_lb": 12, "gf_w": 0.0, "gw_w": 0.13, "lookback": 12, "max_dist": 0.055, "max_hold": 3, "regime_ma": 18, "sustain_hi": 2, "sustain_lo": 3, "tier_lo": 0.9999, "tier_mid": 0.9999}	15	39.199	-26.654	1.471	37.814	40.532	21.153	-30.401	19.528	DD -26.7% breaches floor/slack [risk:max_hold=3 select:cagr]
2026-09-21T08:22:19Z	discard	strat_l15b_rngcomp	{"b_hi": 0.69, "b_lo": 0.45, "b_mid": 0.55, "cap_full": 20, "cap_weak": 11, "cmp_lb": 6, "cmp_w": -0.4, "fast_ma": 5, "floor_lb": 19, "gf_lb": 12, "gf_w": 0.0, "gw_w": 0.13, "lookback": 12, "max_dist": 0.055, "max_hold": 3, "regime_ma": 18, "sustain_hi": 2, "sustain_lo": 3, "tier_lo": 0.9999, "tier_mid": 0.9999}	15	33.424	-26.571	1.258	28.890	37.896	31.366	-31.271	19.528	TRAIN 33.42% <= best 36.60% [cagr] [risk:max_hold=3 select:cagr]
2026-09-21T08:22:58Z	discard	strat_l15b_insideday	{"b_hi": 0.69, "b_lo": 0.45, "b_mid": 0.55, "cap_full": 20, "cap_weak": 11, "fast_ma": 5, "floor_lb": 19, "gf_lb": 12, "gf_w": 0.0, "gw_w": 0.13, "ids_lb": 6, "ids_w": -0.3, "lookback": 12, "max_dist": 0.055, "max_hold": 3, "regime_ma": 18, "sustain_hi": 2, "sustain_lo": 3, "tier_lo": 0.9999, "tier_mid": 0.9999}	15	29.225	-27.998	1.044	23.191	35.254	24.359	-31.733	19.528	TRAIN 29.23% <= best 36.60% [cagr] [risk:max_hold=3 select:cagr]
2026-09-21T08:23:32Z	discard	strat_l15b_insideday	{"b_hi": 0.69, "b_lo": 0.45, "b_mid": 0.55, "cap_full": 20, "cap_weak": 11, "fast_ma": 5, "floor_lb": 19, "gf_lb": 12, "gf_w": 0.0, "gw_w": 0.13, "ids_lb": 6, "ids_w": -0.4, "lookback": 12, "max_dist": 0.055, "max_hold": 3, "regime_ma": 18, "sustain_hi": 2, "sustain_lo": 3, "tier_lo": 0.9999, "tier_mid": 0.9999}	15	27.665	-26.381	1.049	24.840	30.418	22.354	-30.849	19.528	TRAIN 27.66% <= best 36.60% [cagr] [risk:max_hold=3 select:cagr]
2026-09-21T08:31:01Z	discard	strat_l15b_insideday	{"b_hi": 0.69, "b_lo": 0.45, "b_mid": 0.55, "cap_full": 20, "cap_weak": 11, "fast_ma": 5, "floor_lb": 19, "gf_lb": 12, "gf_w": 0.0, "gw_w": 0.13, "ids_lb": 3, "ids_w": -0.15, "lookback": 12, "max_dist": 0.055, "max_hold": 3, "regime_ma": 18, "sustain_hi": 2, "sustain_lo": 3, "tier_lo": 0.9999, "tier_mid": 0.9999}	15	35.438	-25.005	1.417	34.249	36.581	23.024	-30.261	19.528	TRAIN 35.44% <= best 36.60% [cagr] [risk:max_hold=3 select:cagr]
2026-09-21T08:31:14Z	discard	strat_l15b_insideday	{"b_hi": 0.69, "b_lo": 0.45, "b_mid": 0.55, "cap_full": 20, "cap_weak": 11, "fast_ma": 5, "floor_lb": 19, "gf_lb": 12, "gf_w": 0.0, "gw_w": 0.13, "ids_lb": 3, "ids_w": -0.25, "lookback": 12, "max_dist": 0.055, "max_hold": 3, "regime_ma": 18, "sustain_hi": 2, "sustain_lo": 3, "tier_lo": 0.9999, "tier_mid": 0.9999}	15	34.415	-27.998	1.229	30.929	37.826	24.937	-33.070	19.528	TRAIN 34.42% <= best 36.60% [cagr] [risk:max_hold=3 select:cagr]
2026-09-21T08:37:18Z	discard	strat_l15b_insideday	{"b_hi": 0.69, "b_lo": 0.45, "b_mid": 0.55, "cap_full": 20, "cap_weak": 11, "fast_ma": 5, "floor_lb": 19, "gf_lb": 12, "gf_w": 0.0, "gw_w": 0.13, "ids_lb": 3, "ids_w": -0.13, "lookback": 12, "max_dist": 0.055, "max_hold": 3, "regime_ma": 18, "sustain_hi": 2, "sustain_lo": 3, "tier_lo": 0.9999, "tier_mid": 0.9999}	15	35.673	-24.909	1.432	34.345	36.951	23.571	-28.977	19.528	TRAIN 35.67% <= best 36.60% [cagr] [risk:max_hold=3 select:cagr]
2026-09-21T08:48:23Z	discard	strat_l15b_insideday	{"b_hi": 0.69, "b_lo": 0.45, "b_mid": 0.55, "cap_full": 20, "cap_weak": 11, "fast_ma": 5, "floor_lb": 19, "gf_lb": 12, "gf_w": 0.0, "gw_w": 0.15, "ids_lb": 3, "ids_w": -0.13, "lookback": 12, "max_dist": 0.055, "max_hold": 3, "regime_ma": 18, "sustain_hi": 2, "sustain_lo": 3, "tier_lo": 0.9999, "tier_mid": 0.9999}	15	35.913	-25.094	1.431	34.499	37.276	23.492	-28.977	19.528	TRAIN 35.91% <= best 36.60% [cagr] [risk:max_hold=3 select:cagr]
2026-09-21T08:57:55Z	discard	strat_l15b_rngcomp	{"b_hi": 0.69, "b_lo": 0.45, "b_mid": 0.55, "cap_full": 15, "cap_weak": 11, "cmp_lb": 6, "cmp_w": -0.4, "fast_ma": 5, "floor_lb": 19, "gf_lb": 12, "gf_w": 0.0, "gw_w": 0.13, "lookback": 12, "max_dist": 0.055, "max_hold": 6, "regime_ma": 18, "sustain_hi": 2, "sustain_lo": 3, "tier_lo": 0.9999, "tier_mid": 0.9999}	15	31.834	-27.850	1.143	27.528	36.076	28.871	-32.043	19.528	TRAIN 31.83% <= best 36.60% [cagr] [risk:max_hold=6 select:cagr]
