ts	status	candidate	params	top	train_cagr	train_dd	ret_dd	h1	h2	fwd_cagr	fwd_dd	fwd_bench	note
2026-09-20T15:51:26Z	discard	strat_floorhighsustaincond	{"b_hi": 0.57, "b_lo": 0.4, "b_mid": 0.6, "fast_ma": 8, "floor_lb": 19, "lookback": 15, "max_dist": 0.055, "max_hold": 7, "regime_ma": 20, "sustain_hi": 2, "sustain_lo": 3}	15	66.805	-19.688	3.393	59.835	73.733	40.300	-14.374	14.717	TRAIN 66.80% <= best 66.97% [cagr] [risk:max_hold=7 select:cagr]
2026-09-20T15:51:34Z	discard	strat_floorhighsustaincond	{"b_hi": 0.57, "b_lo": 0.4, "b_mid": 0.6, "fast_ma": 8, "floor_lb": 19, "lookback": 14, "max_dist": 0.055, "max_hold": 7, "regime_ma": 19, "sustain_hi": 2, "sustain_lo": 3}	15	65.359	-19.688	3.320	56.688	74.073	39.214	-14.374	14.717	TRAIN 65.36% <= best 66.97% [cagr] [risk:max_hold=7 select:cagr]
2026-09-20T15:51:41Z	discard	strat_floorhighsustaincond	{"b_hi": 0.57, "b_lo": 0.4, "b_mid": 0.6, "fast_ma": 8, "floor_lb": 19, "lookback": 14, "max_dist": 0.055, "max_hold": 7, "regime_ma": 21, "sustain_hi": 2, "sustain_lo": 3}	15	64.474	-23.058	2.796	54.976	74.073	42.070	-14.374	14.717	TRAIN 64.47% <= best 66.97% [cagr] [risk:max_hold=7 select:cagr]
2026-09-20T15:51:48Z	discard	strat_floorhighsustaincond	{"b_hi": 0.57, "b_lo": 0.4, "b_mid": 0.6, "fast_ma": 8, "floor_lb": 20, "lookback": 14, "max_dist": 0.055, "max_hold": 7, "regime_ma": 20, "sustain_hi": 2, "sustain_lo": 3}	15	65.262	-21.821	2.991	53.943	76.829	37.736	-20.298	14.717	TRAIN 65.26% <= best 66.97% [cagr] [risk:max_hold=7 select:cagr]
2026-09-20T15:52:03Z	discard	strat_floorhighsustaincond	{"b_hi": 0.57, "b_lo": 0.4, "b_mid": 0.6, "fast_ma": 8, "floor_lb": 18, "lookback": 14, "max_dist": 0.055, "max_hold": 7, "regime_ma": 20, "sustain_hi": 2, "sustain_lo": 3}	15	63.843	-20.091	3.178	59.900	67.694	43.810	-16.379	14.717	TRAIN 63.84% <= best 66.97% [cagr] [risk:max_hold=7 select:cagr]
2026-09-20T15:52:11Z	discard	strat_floorhighsustaincond	{"b_hi": 0.57, "b_lo": 0.4, "b_mid": 0.6, "fast_ma": 7, "floor_lb": 19, "lookback": 14, "max_dist": 0.055, "max_hold": 7, "regime_ma": 20, "sustain_hi": 2, "sustain_lo": 3}	15	66.971	-19.688	3.402	59.835	74.073	40.300	-14.374	14.717	TRAIN 66.97% <= best 66.97% [cagr] [risk:max_hold=7 select:cagr]
2026-09-20T15:52:19Z	discard	strat_floorhighsustaincond	{"b_hi": 0.57, "b_lo": 0.4, "b_mid": 0.6, "fast_ma": 9, "floor_lb": 19, "lookback": 14, "max_dist": 0.055, "max_hold": 7, "regime_ma": 20, "sustain_hi": 2, "sustain_lo": 3}	15	66.667	-19.688	3.386	59.239	74.073	40.300	-14.374	14.717	TRAIN 66.67% <= best 66.97% [cagr] [risk:max_hold=7 select:cagr]
2026-09-20T15:52:29Z	discard	strat_floorhighsustaincond	{"b_hi": 0.57, "b_lo": 0.4, "b_mid": 0.6, "fast_ma": 8, "floor_lb": 19, "lookback": 14, "max_dist": 0.055, "max_hold": 7, "regime_ma": 20, "sustain_hi": 1, "sustain_lo": 3}	15	66.035	-19.606	3.368	58.949	73.087	38.771	-14.374	14.717	TRAIN 66.04% <= best 66.97% [cagr] [risk:max_hold=7 select:cagr]
2026-09-20T15:52:38Z	discard	strat_floorhighsustaincond	{"b_hi": 0.57, "b_lo": 0.4, "b_mid": 0.6, "fast_ma": 8, "floor_lb": 19, "lookback": 14, "max_dist": 0.055, "max_hold": 7, "regime_ma": 20, "sustain_hi": 3, "sustain_lo": 3}	15	66.101	-20.235	3.267	58.133	74.073	40.815	-14.374	14.717	TRAIN 66.10% <= best 66.97% [cagr] [risk:max_hold=7 select:cagr]
2026-09-20T15:52:48Z	discard	strat_floorhighsustaincond	{"b_hi": 0.57, "b_lo": 0.45, "b_mid": 0.6, "fast_ma": 8, "floor_lb": 19, "lookback": 14, "max_dist": 0.055, "max_hold": 7, "regime_ma": 20, "sustain_hi": 2, "sustain_lo": 3}	15	61.472	-19.688	3.122	58.672	64.188	39.189	-14.374	14.717	TRAIN 61.47% <= best 66.97% [cagr] [risk:max_hold=7 select:cagr]
2026-09-20T15:52:58Z	discard	strat_floorhighsustaincond	{"b_hi": 0.57, "b_lo": 0.4, "b_mid": 0.55, "fast_ma": 8, "floor_lb": 19, "lookback": 14, "max_dist": 0.055, "max_hold": 7, "regime_ma": 20, "sustain_hi": 2, "sustain_lo": 3}	15	65.666	-19.688	3.335	57.286	74.073	41.088	-14.374	14.717	TRAIN 65.67% <= best 66.97% [cagr] [risk:max_hold=7 select:cagr]
2026-09-20T15:53:09Z	discard	strat_floorhighsustaincond	{"b_hi": 0.57, "b_lo": 0.4, "b_mid": 0.6, "fast_ma": 8, "floor_lb": 19, "lookback": 14, "max_dist": 0.055, "max_hold": 7, "regime_ma": 20, "sustain_hi": 2, "sustain_lo": 3}	16	62.271	-19.017	3.274	57.815	66.636	39.204	-12.855	14.717	TRAIN 62.27% <= best 66.97% [cagr] [risk:max_hold=7 select:cagr]
2026-09-20T15:53:18Z	discard	strat_floorhighsustaincond	{"b_hi": 0.57, "b_lo": 0.4, "b_mid": 0.6, "fast_ma": 8, "floor_lb": 19, "lookback": 14, "max_dist": 0.055, "max_hold": 7, "regime_ma": 20, "sustain_hi": 2, "sustain_lo": 3}	14	63.914	-22.828	2.800	54.353	73.582	38.558	-20.787	14.717	TRAIN 63.91% <= best 66.97% [cagr] [risk:max_hold=7 select:cagr]
2026-09-20T15:53:27Z	discard	strat_floorhighsector	{"b_hi": 0.57, "b_lo": 0.4, "b_mid": 0.6, "fast_ma": 8, "floor_lb": 19, "ind_q": 0.5, "lookback": 14, "max_dist": 0.055, "max_hold": 7, "regime_ma": 20, "sect_lb": 6, "sustain_hi": 2, "sustain_lo": 3}	15	63.007	-19.945	3.159	52.957	73.203	34.086	-14.374	14.717	TRAIN 63.01% <= best 66.97% [cagr] [risk:max_hold=7 select:cagr]
2026-09-20T15:53:38Z	discard	strat_floorhighaccum	{"acc_lb": 3, "acc_min": 0.0, "b_hi": 0.57, "b_lo": 0.4, "b_mid": 0.6, "fast_ma": 8, "floor_lb": 19, "lookback": 14, "max_dist": 0.055, "max_hold": 7, "regime_ma": 20, "sustain_hi": 2, "sustain_lo": 3}	15	58.732	-20.722	2.834	54.782	62.592	40.477	-14.374	14.717	TRAIN 58.73% <= best 66.97% [cagr] [risk:max_hold=7 select:cagr]
2026-09-20T15:53:47Z	discard	strat_floorhighsustaincond	{"b_hi": 0.57, "b_lo": 0.4, "b_mid": 0.6, "fast_ma": 8, "floor_lb": 19, "lookback": 12, "max_dist": 0.055, "max_hold": 7, "regime_ma": 20, "sustain_hi": 2, "sustain_lo": 3}	15	66.947	-19.688	3.400	62.116	71.689	40.632	-14.374	14.717	TRAIN 66.95% <= best 66.97% [cagr] [risk:max_hold=7 select:cagr]
2026-09-20T15:53:55Z	discard	strat_floorhighsustaincond	{"b_hi": 0.57, "b_lo": 0.4, "b_mid": 0.6, "fast_ma": 8, "floor_lb": 19, "lookback": 16, "max_dist": 0.055, "max_hold": 7, "regime_ma": 20, "sustain_hi": 2, "sustain_lo": 3}	15	66.429	-19.688	3.374	59.596	73.216	40.300	-14.374	14.717	TRAIN 66.43% <= best 66.97% [cagr] [risk:max_hold=7 select:cagr]
2026-09-20T15:54:06Z	discard	strat_floorhighsustaincond	{"b_hi": 0.565, "b_lo": 0.4, "b_mid": 0.6, "fast_ma": 8, "floor_lb": 19, "lookback": 14, "max_dist": 0.055, "max_hold": 7, "regime_ma": 20, "sustain_hi": 2, "sustain_lo": 3}	15	66.971	-19.688	3.402	59.835	74.073	40.300	-14.374	14.717	TRAIN 66.97% <= best 66.97% [cagr] [risk:max_hold=7 select:cagr]
2026-09-20T15:54:16Z	discard	strat_floorhighsustaincond	{"b_hi": 0.575, "b_lo": 0.4, "b_mid": 0.6, "fast_ma": 8, "floor_lb": 19, "lookback": 14, "max_dist": 0.055, "max_hold": 7, "regime_ma": 20, "sustain_hi": 2, "sustain_lo": 3}	15	65.359	-19.688	3.320	56.688	74.073	40.300	-14.374	14.717	TRAIN 65.36% <= best 66.97% [cagr] [risk:max_hold=7 select:cagr]
2026-09-20T15:54:25Z	discard	strat_floorhighsector	{"b_hi": 0.57, "b_lo": 0.4, "b_mid": 0.6, "fast_ma": 8, "floor_lb": 19, "ind_q": 0.0, "lookback": 14, "max_dist": 0.055, "max_hold": 7, "regime_ma": 20, "sect_lb": 6, "sustain_hi": 2, "sustain_lo": 3}	15	64.195	-19.265	3.332	54.438	74.073	33.102	-14.374	14.717	TRAIN 64.20% <= best 66.97% [cagr] [risk:max_hold=7 select:cagr]
2026-09-20T15:54:39Z	discard	strat_floorhighaccum	{"acc_lb": 6, "acc_min": 0.1, "b_hi": 0.57, "b_lo": 0.4, "b_mid": 0.6, "fast_ma": 8, "floor_lb": 19, "lookback": 14, "max_dist": 0.055, "max_hold": 7, "regime_ma": 20, "sustain_hi": 2, "sustain_lo": 3}	15	54.927	-20.620	2.664	46.837	63.055	49.393	-14.331	14.717	TRAIN 54.93% <= best 66.97% [cagr] [risk:max_hold=7 select:cagr]
2026-09-20T15:54:48Z	discard	strat_floorhighvoltarget	{"b_hi": 0.57, "b_lo": 0.4, "b_mid": 0.6, "fast_ma": 8, "floor_lb": 19, "lookback": 14, "max_dist": 0.055, "max_hold": 7, "regime_ma": 20, "sustain_hi": 2, "sustain_lo": 3, "vt_lb": 6, "vt_target": 0.15}	15	48.866	-15.300	3.194	49.349	48.407	25.914	-11.954	14.717	TRAIN 48.87% <= best 66.97% [cagr] [risk:max_hold=7 select:cagr]
2026-09-20T15:54:57Z	discard	strat_floorhighsustaincond	{"b_hi": 0.57, "b_lo": 0.4, "b_mid": 0.6, "fast_ma": 7, "floor_lb": 19, "lookback": 15, "max_dist": 0.055, "max_hold": 7, "regime_ma": 20, "sustain_hi": 2, "sustain_lo": 3}	15	66.805	-19.688	3.393	59.835	73.733	40.300	-14.374	14.717	TRAIN 66.80% <= best 66.97% [cagr] [risk:max_hold=7 select:cagr]
2026-09-20T15:55:15Z	discard	strat_floorhighsustaincond	{"b_hi": 0.57, "b_lo": 0.4, "b_mid": 0.6, "fast_ma": 8, "floor_lb": 19, "lookback": 14, "max_dist": 0.055, "max_hold": 7, "regime_ma": 20, "sustain_hi": 3, "sustain_lo": 2}	15	62.082	-18.541	3.348	57.839	66.233	42.992	-14.551	14.717	TRAIN 62.08% <= best 66.97% [cagr] [risk:max_hold=7 select:cagr]
2026-09-20T15:55:23Z	discard	strat_floorhighsustaincond	{"b_hi": 0.57, "b_lo": 0.4, "b_mid": 0.6, "fast_ma": 8, "floor_lb": 19, "lookback": 15, "max_dist": 0.055, "max_hold": 7, "regime_ma": 20, "sustain_hi": 2, "sustain_lo": 2}	15	62.768	-18.541	3.385	59.538	65.909	42.470	-15.543	14.717	TRAIN 62.77% <= best 66.97% [cagr] [risk:max_hold=7 select:cagr]
2026-09-20T15:55:31Z	discard	strat_floorhighsustaincond	{"b_hi": 0.57, "b_lo": 0.4, "b_mid": 0.6, "fast_ma": 8, "floor_lb": 19, "lookback": 14, "max_dist": 0.055, "max_hold": 4, "regime_ma": 20, "sustain_hi": 2, "sustain_lo": 3}	15	68.232	-23.186	2.943	61.805	74.597	40.445	-14.374	14.717	DD -23.2% breaches floor/slack [risk:max_hold=4 select:cagr]
2026-09-20T15:55:39Z	discard	strat_floorhighsustaincond	{"b_hi": 0.57, "b_lo": 0.4, "b_mid": 0.6, "fast_ma": 8, "floor_lb": 19, "lookback": 14, "max_dist": 0.055, "max_hold": 11, "regime_ma": 20, "sustain_hi": 2, "sustain_lo": 3}	15	64.769	-19.885	3.257	57.006	72.528	41.244	-14.374	14.717	TRAIN 64.77% <= best 66.97% [cagr] [risk:max_hold=11 select:cagr]
2026-09-20T15:55:50Z	discard	strat_floorhighsustaincond	{"b_hi": 0.6, "b_lo": 0.4, "b_mid": 0.6, "fast_ma": 8, "floor_lb": 19, "lookback": 14, "max_dist": 0.055, "max_hold": 4, "regime_ma": 20, "sustain_hi": 2, "sustain_lo": 3}	15	65.817	-23.186	2.839	57.082	74.597	35.558	-14.374	14.717	TRAIN 65.82% <= best 66.97% [cagr] [risk:max_hold=4 select:cagr]
2026-09-20T15:55:58Z	discard	strat_floorhighsustaincond	{"b_hi": 0.57, "b_lo": 0.4, "b_mid": 0.6, "fast_ma": 8, "floor_lb": 18, "lookback": 14, "max_dist": 0.055, "max_hold": 4, "regime_ma": 20, "sustain_hi": 2, "sustain_lo": 3}	15	65.859	-19.429	3.390	63.590	68.052	44.128	-16.379	14.717	TRAIN 65.86% <= best 66.97% [cagr] [risk:max_hold=4 select:cagr]
2026-09-20T15:56:08Z	discard	strat_floorhighsustaincond	{"b_hi": 0.57, "b_lo": 0.4, "b_mid": 0.6, "fast_ma": 8, "floor_lb": 18, "lookback": 14, "max_dist": 0.055, "max_hold": 4, "regime_ma": 20, "sustain_hi": 2, "sustain_lo": 4}	15	61.959	-21.704	2.855	55.820	68.036	41.922	-16.379	14.717	TRAIN 61.96% <= best 66.97% [cagr] [risk:max_hold=4 select:cagr]
2026-09-20T15:56:16Z	discard	strat_floorhighsustaincond	{"b_hi": 0.6, "b_lo": 0.4, "b_mid": 0.6, "fast_ma": 8, "floor_lb": 18, "lookback": 14, "max_dist": 0.055, "max_hold": 4, "regime_ma": 20, "sustain_hi": 2, "sustain_lo": 3}	15	63.147	-19.429	3.250	58.157	68.052	39.197	-16.379	14.717	TRAIN 63.15% <= best 66.97% [cagr] [risk:max_hold=4 select:cagr]
2026-09-20T15:56:22Z	discard	strat_floorhighsustaincond	{"b_hi": 0.57, "b_lo": 0.4, "b_mid": 0.6, "fast_ma": 8, "floor_lb": 18, "lookback": 14, "max_dist": 0.055, "max_hold": 5, "regime_ma": 20, "sustain_hi": 2, "sustain_lo": 3}	15	60.983	-20.091	3.035	58.091	63.789	47.283	-16.407	14.717	TRAIN 60.98% <= best 66.97% [cagr] [risk:max_hold=5 select:cagr]
2026-09-20T15:56:35Z	discard	strat_floorhighsustaincond	{"b_hi": 0.57, "b_lo": 0.4, "b_mid": 0.6, "fast_ma": 8, "floor_lb": 19, "lookback": 14, "max_dist": 0.04, "max_hold": 7, "regime_ma": 20, "sustain_hi": 2, "sustain_lo": 3}	15	66.971	-19.688	3.402	59.835	74.073	40.300	-14.374	14.717	TRAIN 66.97% <= best 66.97% [cagr] [risk:max_hold=7 select:cagr]
2026-09-20T15:56:42Z	discard	strat_floorhighsustaincond	{"b_hi": 0.57, "b_lo": 0.4, "b_mid": 0.6, "fast_ma": 8, "floor_lb": 19, "lookback": 14, "max_dist": 0.08, "max_hold": 7, "regime_ma": 20, "sustain_hi": 2, "sustain_lo": 3}	15	66.971	-19.688	3.402	59.835	74.073	40.300	-14.374	14.717	TRAIN 66.97% <= best 66.97% [cagr] [risk:max_hold=7 select:cagr]
2026-09-20T15:56:56Z	discard	strat_floorhighaccum	{"b_hi": 0.57, "b_lo": 0.4, "b_mid": 0.6, "fast_ma": 8, "floor_lb": 19, "lookback": 14, "max_dist": 0.055, "max_hold": 7, "regime_ma": 20, "sustain_hi": 2, "sustain_lo": 3}	15	65.941	-18.977	3.475	60.762	71.035	40.959	-14.374	14.717	TRAIN 65.94% <= best 66.97% [cagr] [risk:max_hold=7 select:cagr]
2026-09-20T15:57:11Z	discard	strat_floorhighsustaincond	{"b_hi": 0.57, "b_lo": 0.4, "b_mid": 0.6, "fast_ma": 8, "floor_lb": 18, "lookback": 14, "max_dist": 0.055, "max_hold": 6, "regime_ma": 20, "sustain_hi": 2, "sustain_lo": 3}	15	59.647	-20.091	2.969	54.125	65.096	46.588	-15.611	14.717	TRAIN 59.65% <= best 66.97% [cagr] [risk:max_hold=6 select:cagr]
2026-09-20T15:57:22Z	discard	strat_floorhighsustaincond	{"b_hi": 0.57, "b_lo": 0.4, "b_mid": 0.6, "fast_ma": 8, "floor_lb": 18, "lookback": 14, "max_dist": 0.055, "max_hold": 7, "regime_ma": 20, "sustain_hi": 2, "sustain_lo": 4}	15	60.766	-20.429	2.975	53.641	67.867	44.060	-16.379	14.717	TRAIN 60.77% <= best 66.97% [cagr] [risk:max_hold=7 select:cagr]
2026-09-20T15:57:29Z	discard	strat_floorhighsustaincond	{"b_hi": 0.57, "b_lo": 0.4, "b_mid": 0.6, "fast_ma": 8, "floor_lb": 19, "lookback": 15, "max_dist": 0.055, "max_hold": 7, "regime_ma": 20, "sustain_hi": 1, "sustain_lo": 3}	15	65.931	-19.606	3.363	58.949	72.874	38.771	-14.374	14.717	TRAIN 65.93% <= best 66.97% [cagr] [risk:max_hold=7 select:cagr]
2026-09-20T15:57:37Z	discard	strat_floorhighsustaincond	{"b_hi": 0.57, "b_lo": 0.4, "b_mid": 0.6, "fast_ma": 8, "floor_lb": 19, "lookback": 14, "max_dist": 0.055, "max_hold": 7, "regime_ma": 19, "sustain_hi": 2, "sustain_lo": 3}	15	65.359	-19.688	3.320	56.688	74.073	39.214	-14.374	14.717	TRAIN 65.36% <= best 66.97% [cagr] [risk:max_hold=7 select:cagr]
2026-09-20T15:57:46Z	discard	strat_floorhighsustaincond	{"b_hi": 0.57, "b_lo": 0.45, "b_mid": 0.6, "fast_ma": 8, "floor_lb": 18, "lookback": 14, "max_dist": 0.055, "max_hold": 7, "regime_ma": 20, "sustain_hi": 2, "sustain_lo": 3}	15	58.570	-20.091	2.915	58.736	58.411	42.885	-16.379	14.717	TRAIN 58.57% <= best 66.97% [cagr] [risk:max_hold=7 select:cagr]
2026-09-20T15:57:55Z	discard	strat_floorhighsustaincond	{"b_hi": 0.57, "b_lo": 0.4, "b_mid": 0.6, "fast_ma": 8, "floor_lb": 19, "lookback": 13, "max_dist": 0.055, "max_hold": 7, "regime_ma": 20, "sustain_hi": 1, "sustain_lo": 3}	15	65.232	-19.606	3.327	58.818	71.589	38.771	-14.374	14.717	TRAIN 65.23% <= best 66.97% [cagr] [risk:max_hold=7 select:cagr]
2026-09-20T15:58:06Z	discard	strat_floorhighsustaincond	{"b_hi": 0.57, "b_lo": 0.4, "b_mid": 0.6, "fast_ma": 8, "floor_lb": 18, "lookback": 14, "max_dist": 0.055, "max_hold": 7, "regime_ma": 19, "sustain_hi": 2, "sustain_lo": 3}	15	62.126	-20.091	3.092	56.486	67.694	42.687	-16.379	14.717	TRAIN 62.13% <= best 66.97% [cagr] [risk:max_hold=7 select:cagr]
2026-09-20T15:58:14Z	discard	strat_floorhighsustaincond	{"b_hi": 0.57, "b_lo": 0.4, "b_mid": 0.6, "fast_ma": 9, "floor_lb": 18, "lookback": 14, "max_dist": 0.055, "max_hold": 7, "regime_ma": 20, "sustain_hi": 2, "sustain_lo": 3}	15	63.915	-20.091	3.181	60.044	67.694	43.810	-16.379	14.717	TRAIN 63.92% <= best 66.97% [cagr] [risk:max_hold=7 select:cagr]
2026-09-20T15:58:33Z	discard	strat_floorhighsustaincond	{"b_hi": 0.57, "b_lo": 0.4, "b_mid": 0.6, "fast_ma": 8, "floor_lb": 19, "lookback": 14, "max_dist": 0.055, "max_hold": 12, "regime_ma": 20, "sustain_hi": 2, "sustain_lo": 3}	15	64.769	-19.885	3.257	57.006	72.528	41.244	-14.374	14.717	TRAIN 64.77% <= best 66.97% [cagr] [risk:max_hold=12 select:cagr]
2026-09-20T15:58:44Z	discard	strat_floorhighsustaincond	{"b_hi": 0.57, "b_lo": 0.4, "b_mid": 0.6, "fast_ma": 8, "floor_lb": 18, "lookback": 13, "max_dist": 0.055, "max_hold": 7, "regime_ma": 20, "sustain_hi": 2, "sustain_lo": 3}	15	63.028	-20.091	3.137	59.648	66.318	43.810	-16.379	14.717	TRAIN 63.03% <= best 66.97% [cagr] [risk:max_hold=7 select:cagr]
2026-09-20T15:58:51Z	discard	strat_floorhighsustaincond	{"b_hi": 0.57, "b_lo": 0.4, "b_mid": 0.6, "fast_ma": 8, "floor_lb": 19, "lookback": 15, "max_dist": 0.055, "max_hold": 7, "regime_ma": 20, "sustain_hi": 3, "sustain_lo": 3}	15	65.935	-20.235	3.259	58.133	73.733	40.815	-14.374	14.717	TRAIN 65.94% <= best 66.97% [cagr] [risk:max_hold=7 select:cagr]
2026-09-20T15:58:58Z	discard	strat_floorhighsustaincond	{"b_hi": 0.57, "b_lo": 0.4, "b_mid": 0.6, "fast_ma": 9, "floor_lb": 19, "lookback": 15, "max_dist": 0.055, "max_hold": 7, "regime_ma": 20, "sustain_hi": 2, "sustain_lo": 3}	15	66.501	-19.688	3.378	59.239	73.733	40.300	-14.374	14.717	TRAIN 66.50% <= best 66.97% [cagr] [risk:max_hold=7 select:cagr]
2026-09-20T15:59:07Z	discard	strat_floorhighsustaincond	{"b_hi": 0.575, "b_lo": 0.4, "b_mid": 0.6, "fast_ma": 8, "floor_lb": 19, "lookback": 15, "max_dist": 0.055, "max_hold": 7, "regime_ma": 20, "sustain_hi": 2, "sustain_lo": 3}	15	65.194	-19.688	3.311	56.688	73.733	40.300	-14.374	14.717	TRAIN 65.19% <= best 66.97% [cagr] [risk:max_hold=7 select:cagr]
2026-09-20T15:59:14Z	discard	strat_floorhighsustaincond	{"b_hi": 0.57, "b_lo": 0.4, "b_mid": 0.6, "fast_ma": 8, "floor_lb": 19, "lookback": 14, "max_dist": 0.055, "max_hold": 7, "regime_ma": 19, "sustain_hi": 2, "sustain_lo": 4}	15	62.703	-19.885	3.153	51.460	74.200	34.893	-18.980	14.717	TRAIN 62.70% <= best 66.97% [cagr] [risk:max_hold=7 select:cagr]
2026-09-20T15:59:23Z	discard	strat_floorhighsustaincond	{"b_hi": 0.57, "b_lo": 0.4, "b_mid": 0.6, "fast_ma": 8, "floor_lb": 18, "lookback": 14, "max_dist": 0.055, "max_hold": 7, "regime_ma": 20, "sustain_hi": 1, "sustain_lo": 3}	15	62.578	-20.091	3.115	58.069	66.997	42.203	-16.379	14.717	TRAIN 62.58% <= best 66.97% [cagr] [risk:max_hold=7 select:cagr]
2026-09-20T15:59:51Z	discard	strat_floorhighsustaincond	{"b_hi": 0.57, "b_lo": 0.4, "b_mid": 0.6, "fast_ma": 8, "floor_lb": 19, "lookback": 11, "max_dist": 0.055, "max_hold": 7, "regime_ma": 20, "sustain_hi": 2, "sustain_lo": 3}	15	66.947	-19.688	3.400	62.116	71.689	40.699	-14.374	14.717	TRAIN 66.95% <= best 66.97% [cagr] [risk:max_hold=7 select:cagr]
2026-09-20T16:00:06Z	discard	strat_floorhighsustaincond	{"b_hi": 0.57, "b_lo": 0.4, "b_mid": 0.6, "fast_ma": 8, "floor_lb": 19, "lookback": 17, "max_dist": 0.055, "max_hold": 7, "regime_ma": 20, "sustain_hi": 2, "sustain_lo": 3}	15	66.063	-19.688	3.356	59.596	72.473	40.300	-14.374	14.717	TRAIN 66.06% <= best 66.97% [cagr] [risk:max_hold=7 select:cagr]
2026-09-20T16:00:18Z	discard	strat_floorhighsustaincond	{"b_hi": 0.57, "b_lo": 0.4, "b_mid": 0.6, "fast_ma": 8, "floor_lb": 19, "lookback": 14, "max_dist": 0.055, "max_hold": 7, "regime_ma": 20, "sustain_hi": 2, "sustain_lo": 5}	15	63.229	-19.885	3.180	54.322	72.201	37.407	-18.980	14.717	TRAIN 63.23% <= best 66.97% [cagr] [risk:max_hold=7 select:cagr]
2026-09-20T16:01:02Z	discard	strat_floorhighsustaincond	{"b_hi": 0.57, "b_lo": 0.4, "b_mid": 0.6, "fast_ma": 8, "floor_lb": 19, "lookback": 12, "max_dist": 0.055, "max_hold": 9, "regime_ma": 20, "sustain_hi": 2, "sustain_lo": 3}	15	65.288	-19.885	3.283	59.246	71.261	42.233	-14.374	14.717	TRAIN 65.29% <= best 66.97% [cagr] [risk:max_hold=9 select:cagr]
2026-09-20T16:01:18Z	discard	strat_floorhighsector	{"b_hi": 0.57, "b_lo": 0.4, "b_mid": 0.6, "fast_ma": 8, "floor_lb": 19, "ind_q": 0.0, "lookback": 12, "max_dist": 0.055, "max_hold": 7, "regime_ma": 20, "sect_lb": 12, "sustain_hi": 2, "sustain_lo": 3}	15	66.721	-19.688	3.389	62.116	71.233	39.752	-14.374	14.717	TRAIN 66.72% <= best 66.97% [cagr] [risk:max_hold=7 select:cagr]
2026-09-20T16:01:28Z	discard	strat_floorhighsustaincond	{"b_hi": 0.57, "b_lo": 0.4, "b_mid": 0.6, "fast_ma": 8, "floor_lb": 18, "lookback": 12, "max_dist": 0.055, "max_hold": 7, "regime_ma": 20, "sustain_hi": 2, "sustain_lo": 3}	15	63.686	-20.091	3.170	61.654	65.648	43.458	-16.379	14.717	TRAIN 63.69% <= best 66.97% [cagr] [risk:max_hold=7 select:cagr]
2026-09-20T16:01:42Z	discard	strat_floorhighsustaincond	{"b_hi": 0.57, "b_lo": 0.4, "b_mid": 0.6, "fast_ma": 8, "floor_lb": 19, "lookback": 12, "max_dist": 0.055, "max_hold": 7, "regime_ma": 20, "sustain_hi": 1, "sustain_lo": 3}	15	66.276	-19.606	3.380	61.562	70.898	39.181	-14.374	14.717	TRAIN 66.28% <= best 66.97% [cagr] [risk:max_hold=7 select:cagr]
2026-09-20T16:02:01Z	discard	strat_floorhighsustaincond	{"b_hi": 0.57, "b_lo": 0.4, "b_mid": 0.6, "fast_ma": 9, "floor_lb": 19, "lookback": 12, "max_dist": 0.055, "max_hold": 7, "regime_ma": 20, "sustain_hi": 2, "sustain_lo": 3}	15	66.643	-19.688	3.385	61.511	71.689	40.632	-14.374	14.717	TRAIN 66.64% <= best 66.97% [cagr] [risk:max_hold=7 select:cagr]
2026-09-20T16:02:19Z	discard	strat_floorhighsustaincond	{"b_hi": 0.57, "b_lo": 0.4, "b_mid": 0.6, "fast_ma": 8, "floor_lb": 19, "lookback": 11, "max_dist": 0.055, "max_hold": 7, "regime_ma": 20, "sustain_hi": 1, "sustain_lo": 3}	15	66.238	-19.606	3.378	61.488	70.898	39.126	-14.374	14.717	TRAIN 66.24% <= best 66.97% [cagr] [risk:max_hold=7 select:cagr]
2026-09-20T16:02:42Z	discard	strat_floorhighsustaincond	{"b_hi": 0.57, "b_lo": 0.4, "b_mid": 0.55, "fast_ma": 8, "floor_lb": 19, "lookback": 12, "max_dist": 0.055, "max_hold": 7, "regime_ma": 20, "sustain_hi": 2, "sustain_lo": 3}	15	65.660	-19.688	3.335	59.565	71.689	41.422	-14.374	14.717	TRAIN 65.66% <= best 66.97% [cagr] [risk:max_hold=7 select:cagr]
2026-09-20T16:02:54Z	discard	strat_floorhighsustaincond	{"b_hi": 0.57, "b_lo": 0.4, "b_mid": 0.6, "fast_ma": 8, "floor_lb": 19, "lookback": 12, "max_dist": 0.055, "max_hold": 7, "regime_ma": 19, "sustain_hi": 2, "sustain_lo": 3}	15	65.335	-19.688	3.319	58.924	71.689	39.543	-14.374	14.717	TRAIN 65.33% <= best 66.97% [cagr] [risk:max_hold=7 select:cagr]
