ts	status	candidate	params	top	train_cagr	train_dd	ret_dd	h1	h2	fwd_cagr	fwd_dd	fwd_bench	note
2026-09-21T18:11:24Z	discard	strat_l19a_balanced	{"b_hi": 0.69, "b_lo": 0.45, "b_mid": 0.55, "cap_full": 20, "cap_weak": 11, "fast_ma": 5, "floor_lb": 19, "gf_lb": 12, "gf_w": 0.0, "gw_w": 0.15, "ids_lb": 3, "ids_w": -0.13, "la_min": 0, "la_w": 0.5, "lookback": 12, "max_dist": 0.055, "max_hold": 3, "or_lb": 6, "or_w": -0.1, "regime_ma": 18, "sustain_hi": 2, "sustain_lo": 3, "tier_lo": 0.9999, "tier_mid": 0.9999}	15	38.981	-23.870	1.633	37.323	40.580	21.678	-31.368	19.528	DD -23.9% breaches floor/slack [risk:max_hold=3 select:cagr minyr=-9.9 ystd=69.5]
2026-09-23T09:18:59Z	discard	strat_l20b_spread	{"b_hi": 0.69, "b_lo": 0.45, "b_mid": 0.55, "cap_full": 20, "cap_weak": 11, "fast_ma": 5, "floor_lb": 19, "gf_lb": 12, "gf_w": 0.0, "gw_w": 0.15, "ids_lb": 3, "ids_w": -0.13, "la_min": 0, "la_w": 0.5, "lookback": 12, "max_dist": 0.055, "max_hold": 3, "or_lb": 6, "or_w": -0.1, "regime_ma": 18, "sp_frac": 0.5, "sp_lb": 4, "sp_w": -0.05, "sustain_hi": 2, "sustain_lo": 3, "tier_lo": 0.9999, "tier_mid": 0.9999}	15	36.622	-23.870	1.534	33.888	39.281	17.975	-31.368	19.528	TRAIN 36.62% <= best 36.60% [cagr] [risk:max_hold=3 select:cagr minyr=-10.6 ystd=64.7]
2026-09-24T09:43:42Z	discard	strat_l21b_spreadz	{"b_hi": 0.69, "b_lo": 0.45, "b_mid": 0.55, "cap_full": 20, "cap_weak": 11, "fast_ma": 5, "floor_lb": 19, "gf_lb": 12, "gf_w": 0.0, "gw_w": 0.15, "ids_lb": 3, "ids_w": -0.13, "la_min": 0, "la_w": 0.5, "lookback": 12, "max_dist": 0.055, "max_hold": 3, "or_lb": 6, "or_w": -0.1, "regime_ma": 18, "sp_frac": 0.5, "sp_lb": 4, "sp_w": -0.05, "sustain_hi": 2, "sustain_lo": 3, "sz_frac": 0.5, "sz_lb": 24, "sz_mode": "z", "sz_w": -0.05, "tier_lo": 0.9999, "tier_mid": 0.9999}	15	37.294	-23.870	1.562	34.758	39.756	19.837	-31.368	19.528	DD -23.9% breaches floor/slack [risk:max_hold=3 select:cagr minyr=-10.6 ystd=65.9]
